date_est,year_month,year,month,day,year_month,yy_mm,yy_mmm,PM,haircut,walking,golf,massage,interview,air_force_one,date,activities
10/1/2021,202110,2021,10,1,202110,2021-10,2021-Oct,,,,,,,,,
10/2/2021,202110,2021,10,2,202110,2021-10,2021-Oct,,,,,,,,,
10/3/2021,202110,2021,10,3,202110,2021-10,2021-Oct,,,,,,,,,
10/4/2021,202110,2021,10,4,202110,2021-10,2021-Oct,Fumio_Kishida,No,No,No,No,No,No,10жњ4ж—Ґ,в–Ѕ14ж™2е€иЎ™ўгЃ®ж­Је‰Їи­°й•·гЂЃи­°йЃ‹е§”е“Ўй•·гЂЃдёЋй‡же…љеђ„дјљжґѕгЃ«гЃ‚гЃ„гЃ•гЃ¤е›ћг‚ЉгЂ‚з”е€©е№№дє‹й•·гЂЃжЈ®е±±е›ЅеЇѕе§”е“Ўй•·еђЊиЎЊг24е€еЏ‚й™ўгЃ®ж­Је‰Їи­°й•·гЂЃи­°йЃ‹е§”е“Ўй•·гЂЃдёЋй‡же…љеђ„дјљжґѕгЃ«гЃ‚гЃ„гЃ•гЃ¤е›ћг‚ЉгЂ‚дё–и•еЏ‚й™ўе№№дє‹й•·еђЊиЎЊг50е€е®й‚ёгЂ‚в–Ѕ15ж™29е€е±±еЏЈй‚ЈжґҐз”·е…¬жЋе…љд»ЈиЎЁгЃЁдёЋе…ље…љй¦–дјљи«‚жќѕй‡Ће®ж€їй•·е®гЃз”е€©е№№дє‹й•·гЂЃзџідє•е•“дёе…¬жЋе…ље№№дє‹й•·еђЊеё­гЂ40е€зµ–Јжњ¬йѓЁиЁ­зЅ®гЂ48е€ж–°й–Јеѓљг®е‘јгЃіиѕјгЃїгЂ‚в–Ѕ17ж™44е€зљ‡е±…г‚ееҐЏг¦–з›ёи¦Єд»»ејЏг–ЈеѓљиЄЌиЁјејЏг‚в–Ѕ20ж™36е€е®й‚ёгЂ‚в–Ѕ21ж™1е€иЁи…дјљи¦‹г‚в–Ѕ22ж™3е€еђ–ЈеѓљгЃ«иЈњи·иѕћд»¤дє¤д»г20е€е€ќй–Ји­°гЂ44е€й–ЈеѓљгЃЁиЁеїµж’®еЅ±гЂ48е€е†…й–Јжі•е€¶е±й•·е®г‚‰гЃ«иѕћд»¤дє¤д»г‚в–Ѕ23ж™34е€жќ±дє¬гѓ»иµ¤еќ‚г®иЎ™ўи­°е“Ўе®їи€ЋгNikkei Inc. No reproduction without permission.
10/5/2021,202110,2021,10,5,202110,2021-10,2021-Oct,Fumio_Kishida,No,No,No,No,YES!,No,10жњ5ж—Ґ,в–Ѕ7ж™27е€жќ±дє¬гѓ»иµ¤еќ‚г®иЎ™ўи­°е“Ўе®їи€Ћз™єгЂ31е€е®й‚ёгЂ‚в–Ѕ8ж™15е€гѓђг‚¤гѓѓіз±іе¤§зµ±й гЃЁй›»и©±гЂ‚в–Ѕ9ж™2е€е ±йЃ“еђ„з¤ѕгЃ®г‚¤гѓіг‚їгѓ“гѓҐгѓјгЂ30е€йЈЇеі¶гЂЃд»Љдє•гЃзи°·гЂЃе®®е®¶гЂЃжќ‘дє•гЃеІЎжќ‘гЃе±±еґЋеђ„еЏ‚дёЋгЃ«иѕћд»¤дє¤д»г‚в–Ѕ10ж™3е€й–Ји­°гЂ11е€иЊ‚жњЁе¤–з›ёгЂ‚в–Ѕ11ж™‚гг‚Єгѓјг‚№гѓ€гѓ©гѓЄг‚ўгЃ®гѓўгѓЄг‚Ѕгѓій¦–з›ёгЃЁгѓѓ¬гѓ“дјљи­°гЂ23е€дё­жњ¬йљї—е…љеєі¶зњЊйЈдјљй•·д»Јзђ46е€еЌЃе‰й›…е’ЊзµЊе›ЈйЂЈдјљй•·гЂ‚в–Ѕ13ж™54е€жІ–з”°е†…й–ЈеЌ±ж©џз®Ўзђ›ЈгЂЃз§‹и‘‰е›Ѕе®¶е®‰е…Ёдїќйљње±й•·гЂ«ж©‹е®ж€їе‰Їй•·е®иЈњг‚в–Ѕ16ж™‚гж»ќжІўе†…й–Јжѓ…е±е®г58е€иІЎе‹™зњЃгЃ®зџўй‡Ћж¬Ўе®гЃж–°е·ќе®ж€їй•·гЂЃиЊ¶и°·дё»иЁ€е±й•·гЂ‚в–Ѕ17ж™‚ги—¤дє•е®ж€їе‰Їй•·е®иЈњгЃиї«дє•ж–°ећ‹г‚ігѓ­гѓЉг‚¦г‚¤гѓ«г‚№ж„џжџ“з—‡еЇѕз­–жЋЁйЂІе®¤й•·гЂЃеЋљеЉґзњЃг®еђ‰з”°ж¬Ўе®гЃз¦Џеі¶еЊ»е‹™жЉЂз›ЈгЂ‚в–Ѕ18ж™25е€е…љжњ¬йѓЁгЂ30е€жҐзЂ¬иЂ•дЅњй«зџҐзњЊй€еґЋеё‚й•·гЂ36е€й‡‘з”°е‹ќе№ґе…і•з›ёгЂ39е€е·¦и—¤з«гЂЃе›Ѕе ґе№ёд№‹еЉ©дёЎиЎ™ўи­°е“ЎгЂ48е€жІій‡Ћеє±жњ¬йѓЁй•·гЂ‚в–Ѕ19ж™37е€жќ±дє¬гѓ»иµ¤еќ‚г®иЎ™ўи­°е“Ўе®їи€Ћг‚В
10/6/2021,202110,2021,10,6,202110,2021-10,2021-Oct,Fumio_Kishida,No,No,No,No,YES!,No,10жњ6ж—Ґ,в–Ѕ9ж™8е€жќ±дє¬гѓ»иµ¤еќ‚г®иЎ™ўи­°е“Ўе®їи€Ћз™єгЂ22е€жќ±дє¬гѓ»дё‰з•Єз”єгЃ®е®®е†…еєЃееєЃигЂ‚е°±д»»гЃ®иЁеёігЂ39е€жќ±дє¬гѓ»е…µ¤еќ‚г®иµ¤еќ‚еѕЎз”Ёењ°гЂ‚дё‰з¬е®®жќ±й‚ёгЂЃдё‰з¬е®®й‚ёгЂ«ее®®й‚ёгЃ§е°±д»»гЃ®иЁеёігЂ‚в–Ѕ10ж™10е€жќ±дє¬гѓ»жќ±гЃ®еёёй™ёе®®й‚ёгЂ‚е°±д»»гЃ®иЁеёігЂ27е€е®й‚ёгЂ28е€е ±йЃ“еђ„з¤ѕгЃ®г‚¤гѓіг‚їгѓ“гѓҐгѓјгЂ32е€е°ѕеґЋй§ђгѓЄгѓ€г‚ўгѓ‹г‚ўе¤§дЅїгЂЃжµ…е€©й§ђг‚¦гѓ«г‚°г‚ўг‚¤е¤§дЅїгЂЃдё­еЋџй§ђггѓіг‚ёгѓҐгѓ©г‚№е¤§дЅїг‚‰г®ж–°д»»гЃ‚гЃ„гЃ•гЃ¤гЂ49е€з”е€©е№№дє‹й•·гЂ‚в–Ѕ11ж™20е€йЃи—¤йЃёеЇѕе§”е“Ўй•·гЂ‚в–Ѕ14ж™2е€и‡Ёж™‚й–Ји­°гЂ10е€иЊ‚жњЁе¤–з›ёгЂ‚в–Ѕ15ж™24е€зљ‡е±…г‚ееҐЏгЃе‰Їе¤§и‡ЈиЄЌиЁјејЏг‚в–Ѕ17ж™47е€е®й‚ёгЂ‚в–Ѕ18ж™18е€е‰Їе¤§и‡ЈгЃЁиЁеїµж’®еЅ±гЂ28е€е‰Їе¤§и‡Јдјљи­°гЂ‚в–Ѕ19ж™13е€ж”їе‹™е®гЃ«иѕћд»¤дє¤д»г32е€ж”їе‹™е®гЃЁиЁеїµж’®еЅ±гЂ38е€ж”їе‹™е®дјљеђ€гЂ‚в–Ѕ20ж™8е€жќ±дє¬гѓ»иµ¤еќ‚г®иЎ™ўи­°е“Ўе®їи€Ћг‚В
10/7/2021,202110,2021,10,7,202110,2021-10,2021-Oct,Fumio_Kishida,No,No,No,No,YES!,No,10жњ7ж—Ґ,в–Ѕ8ж™21е€жќ±дє¬гѓ»иµ¤еќ‚г®иЎ™ўи­°е“Ўе®їи€Ћз™єгЂ24е€е®й‚ёгЂ‚в–Ѕ9ж™‚гй«её‚ж”їиЄїдјљй•·гЂЃеЏ¤е±‹ењ­еЏёиЎ™ўи­°е“ЎгЂ35е€йЃи—¤йЃёеЇѕе§”е“Ўй•·гЂ‚в–Ѕ10ж™2е€и‡Ёж™‚й–Ји­°гЂ23е€еѕЊи—¤еЋљеЉґз›ёгЂЃиђ©з”џз”°зµЊз”Јз›ёгЂЃжќѕй‡Ће®ж€їй•·е®гЃе±±йљ›зµЊиІЎз›ёгЂ52е€јЄјІжќ±дє¬й§…г‚в–Ѕ12ж™2е€гЃІгЃ‹г‚Љ509еЏ·гЃ§јЄјІйќ™еІЎй§…г‚й§…е‰ЌгЃ§иЎ—й­жј”иЄ¬гЂ50е€йќ™еІЎеё‚жё…ж°ґеЊєгЃ®з«њиЏЇеЇєгЂ‚и‡Єж°‘е…љеІёз”°жґѕдє‹е‹™з·Џй•·г‚’е‹™г‚ЃгЃџж•…жњ›жњ€зѕ©е¤«е…’°еў›ёгЃ®еў“еЏ‚г‚Љг‚дёЉе·ќй™Ѕе­ђгЃеђ‰е·ќиµідёЎиЎ™ўи­°е“ЎеђЊиЎЊг56е€е ±йЃ“еђ„з¤ѕгЃ®г‚¤гѓіг‚їгѓ“гѓҐгѓјгЂ‚в–Ѕ13ж™27е€јЄјІйќ™еІЎй§…г28е€дёЉе·ќгЃеђ‰е·ќдёЎиЎ™ўи­°е“ЎгЂ‚в–Ѕ14ж™42е€гЃІгЃ‹г‚Љ506еЏ·гЃ§јЄјІжќ±дє¬й§…г54е€е®й‚ёгЂ‚в–Ѕ15ж™29е€ж–°иЃћг»йЂљдїЎеђ¤ѕгЃ®и«–иЄ¬е§”е“Ўг‚‰гЃЁж‡‡и«59е€ењЁдє¬ж°‘ж”ѕеђ¤ѕгЃ®и§ЈиЄ¬е§”е“Ўг‚‰гЃЁж‡‡и«‚в–Ѕ16ж™27е€е†…й–ЈиЁи…дјљеЉ з›џе±йЃ“еђ„з¤ѕгЃ®г‚­гѓЈгѓгЃЁж‡‡и«‚в–Ѕ17ж™‚гж №жњ¬еЊиЎ™ўи­°е“ЎгЂ31е€гѓ­г‚·г‚ўгЃ®гѓ—гјгѓЃгѓіе¤§зµ±й гЃЁй›»и©±гЂ‚в–Ѕ18ж™1е€е№ідє•дјёжІ»е…Ёе›ЅзџҐдє‹дјљй•·гЂЃж№ЇеґЋи‹±еЅ¦еєі¶зњЊзџҐдє‹г®иЎЁж•¬гЂ12е€зµЊиІЎз›ёгЂЃи—¤дє•е®ж€їе‰Їй•·е®иЈњгЃз”°е’Њей–Јеєњж¬Ўе®г‚в–Ѕ19ж™6е€е ±йЃ“еђ„з¤ѕгЃ®г‚¤гѓіг‚їгѓ“гѓҐгѓјгЂ13е€е…љжњ¬йѓЁгЂ14е€з”е€©е№№дє‹й•·гЂ58е€жќ±дє¬гѓ»иµ¤еќ‚г®иЎ™ўи­°е“Ўе®їи€Ћг‚в–Ѕ23ж™16е€е®й‚ёгЂ17е€е ±йЃ“еђ„з¤ѕгЃ®г‚¤гѓіг‚їгѓ“гѓҐгѓјгЂ‚В
10/8/2021,202110,2021,10,8,202110,2021-10,2021-Oct,Fumio_Kishida,No,No,No,No,YES!,No,10жњ8ж—Ґ,в–Ѕ0ж™45е€дєЊд№‹ж№ЇйІзЃЅз›ёгЂЃжњЁеЋџгЃзЈЇеґЋгЃж—з”џеђ®ж€їе‰Їй•·е®гЃжІ–з”°е†…й–ЈеЌ±ж©џз®Ўзђ›ЈгЂЃж¦Љей–Јеєњж”їз­–зµ±ж‹¬е®г‚в–Ѕ1ж™25е€е ±йЃ“еђ„з¤ѕгЃ®г‚¤гѓіг‚їгѓ“гѓҐгѓјгЂ33е€жќ±дє¬гѓ»иµ¤еќ‚г®иЎ™ўи­°е“Ўе®їи€Ћг‚в–Ѕ8ж™28е€е®й‚ёгЂ29е€е†…й–ЈеЌ±ж©џз®Ўзђ›ЈгЂЃж¦Љей–Јеєњж”їз­–зµ±ж‹¬е®г52е€й–Ји­°гЂ‚в–Ѕ9ж™10е€жќ‘дє•и‹±жЁ№иЎ™ўи­°е“ЎгЃ«й¦–з›ёиЈњдЅђе®г®иѕћд»¤дє¤д»г‚иЁеїµж’®еЅ±гЂ37е€жќ±дє¬гѓ»е…µ¤еќ‚г®иµ¤еќ‚еѕЎз”Ёењ°гЂ‚з§‹зЇе®®й‚ёгЃ§е°±д»»гЃ®иЁеёігЂ48е€е®й‚ёгЂ‚в–Ѕ10ж™11е€гѓЋгјгѓ™гѓ«з‰©зђ­¦иіћгЃ«ж±єгЃѕгЃЈгЃџзњџйЌ‹ж·‘йѓЋз±ігѓ—гѓЄгѓіг‚№гѓ€гѓіе¤§дёЉеё­з ”з©¶е“ЎгЃЁг‚Єгѓігѓ©г‚¤гѓійќўдјљг‚в–Ѕ11ж™29е€ж¬Ўе®йЈзµЎдјљи­°гЃ«е‡єеё­гЃ—гЃгЃ‚гЃЃ•гЃ¤гЂ56е€е›Ѕдјљг‚в–Ѕ12ж™2е€иЎ™ўжњ¬дјљи­°гЂ15е€е®й‚ёгЂ38е€е›Ѕдјљг‚в–Ѕ13ж™1е€з¬¬205и‡Ёж™‚е›Ѕдјљй–‹дјљејЏг11е€е®й‚ёгЂ53е€е›Ѕдјљг‚в–Ѕ14ж™2е€иЎ™ўжњ¬дјљи­°гЂ‚ж‰ЂдїЎиЎЁжЋжј”иЄ¬гЂ‚в–Ѕ15ж™1е€еЏ‚й™ўжњ¬дјљи­°гЂ‚ж‰ЂдїЎиЎЁжЋжј”иЄ¬гЂ33е€е®й‚ёгЂ44е€иѕІж°ґзњЃг®жћќе…ѓж¬Ўе®гЃе№іеЅўиѕІз”Је±й•·гЂ‚в–Ѕ16ж™30е€дё­е›ЅгЃ®зї’иї‘е№іе›Ѕе®¶дё»её­гЃЁй›»и©±гЂ‚в–Ѕ17ж™15е€г‚¤гѓігѓ‰г®гѓўгѓ‚Јй¦–з›ёгЃЁй›»и©±гЂ54е€е°Џж±з™ѕеђ€е­ђжќ±дє¬йѓЅзџҐдє‹г‚йЃ и—¤е€©жЋиЎ™ўи­°е“ЎеђЊеё­гЂ‚в–Ѕ18ж™50е€жќѕдє•дёе®џеєі¶её‚й•·гЂ‚дЅђг…жњЁеЇїеђ‰еђЊеё‚и­°дјљи­°й•·еђЊеё­гЂ‚в–Ѕ19ж™6е€зџіе·ќж‹‰и‡ґе•ЏйЎЊеЇѕз­–жњ¬йѓЁдє‹е‹™е±й•·гЂ56е€е ±йЃ“еђ„з¤ѕгЃ®г‚¤гѓіг‚їгѓ“гѓҐгѓјгЂ‚в–Ѕ20ж™9е€жќ±дє¬гѓ»иµ¤еќ‚г®иЎ™ўи­°е“Ўе®їи€Ћг‚В
10/9/2021,202110,2021,10,9,202110,2021-10,2021-Oct,Fumio_Kishida,No,No,No,No,YES!,No,10жњ9ж—Ґ,в–Ѕ9ж™6е€жќ±дє¬гѓ»иµ¤еќ‚г®иЎ™ўи­°е“Ўе®їи€Ћз™єгЂ24е€жќ±дє¬гѓ»ж±џжќ±ж©‹г®йѓЅз«‹еўЁжќ±з—…й™ўгЂ‚ж–°ећ‹г‚ігѓ­гѓЉг‚¦г‚¤гѓ«г‚№ж„џжџ“з—‡ж‚ЈиЂ…еђ‘гЃ‘г®з—…еєЉг‚’и¦–еЇџг59е€з—…й™ўй–ўдї‚и…гЃЁи»Љеє§гЃ§ж„Џи¦‹дє¤жЏ›г‚в–Ѕ10ж™32е€е ±йЃ“еђ„з¤ѕгЃ®г‚¤гѓіг‚їгѓ“гѓҐгѓјгЂ‚в–Ѕ11ж™7е€зѕЅз”°з©єжёЇгЂ10е€д»Ѓеќ‚еђ‰дјёе’Њж­Ње±±зњЊзџҐдє‹г‚в–Ѕ13ж™‚ге…Ёж—Ґз©є23дѕїгЃ§е¤§йЄз©єжёЇгЂ32е€е¤§йЄеё‚дё­е¤®еЊєгЃ®зњџе®—е¤§и°·жґѕй›Јжіўе€Ґй™ўгЂ‚ж•…е·¦и—¤жЃµе…і•з›ёгЃ®е¤§и°·е­¦ењ’г»и‡Єж°‘е…љеђ€еђЊи‘¬гЃ«еЏ‚егЃ—гЃеј”иѕћг‚в–Ѕ15ж™8е€е¤§йЄз©єжёЇгЂ‚в–Ѕ16ж™55е€е…Ёж—Ґз©є32дѕїгЃ§зѕЅз”°з©єжёЇгЂ‚в–Ѕ17ж™36е€е…¬й‚ёгЂ‚в–Ѕ19ж™5е€жќ±дє¬гѓ»иµ¤еќ‚г®иЎ™ўи­°е“Ўе®їи€Ћг‚В
10/10/2021,202110,2021,10,10,202110,2021-10,2021-Oct,Fumio_Kishida,No,No,No,No,No,No,,
10/11/2021,202110,2021,10,11,202110,2021-10,2021-Oct,Fumio_Kishida,No,No,No,No,YES!,No,10жњ10ж—Ґгѓ»11ж—Ґ,гЂ10ж—ҐгЂ‰в–Ѕ6ж™55е€жќ±дє¬гѓ»иµ¤еќ‚г®иЎ™ўи­°е“Ўе®їи€Ћз™єгЂ‚в–Ѕ7ж™8е€жќ±дє¬гѓ»еЏ°е ґгЃ®гѓ•г‚ёгѓѓ¬гѓ“г30е€е ±йЃ“з•ЄзµЃ«е‡єжј”г‚в–Ѕ9ж™9е€жЁЄжµњеё‚жёЇеЊ—еЊєгЃ®гѓ›гѓ†гѓ«гЂЊжќ±жЁЄг‚¤гѓіж–°жЁЄжµњй§…е‰Ќж–°й¤ЁгЂЌг‚ж–°ећ‹г‚ігѓ­гѓЉг‚¦г‚¤гѓ«г‚№ж„џжџ“иЂ…г®е®їжіЉз™‚й¤Љж–ЅиЁ­г‚’и¦–еЇџг‚й»’еІ©зҐђжІ»зҐћеҐ€е·ќзњЊзџҐдє‹гЃж‰‹д»ЈжњЁеЉџеЎ©й‡Ћзѕ©иЈЅи–¬з¤ѕй•·еђЊиЎЊг‚в–Ѕ10ж™5е€е ±йЃ“еђ„з¤ѕгЃ®г‚¤гѓіг‚їгѓ“гѓҐгѓјгЂ‚в–Ѕ11ж™1е€е…¬й‚ёгЂ‚в–Ѕ12ж™14е€жќ±дє¬гѓ»жќ±ж–°ж©‹г®и¤‡еђ€ж–ЅиЁ­гЂЊг‚«гѓ¬гѓ‚їж±ђз•™гЂЌг‚гЊг‚«гѓ¬гѓ‚їг‚№г‚їг‚ёг‚ЄгЂЌгЃ§иЎ™ўйЃёгЃ®ж”їи¦‹ж”ѕйЂЃеЏЋйЊІгЂ‚в–Ѕ14ж™46е€е…љжњ¬йѓЁгЂ‚в–Ѕ15ж™8е€з”е€©е№№дє‹й•·гЂЃ и—¤йЃёеЇѕе§”е“Ўй•·гЂ‚в–Ѕ16ж™31е€йЃёеЇѕе§”е“Ўй•·гЂ‚в–Ѕ17ж™28е€е ±йЃ“еђ„з¤ѕгЃ®г‚¤гѓіг‚їгѓ“гѓҐгѓјгЂ33е€иЎ™ўз¬¬1и­°е“Ўдјљй¤ЁгЂ43е€жќ±дє¬гѓ»иµ¤еќ‚г®иЎ™ўи­°е“Ўе®їи€Ћг‚г11ж—ҐгЂ‰в–Ѕ9ж™24е€иЎ™ўи­°е“Ўе®їи€Ћз™єгЂ28е€е®й‚ёгЂ33е€жњЁеЋџе®ж€їе‰Їй•·е®г‚в–Ѕ12ж™53е€е›Ѕдјљг‚в–Ѕ13ж™2е€иЎ™ўжњ¬дјљи­°гЂ‚в–Ѕ15ж™47е€е®й‚ёгЂ‚в–Ѕ16ж™26е€е…љжњ¬йѓЁгЂ30е€йЃёжЊ™еЇѕз­–жњ¬йѓЁдјљи­°гЂ‚в–Ѕ17ж™‚ге®й‚ёгЂ4е€дё‰жќ‘жЋе¤«ж—Ґжњ¬е•·Ґдјљи­°ж‰дјљй­г‚‰г‚в–Ѕ18ж™‚ге…Ёе›Ѕеё‚й•·дјљй•·гЃ®з«‹и°·з§жё…з¦Џеі¶зњЊз›ёй¦¬её‚й•·г‚‰г56е€ж №жњ¬еЊиЎ™ўи­°е“ЎгЂ‚в–Ѕ19ж™21е€жќ±дє¬гѓ»иµ¤еќ‚г®иЎ™ўи­°е“Ўе®їи€Ћг‚в–Ѕ21ж™37е€жќ±дє¬гѓ»е…­жњ¬жњЁгЃ®гѓѓ¬гѓ“жќ±дє¬гЂ‚в–Ѕ22ж™‚ге ±йЃ“з•ЄзµЃ«е‡єжј”г42е€жќ±дє¬гѓ»иµ¤еќ‚г®иЎ™ўи­°е“Ўе®їи€Ћг‚В
10/12/2021,202110,2021,10,12,202110,2021-10,2021-Oct,Fumio_Kishida,No,No,No,No,YES!,No,10жњ12ж—Ґ,в–Ѕ7ж™31е€жќ±дє¬гѓ»иµ¤еќ‚г®иЎ™ўи­°е“Ўе®їи€Ћз™єгЂ35е€е®й‚ёгЂ40е€зЈЇеґЋе®ж€їе‰Їй•·е®г‚в–Ѕ8ж™49е€жњЁеЋџе®ж€їе‰Їй•·е®г‚в–Ѕ9ж™2е€й–Ји­°гЂ20е€жњЁеЋџе‰Їй•·е®г54е€е›Ѕдјљг58е€иЊ‚жњЁе¤–з›ёгЂ‚в–Ѕ10ж™1е€еЏ‚й™ўжњ¬дјљи­°гЂ‚в–Ѕ11ж™49е€е®й‚ёгЂ‚в–Ѕ13ж™1е€е®®жІўжґ‹дёеЏ‚й™ўи­°е“ЎгЂ52е€е›Ѕдјљг‚в–Ѕ14ж™2е€иЎ™ўжњ¬дјљи­°гЂ‚в–Ѕ16ж™24е€е®й‚ёгЂ35е€е…Ёе›ЅиѕІжҐ­еЌ”еђЊзµђ€дё­е¤®дјљпј€пјЄјЎе…Ёдё­ј‰г®дё­е®¶еѕ№дјљй•·г‚‰г‚в–Ѕ17ж™‚гз™Ѕж №й›…е­ђж—Ґжњ¬зњјз§‘еЊ»дјљдјљй•·гЂ10е€е›Ѕдє•ж­Је№ёе…Ёе›ЅиѕІжҐ­дјљи­°ж‰дјљй•·г‚‰г27е€жЈ®зѕ©д№…е…Ёе›Ѕе•·ҐдјљйЈеђ€дјљдјљй•·г‚‰г‚в–Ѕ19ж™14е€жќ±дє¬гѓ»жќ±зџўеЏЈгЃ®дёи€¬з¤ѕе›Јжі•дєєгЂЊгЃЁг‚‚гЃ—гЃіЅЅ”гЃ г‚“гЃ г‚“гЌг15е€е­ђгЃ©г‚‚йЈџе‚г‚’и¦–еЇџг‚е›°й›Јг‚’жЉ±гЃ€г‚‹дєєг‚’ж”ЇжЏґгЃ™г‚‹е›ЈдЅ“й–ўдї‚и…г‚‰гЃЁи»Љеє§гЃ§ж„Џи¦‹дє¤жЏ›г‚й‡жз”°е°‘е­ђеЊ–з›ёеђЊеё­гЂ52е€е ±йЃ“еђ„з¤ѕгЃ®г‚¤гѓіг‚їгѓ“гѓҐгѓјгЂ‚в–Ѕ20ж™26е€е®й‚ёгЂ44е€г‚ўгѓ•г‚¬гѓ‹г‚№г‚їгѓігЃ«й–ўгЃ™г‚‹20г‚«е›Ѕгѓ»ењ°еџџпј€пј§20ј‰й¦–и„ігѓѓ¬гѓ“й›»и©±дјљи­°гЂ‚в–Ѕ21ж™25е€жќ±дє¬гѓ»е…­жњ¬жњЁгЃ®гѓѓ¬гѓ“жњќж—ҐгЂ58е€е ±йЃ“з•ЄзµЃ«е‡єжј”г‚в–Ѕ22ж™46е€жќ±дє¬гѓ»иµ¤еќ‚г®иЎ™ўи­°е“Ўе®їи€Ћг‚В
10/13/2021,202110,2021,10,13,202110,2021-10,2021-Oct,Fumio_Kishida,No,No,No,No,No,No,10жњ13ж—Ґ,в–Ѕ6ж™59е€жќ±дє¬гѓ»иµ¤еќ‚г®иЎ™ўи­°е“Ўе®їи€Ћз™єгЂ‚в–Ѕ7ж™2е€е®й‚ёгЂ5е€зЈЇеґЋе®ж€їе‰Їй•·е®г‚в–Ѕ9ж™54е€е›Ѕдјљг‚в–Ѕ10ж™1е€еЏ‚й™ўжњ¬дјљи­°гЂ‚в–Ѕ11ж™41е€е®й‚ёгЂ46е€зЈЇеґЋе‰Їй•·е®г‚в–Ѕ12ж™54е€е›Ѕдјљг‚в–Ѕ13ж™1е€еЏ‚й™ўжњ¬дјљи­°гЂ‚в–Ѕ15ж™53е€е®й‚ёгЂ‚в–Ѕ16ж™28е€е…љжњ¬йѓЁгЂ30е€е…ље…Ёе›Ѕе№№дє‹й•·дјљи­°гЃ«е‡єеё­гЃ—гЃгЃ‚гЃЃ•гЃ¤гЂ52е€е®й‚ёгЂ‚в–Ѕ17ж™44е€е›Ѕе®¶е®‰е…Ёдїќйљњдјљи­°гЂ‚в–Ѕ18ж™35е€г‚ёгѓ§гѓіг‚Ѕгѓіи‹±й¦–з›ёгЃЁй›»и©±гЂ‚в–Ѕ19ж™6е€йІиЎ›зњЃгЃ®еі¶з”°ж¬Ўе®гЃе±±еґЋзµ±еђ€е№•ей•·гЂЃеђ‰з”°й™ёдёЉе№•ей•·гЂЃе±±жќ‘жµ·дёЉе№•ей•·гЂЃдє•з­’и€Єз©єе№•ей•·гЂ27е€ж №жњ¬еЊе…ЋљеЉґз›ёгЂ‚в–Ѕ21ж™7е€жќ±дє¬гѓ»иµ¤еќ‚г®иЎ™ўи­°е“Ўе®їи€Ћг‚В
10/14/2021,202110,2021,10,14,202110,2021-10,2021-Oct,Fumio_Kishida,No,No,No,No,YES!,No,10жњ14ж—Ґ,в–Ѕ7ж™26е€жќ±дє¬гѓ»иµ¤еќ‚г®иЎ™ўи­°е“Ўе®їи€Ћз™єгЂ30е€е®й‚ёгЂ31е€е ±йЃ“еђ„з¤ѕгЃ®г‚¤гѓіг‚їгѓ“гѓҐгѓјгЂ34е€и—¤дє•е®ж€їе‰Їй•·е®иЈњгЃиї«дє•ж–°ећ‹г‚ігѓ­гѓЉг‚¦г‚¤гѓ«г‚№ж„џжџ“з—‡еЇѕз­–жЋЁйЂІе®¤й•·гЂЃеЋљеЉґзњЃг®еђ‰з”°ж¬Ўе®гЃз¦Џеі¶еЊ»е‹™жЉЂз›ЈгЂ‚в–Ѕ8ж™11е€ж–°е·ќж°—е™е¤‰е‹•еЇѕз­–жЋЁйЂІе®¤й•·гЂЃе°Џй‡же¤–е‹™зњЃењ°зђ¦ЏжЁЎиЄІйЎЊеЇ©и­°е®гЃеҐ€й€й‡жзµЊз”ЈзњЃз”ЈжҐ­жЉиЎ“з’°еў±й•·гЂЃдїќеќ‚иі‡жєђг‚ЁгѓЌгѓ«г‚®гѓјеє•·е®гЃз’°еўњЃгЃ®дё­дє•ж¬Ўе®гЃе°Џй‡жењ°зђ’°еў±й•·гЂ22е€иђ©з”џз”°зµЊз”Јз›ёгЂЃе¤љз”°зµЊз”Јж¬Ўе®гЃиі‡жєђг‚ЁгѓЌгѓ«г‚®гѓјеєЃг®й•·е®гЃжќѕж°ёе‡¦зђ°ґжђЌе®іеЇѕеїњж”ЇжЏґе®¤й•·гЂ43е€е¤–е‹™зњЃг®жЈ®ж¬Ўе®гЃи€№и¶Љг‚ўг‚ёг‚ўе¤§жґ‹е·ће±й•·гЂ‚в–Ѕ9ж™2е€и‡Ёж™‚й–Ји­°гЂ19е€иЊ‚жњЁе¤–з›ёгЂ27е€е°ѕиє«иЊ‚ж–°ећ‹г‚ігѓ­гѓЉг‚¦г‚¤гѓ«г‚№ж„џжџ“з—‡еЇѕз­–ез§‘дјљй•·гЂ‚в–Ѕ11ж™47е€и‹±зґ™гѓ•г‚ЈгѓЉгѓіг‚·гѓЈгѓ«гѓ»г‚їг‚¤гѓг‚єгЃ®г‚¤гѓіг‚їгѓ“гѓҐгѓјгЂ‚в–Ѕ12ж™55е€е›Ѕдјљг‚в–Ѕ13ж™2е€иЎ™ўжњ¬дјљи­°гЂ5е€иЎ™ўгЃ®е¤§еі¶гЂЃиµ¤жќѕе‰Ќж­Је‰Їи­°й•·гЂ«жњЁе‰Ќи­°й™ўйЃ‹е–¶е§”е“Ўй•·гЂЃеЏ‚й™ўгЃ®е±±жќ±гЂЃе°Џе·ќж­Је‰Їи­°й•·гЂЃз”е€©е№№дє‹й•·гЂ–ўеЏЈеЏ‚й™ўи­°е“Ўдјљй•·гЂЃе±±еЏЈй‚ЈжґҐз”·е…¬жЋе…љд»ЈиЎЁгЃ«гЃ‚гЃ„гЃ•гЃ¤е›ћг‚ЉгЂ‚жќѕй‡ЋгЃжњЁеЋџгЃзЈЇеґЋж­Је‰Їе®ж€їй•·е®еђЊиЎЊг24е€е…љжњ¬йѓЁгЂ32е€иЎ™ўйЃёз«‹е™иЈњдє€е®љи…гЃ«е…¬иЄЌиЁјдє¤д»г‚в–Ѕ15ж™49е€жќ±дє¬гѓ»иµ¤еќ‚г®јґјўјігЂ‚е±йЃ“з•Єзµ®еЏЋйЊІгЂ‚в–Ѕ17ж™8е€е®й‚ёгЂ17е€и‡Ёж™‚й–Ји­°гЂ30е€з¦Џз”°з·Џе‹™дјљй•·гЂ‚в–Ѕ19ж™1е€иЁи…дјљи¦‹г‚в–Ѕ20ж™33е€йЃи—¤йЃёеЇѕе§”е“Ўй•·гЂ‚в–Ѕ21ж™34е€жќ±дє¬гѓ»е…­жњ¬жњЁгЃ®гѓѓ¬гѓ“жњќж—ҐгЂ‚в–Ѕ22ж™10е€е ±йЃ“з•ЄзµЃ«е‡єжј”г‚в–Ѕ23ж™14е€жќ±дє¬гѓ»иµ¤еќ‚г®иЎ™ўи­°е“Ўе®їи€Ћг‚В
10/15/2021,202110,2021,10,15,202110,2021-10,2021-Oct,Fumio_Kishida,No,No,No,No,YES!,No,10жњ15ж—Ґ,в–Ѕ8ж™34е€жќ±дє¬гѓ»иµ¤еќ‚г®иЎ™ўи­°е“Ўе®їи€Ћз™єгЂ38е€е®й‚ёгЂ48е€иЄ­еЈІж–°иЃћг®г‚¤гѓіг‚їгѓ“гѓҐгѓјгЂ‚в–Ѕ9ж™8е€ж–‰и—¤е›Ѕдє¤з›ёгЂЃеѕЊи—¤еЋљеЉґз›ёгЂЃеЏ¤е·ќжі•з›ёгЂЃеІёйІиЎ›з›ёгЂЃжњ«жќѕж–‡з§‘з›ёгЂЃе±±еЏЈз’°еў›ёгЂЃз‰§еі¶гѓ‚ёг‚їгѓ«з›ёгЂЃиҐїйЉеѕ©и€€з›ёгЂЃЯе­ђиѕІз›ёгЂЃи‹Ґе®®дё‡еЌљз›ёгЂ‡жз”°е°‘е­ђеЊ–з›ёгЂЃе°Џжћ—зµЊжё€е®‰дїќз›ёгЂЃее†…гѓЇг‚ЇгѓЃгѓіз›ёгЂЃдєЊд№‹ж№ЇйІзЃЅз›ёгЂЃиЊ‚жњЁе¤–з›ёгЃЁй •ЄгЃ«йќўдјљг31е€еѕ©и€€жЋЁйЂІдјљи­°гЂ48е€ж–°ећ‹г‚ігѓ­гѓЉг‚¦г‚¤гѓ«г‚№ж„џжџ“з—®ж”їеєњеЇѕз­–жњ¬йѓЁгЂ‚в–Ѕ10ж™3е€й–Ји­°гЂ15е€е¤–з›ёгЂ21е€жњ€дѕ‹зµЊжё€е±е‘Љй–ўдї‚й–Јеѓљдјљи­°гЂ35е€иђ©з”џз”°зµЊз”Јз›ёгЂ39е€й‡‘е­ђз·Џе‹™з›ёгЂ42е€е±±йљ›зµЊиІЎз›ёгЂ44е€й€ґжњЁиІЎе‹™з›ёгЂ‚в–Ѕ11ж™2е€жњ€еиЄЊгЊпјЁЅЅЋпЅЅЅЃгЌг®г‚¤гѓіг‚їгѓ“гѓҐгѓјгЂ50е€жњ€еиЄЊгЊпј·Ѕ‰пј¬ј¬гЂЌг®г‚¤гѓіг‚їгѓ“гѓҐгѓјгЂ‚в–Ѕ12ж™31е€ж–°з”°е‰дёе№із”°з‰§е ґг‚°гѓ«гѓјгѓ—дјљй•·гЂ‚йЃ и—¤йЃёеЇѕе§”е“Ўй•·еђЊеё­гЂ39е€йЃёеЇѕе§”е“Ўй•·гЂ58е€жќ±дє¬гѓ»ж°ёз”°з”єгЃ®е†…й–Јеєњжњ¬еєњг‚в–Ѕ13ж™1е€ж–°гЃ—гЃ„иі‡жњ¬дё»зѕ©е®џзЏѕжњ¬йѓЁдє‹е‹™е±гЃ®зњ‹жќїжЋ›г_гЂ‚иЁеїµж’®еЅ±гЂ‚е±йЃ“еђ„з¤ѕгЃ®г‚¤гѓіг‚їгѓ“гѓҐгѓјгЂ‚зµЊиІЎз›ёгЂЃжњЁеЋџе®ж€їе‰Їй•·е®еђЊеё­гЂ5е€е®й‚ёгЂ‚в–Ѕ14ж™24е€г‚ёгѓЈгѓјгѓЉгѓЄг‚№гѓ€г®з”°еЋџз·Џдёжњ—ж°Џг59е€е®‰е…Ёгѓ»е®‰еїЃЄгЃѕгЃЎгЃҐгЃЏг‚Љй–ўдї‚еЉџеЉґиЂ…иЎЁеЅ°ејЏг‚гЃ‚гЃЃ•гЃ¤гЂ‚в–Ѕ15ж™8е€иЎЁеЅ°иЂ…гЃЁиЁеїµж’®еЅ±гЂ‚ж‡•и«41е€е…љжњ¬йѓЁгЂ42е€йє»з”џе‰Їз·ЏиЈЃгЃз”е€©е№№дє‹й•·гЂЃёеЇѕе§”е“Ўй•·гЂ‚в–Ѕ16ж™13е€е‰Їз·ЏиЈЃгЃе№№дє‹й•·гЂ33е€йЃёеЇѕе§”е“Ўй•·еЉг‚Џг‚‹гЂ‚в–Ѕ17ж™5е€е‰Їз·ЏиЈЃгЃе№№дє‹й•·гЂ17е€йЃёеЇѕе§”е“Ўй•·гЂЃеЋџз”°зѕ©ж­е‰ЌиЎ™ўи­°е“ЎгЂЃеЋџеЏЈе‰Јз”џе…љз¦ЏеІЎзњЊйЈдјљй•·еЉг‚Џг‚‹гЂ28е€е®й‚ёгЂ35е€иЌ’жњЁжі°и‡Је…Ёе›Ѕз”єжќ‘дјљй•·г‚‰г®иЎЁж•¬гЂ‚з·Џе‹™з›ёеђЊеё­гЂ51е€з¦Џдє•гѓ€г‚·е­ђж—Ґжњ¬зњ‹и­·еЌ”дјљдјљй•·гЂ‚в–Ѕ18ж™10е€ж»ќжІўе†…й–Јжѓ…е±е®г40е€йџ“е›ЅгЃ®ж–‡ењЁеЇ…е¤§зµ±й гЃЁй›»и©±гЂ‚в–Ѕ19ж™31е€е ±йЃ“еђ„з¤ѕгЃ®г‚¤гѓіг‚їгѓ“гѓҐгѓјгЂ46е€жќ±дє¬гѓ»жќ±ж–°ж©‹г®ж—Ґжњ¬гѓѓ¬гѓ“г‚в–Ѕ20ж™9е€е ±йЃ“з•Єзµ®еЏЋйЊІгЂ59е€жќ±дє¬гѓ»иµ¤еќ‚г®иЎ™ўи­°е“Ўе®їи€Ћг‚В
10/16/2021,202110,2021,10,16,202110,2021-10,2021-Oct,Fumio_Kishida,No,No,No,No,YES!,No,10жњ16ж—Ґ,в–Ѕ6ж™54е€жќ±дє¬гѓ»иµ¤еќ‚г®иЎ™ўи­°е“Ўе®їи€Ћз™єгЂ‚в–Ѕ7ж™9е€јЄјІжќ±дє¬й§…г‚в–Ѕ9ж™21е€гЃЇг‚¶гЃ101еЏ·гЃ§јЄјІдёгѓЋй–ўй§…г‚иҐїйЉеѕ©и€€з›ёеђЊиЎЊг‚в–Ѕ10ж™46е€еІ©ж‰‹зњЊй™ёе‰Ќй«з”°её‚г®й«з”°жќѕеЋџжґҐжіўеѕ©и€€зҐ€еїµе…¬ењ’г‚зЊ®иЉ±гЂ»™гЃЁгЃ‚и¦–еЇџг‚йЃ”еў—ж‹“д№џзџҐдє‹еђЊиЎЊг‚в–Ѕ11ж™38е€еђЊзњЊе¤§и€№жёЎеё‚г®гЂЊе¤§и€№жёЎеё‚й­љеё‚еґгЂЌг‚ж°ґз”ЈжҐ­й–ўдї‚и…г‚‰гЃЁи»Љеє§гЃ§ж„Џи¦‹дє¤жЏ›г‚еѕ©и€€з›ёгЂЃж€ёз”°е…¬жЋеё‚й•·г‚‰еђЊеё­гЂ‚иЁеїµж’®еЅ±гЂ‚в–Ѕ12ж™25е€еђЊеё‚г®е•Ґ­ж–ЅиЁ­гЂЊг‚­гѓЈгѓ‚»гѓіе¤§и€№жёЎгЂЌг‚жјйЈџг‚й­љд»‹йЎћг®зј¶и©°г‚’иіје…ҐгЂ‚ж”ЇжЏґиЂ…г‚’е‰ЌгЃ«гЃ‚гЃ„гЃ•гЃ¤гЂ‚еђЊж–ЅиЁ­й–ўдї‚и…гЃЁиЁеїµж’®еЅ±гЂ‚в–Ѕ13ж™27е€е®®еџЋзњЊж°—д»™жІјеё‚г®е•Ґ­ж–ЅиЁ­гЂЊгЃЄгЃ‚Џг‚“гЌг‚и¦–еЇџг‚з§»дЅЏи…гЃЁж„Џи¦‹дє¤жЏ›г‚иЁеїµж’®еЅ±гЂ‚иЏ…еЋџиЊ‚её‚й•·еђЊиЎЊг‚в–Ѕ14ж™18е€еђЊеё‚г®дё‰й™ёи‡Єе‹•и»ЉйЃ“жњ¬еђ‰гѓ‘гѓјг‚­гѓіг‚°г‚ЁгѓЄг‚ўгЂ‚дј‘ж©гЂ‚в–Ѕ15ж™50е€еђЊзњЊзџіе·»её‚г®зџіе·»еЌ—жµњжґҐжіўеѕ©и€€зҐ€еїµе…¬ењ’г‚зЊ®иЉ±гЂ»™гЃЁгЃ‚и¦–еЇџг‚йЃ и—¤дїЎе“‰е‰ЇзџҐдє‹г‚‰еђЊиЎЊг‚в–Ѕ16ж™12е€еђЊеё‚г®з”џй®®йЈџе“Ѓеё‚еґгЂЊгЃ„гЃ—г®гЃѕгЃЌе…ѓж°—гЃ„гЃЎгЃ°гЂЌг‚ж¬ЎжњџиЎ™ўйЃёгЃ®и‡Єж°‘е…ље…¬иЄЌе™иЈњдє€е®љи…г®жЈ®дё‹еЌѓй‡Њж°Џг‚‰гЃЁйќўдјљг‚в–Ѕ17ж™15е€еђЊеё‚г®гЂЊз™Ѕи¬™и’Ій‰ѕеє—гЌй–Ђи„‡е·Ґе ґгЂ‚и¦–еЇџг‚гЃ‹гЃѕгЃјгЃ“г‚’и©¦йЈџг‚в–Ѕ18ж™2е€еђЊзњЊжќѕеі¶з”єгЃ®гЂЊжќѕеі¶з”єж–‡еЊ–и¦іе…‰дє¤жµ¤ЁгЂЌг‚и¦іе…‰жҐ­й–ўдї‚и…г‚‰гЃЁи»Љеє§гЃ§ж„Џи¦‹дє¤жЏ›г‚еѕ©и€€з›ёг‚‰еђЊеё­гЂ54е€е ±йЃ“еђ„з¤ѕгЃ®г‚¤гѓіг‚їгѓ“гѓҐгѓјгЂ‚в–Ѕ19ж™53е€д»™еЏ°её‚йќ’и‘‰еЊєгЃ®д»™еЏ°е›Ѕйљ›ггѓѓ«гЂ‚е®їжіЉг‚В
10/17/2021,202110,2021,10,17,202110,2021-10,2021-Oct,Fumio_Kishida,YES!,No,No,No,YES!,No,10жњ17ж—Ґ,в–Ѕ7ж™24е€е®їжіЉегЃ®д»™еЏ°её‚йќ’и‘‰еЊєгЃ®д»™еЏ°е›Ѕйљ›ггѓѓ«з™єгЂ‚иҐїйЉеѕ©и€€з›ёеђЊиЎЊг‚в–Ѕ8ж™27е€з¦Џеі¶зњЊеЌ—з›ёй¦¬её‚г®е•Ґ­ж–ЅиЁ­гЂЊг‚»гѓѓѓгѓЃ‹гЃ—гЃѕгЂЌг‚дј‘ж©гЂ‚в–Ѕ9ж™13е€еђЊзњЊе¤§з†ЉгЃеЏЊи‘‰дёЎз”єгЃ®жќ±дє¬й›»еЉ›з¦Џеі¶з¬¬1еЋџз™єгЂ‚и¦–еЇџг‚ее й›…й›„зџҐдє‹гЃжќ±дє¬й›»еЉ›ггѓјгѓ«гѓ‚Јгѓіг‚°г‚№гЃ®е°Џжћ—е–њедјљй•·гЂЃе°Џж—©е·ќж™єжЋз¤ѕй•·г‚‰еђЊиЎЊг‚в–Ѕ10ж™54е€еђЊзњЊжµЄж±џз”єгЃ®з”єе–¶е¤§е№іе±±йњЉењ’гЂ‚ж°йњЉзў‘гЃ«зЊ®иЉ±гЂ»™гЃЁгЃ‚еђ‰з”°ж•°еЌљжµЄж±џз”єй•·г‚‰еђЊиЎЊг‚в–Ѕ11ж™9е€еђЊз”єгЃ®гЂЊйЃ“гЃ®й§…гЃЄгЃїгЃ€гЌг‚и¦–еЇџг‚жјйЈџг‚гЃ—г‚‰гЃ™гЂЃз±ігЂ™¶е™ЁгЃЄгЃ©г‚’иіје…ҐгЂ‚в–Ѕ12ж™19е€еђЊзњЊеЏЊи‘‰з”єгЃ®и‘¬е„е ґгЂЊиЃ–й¦™и‹‘гЂЌг‚з‰№е®љеѕ©и€€ез”џж‹ з‚№еЊєеџџпј€еѕ©и€€ж‹ з‚№ј‰е¤–гЃ«гЃ‚гЃџг‚‹е‘Ёиѕєг‚’и»ЉегЃ‹г‚‰и¦–еЇџг43е€јЄјІеЏЊи‘‰й§…г‚еѕ©и€€ж‹ з‚№е†…гЃ«гЃ‚гЃџг‚‹е‘Ёиѕєг‚’и¦–еЇџг‚дјЉжІўеЏІжњ—з”єй•·гЃ‹г‚‰еђЊз”єгЃЁдјЃжҐ­гЃЊе±еђЊй–‹з™єгЃ—гЃџг‚їг‚Єгѓ«гѓћгѓ•гѓ©гѓјеЏ—г_еЏ–г‚ЉгЂ‚в–Ѕ13ж™23е€еђЊзњЊе¤§з†Љз”єгЃ®г‚¤гѓЃг‚ґж Ѕеџ№ж–ЅиЁ­гЂЊгѓЌг‚Їг‚µг‚№гѓ•г‚ЎгѓјгѓгЃЉгЃЉгЃЏгЃѕгЂЌг‚и¦–еЇџг‚г‚¤гѓЃг‚ґг‚’и©¦йЈџг‚еђ‰з”°ж·із”єй•·еђЊиЎЊг57е€еђЊзњЊеЇЊеІЎз”єгЃ®еђЊз”єж–‡еЊ–дє¤жµЃг‚»гѓіг‚їгѓјгЂЊе­¦гЃігЃ®жЈ®гЂЌг‚её°й‚…гЃз§»дЅЏи…гЃЁи»Љеє§гЃ§ж„Џи¦‹дє¤жЏ›г‚еѕ©и€€з›ёгЂЃзџҐдє‹г‚‰еђЊеё­гЂ‚иЁеїµж’®еЅ±гЂ‚в–Ѕ14ж™45е€е ±йЃ“еђ„з¤ѕгЃ®г‚¤гѓіг‚їгѓ“гѓҐгѓјгЂ‚в–Ѕ16ж™8е€еђЊзњЊз”°жќ‘её‚г®зЈђи¶Љи‡Єе‹•и»ЉйЃ“йїж­¦йљ€й«еЋџг‚µгѓјгѓ“г‚№г‚ЁгѓЄг‚ўгЂ‚дј‘ж©гЂ39е€јЄјІйѓЎе±±й§…г46е€ж №жњ¬еЊе‰ЌиЎ™ўи­°е“ЎгЂ‚в–Ѕ18ж™23е€г‚ЃѕгЃігЃ62еЏ·гЃ§јЄјІжќ±дє¬й§…г26е€жњЁеЋџе®ж€їе‰Їй•·е®г‚в–Ѕ19ж™4е€жќ±дє¬гѓ»йЉеє§гЃ®ж­ЊидјЋеє§г‚їгѓЇгѓјгЂ‚г‚¤гѓіг‚їгѓјгѓЌгѓѓгѓ€е‹•з”»дё­з¶™г‚µг‚¤гѓ€гЊгѓ‹г‚ігѓ‹г‚іе‹•з”»гЂЌг®е…љй¦–иЁЋи«–гЃ«е‡єеё­гЂ‚в–Ѕ20ж™53е€жќ±дє¬гѓ»е…­з•Єз”єгЃ®гЂЊг‚«гѓѓ€гѓ»г‚¤гѓігѓ»г‚Ѕгѓјгѓ¬йє№з”єеє—гЌг‚ж•Јй«ЄгЂ‚в–Ѕ22ж™20е€жќ±дє¬гѓ»иµ¤еќ‚г®иЎ™ўи­°е“Ўе®їи€Ћг‚В
10/18/2021,202110,2021,10,18,202110,2021-10,2021-Oct,Fumio_Kishida,No,No,No,No,YES!,No,10жњ18ж—Ґ,в–Ѕ8ж™14е€жќ±дє¬гѓ»иµ¤еќ‚г®иЎ™ўи­°е“Ўе®їи€Ћз™єгЂ25е€жќ±дє¬гѓ»ж–°ж©‹г®е±…й…’е±‹гЊзЈЇдёёж°ґз”ЈйЈџе‚ж–°ж©‹зѓЏжЈ®йЂљг‚Љеє—гЌг28е€йЈІйЈџеє—зµЊе–¶иЂ…г‚‰гЃЁи»Љеє§гЃ§ж„Џи¦‹дє¤жЏ›г‚е±±йљ›зµЊиІЎз›ёг‚‰еђЊеё­гЂ‚в–Ѕ9ж™19е€е ±йЃ“еђ„з¤ѕгЃ®г‚¤гѓіг‚їгѓ“гѓҐгѓјгЂ33е€е®й‚ёгЂ‚в–Ѕ10ж™34е€е ±йЃ“еђ„з¤ѕгЃ®г‚¤гѓіг‚їгѓ“гѓҐгѓјгЂ54е€жќ±дє¬гѓ»зҐћеЌ—гЃ®ј®јЁј«гЂ‚иЎ™ўйЃёжЇ”дѕ‹д»ЈиЎЁгЃ®ж”їи¦‹ж”ѕйЂЃеЏЋйЊІгЂ‚в–Ѕ12ж™41е€жќ±дє¬гѓ»е†…е№ёз”єгЃ®ж—Ґжњ¬гѓ—гѓ¬г‚№г‚»гѓіг‚їгѓјгѓ“гѓ«гЂ‚в–Ѕ13ж™5е€ж—Ґжњ¬иЁи…г‚Їгѓ©гѓ–дё»е‚¬гЃ®9е…ље…љй¦–иЁЋи«–дјљг‚в–Ѕ15ж™17е€е…љжњ¬йѓЁгЂ29е€йє»з”џе‰Їз·ЏиЈЃгЃз”е€©е№№дє‹й•·гЂЃ и—¤йЃёеЇѕе§”е“Ўй•·гЂ‚в–Ѕ16ж™55е€е®й‚ёгЂ‚в–Ѕ17ж™1е€еЊ—жњќй®®гЃ«г‚€г‚‹ж‹‰и‡ґиў«е®іиЂ…е®¶ж—Џдјљг®йЈЇеЎљз№›„д»ЈиЎЁгЂЃжЁЄз”°ж—©зґж±џгЃ•г‚“г‚‰гЃЁйќўдјљг‚жќѕй‡Ће®ж€їй•·е®г‚‰еђЊеё­гЂ‚в–Ѕ18ж™6е€е…љжњ¬йѓЁгЂ7е€йЃёеЇѕе§”е“Ўй•·гЂ27е€е№№дє‹й•·гЂ32е€е№№дє‹й•·гЂЃёеЇѕе§”е“Ўй•·гЂ‚в–Ѕ19ж™23е€е№№дє‹й•·гЂ29е€е®й‚ёгЂ41е€е°Џй‡жз”°е†…й–Јеєњиіће‹Іе±й•·гЂ‚в–Ѕ20ж™44е€иЎ™ўйЃёеђ‘г_гЃ®гѓ“гѓ‡г‚ЄгѓЎгѓ‚»гѓјг‚ёеЏЋйЊІгЂ‚в–Ѕ21ж™16е€жќ±дє¬гѓ»иµ¤еќ‚г®иЎ™ўи­°е“Ўе®їи€Ћг‚В
10/19/2021,202110,2021,10,19,202110,2021-10,2021-Oct,Fumio_Kishida,No,No,No,No,YES!,No,10жњ19ж—Ґ,в–Ѕ7ж™42е€жќ±дє¬гѓ»иµ¤еќ‚г®иЎ™ўи­°е“Ўе®їи€Ћз™єгЂ59е€јЄјІжќ±дє¬й§…г‚в–Ѕ9ж™45е€г‚ЃѕгЃігЃ127еЏ·гЃ§јЄјІз¦Џеі¶й§…г‚в–Ѕ10ж™20е€з¦Џеі¶её‚г®гЂЊењџж№Їжё©жі‰и¦іе…‰жЎ€еж‰гЂЌе‰ЌгЂ‚иЎ—й­жј”иЄ¬гЂ‚в–Ѕ11ж™15е€јЄјІз¦Џеі¶й§…г‚е±йЃ“еђ„з¤ѕгЃ®г‚¤гѓіг‚їгѓ“гѓҐгѓјгЂ‚в–Ѕ12ж™4е€г‚ЃѕгЃігЃ133еЏ·гЃ§јЄјІд»™еЏ°й§…г10е€д»™еЏ°её‚йќ’и‘‰еЊєгЃ®е•Ґ­ж–ЅиЁ­гЂЊг‚ўг‚Ёгѓ«гЂЌе‰ЌгЂ‚иЎ—й­жј”иЄ¬гЂ33е€јЄјІд»™еЏ°й§…г‚в–Ѕ14ж™47е€г‚ЃѕгЃігЃ140еЏ·гЃ§јЄјІжќ±дє¬й§…г‚в–Ѕ15ж™3е€е®й‚ёгЂ4е€е ±йЃ“еђ„з¤ѕгЃ®г‚¤гѓіг‚їгѓ“гѓҐгѓјгЂ‚в–Ѕ16ж™5е€е›Ѕе®¶е®‰е…Ёдїќйљњдјљи­°гЂ31е€е ±йЃ“еђ„з¤ѕгЃ®г‚¤гѓіг‚їгѓ“гѓҐгѓјгЂ‚в–Ѕ17ж™51е€йЃи—¤йЃёеЇѕе§”е“Ўй•·гЂ‚в–Ѕ18ж™43е€жќ±дє¬гѓ»зґе°ѕдє•з”єгЃ®ј®јЁј«еЌ»Јз”°ж”ѕйЂЃдјљй¤ЁгЂ‚в–Ѕ19ж™6е€е ±йЃ“з•ЄзµЃ«е‡єжј”г41е€жќ±дє¬гѓ»иµ¤еќ‚г®иЎ™ўи­°е“Ўе®їи€Ћг‚В
10/20/2021,202110,2021,10,20,202110,2021-10,2021-Oct,Fumio_Kishida,No,No,No,No,No,No,10жњ20ж—Ґ,в–Ѕ7ж™58е€жќ±дє¬гѓ»иµ¤еќ‚г®иЎ™ўи­°е“Ўе®їи€Ћз™єгЂ‚в–Ѕ8ж™22е€зѕЅз”°з©єжёЇгЂ‚в–Ѕ9ж™38е€ж—Ґжњ¬и€Єз©є107дѕїгЃ§е¤§йЄз©єжёЇгЂ‚в–Ѕ10ж™9е€е…µеє«зњЊдјЉдё№её‚г®гЂЊжќ±гѓЄгЃЃџгЃїгѓ›гјгѓ«гЂЌг‚йЈІйЈџеє—зµЊе–¶иЂ…г‚‰гЃЁи»Љеє§гЃ§ж„Џи¦‹дє¤жЏ›г56е€јЄјІе°јеґЋй§…е‰ЌгЂ‚иЎ—й­жј”иЄ¬гЂ‚в–Ѕ11ж™34е€йЄжЂҐдјЉдё№й§…е‰ЌгЂ‚иЎ—й­жј”иЄ¬гЂ‚в–Ѕ12ж™26е€еђЊзњЊиҐїе®®её‚г®дё­е›Ѕи‡Єе‹•и»ЉйЃ“иҐїе®®еђЌеЎ©г‚µгѓјгѓ“г‚№г‚ЁгѓЄг‚ўгЂ‚дј‘ж©гЂ42е€зҐћж€ёй›»й‰ІЎе ґй§…е‰ЌгЂ‚иЎ—й­жј”иЄ¬гЂ‚в–Ѕ13ж™37е€јЄјІж‘‚жґҐжњ¬е±±й§…еЊ—еЏЈгЂ‚иЎ—й­жј”иЄ¬гЂ‚в–Ѕ14ж™26е€јЄјІж–°зҐћж€ёй§…г‚в–Ѕ15ж™47е€гЃ®гЃћгЃї89еЏ·гЃ§јЄјІеєі¶й§…г49е€еєі¶её‚еЌ—еЊєгЃ®гѓ›гѓ†гѓ«г‚°гѓ©гѓігѓґг‚Јг‚ўеєі¶гЂ‚и‡Єиє«гЃ®еѕЊжЏґдјље№№йѓЁг‚‰еєиїЋгЃ€гЂ‚иЉ±жќџиґ€е‘€гЂ‚иЁеїµж’®еЅ±гЂ‚в–Ѕ16ж™16е€јЄјІжЁЄе·ќй§…е‰ЌгЂ‚иЎ—й­жј”иЄ¬гЂ‚в–Ѕ17ж™8е€јЄјІз·‘дє•й§…е‰ЌгЂ‚иЎ—й­жј”иЄ¬гЂ‚в–Ѕ18ж™9е€еєі¶зњЊжќ±еєі¶её‚г®иҐїжќЎдё­е¤®е…¬ењ’г‚иЎ—й­жј”иЄ¬гЂ‚в–Ѕ19ж™‚геєі¶з©єжёЇгЂ3е€е…љиЎ™ўйЃёеЂ™иЈњи…г®ж±єиµ·е¤§дјљгЃ«гѓЄгѓўгѓјгѓ€еєжј”г‚в–Ѕ21ж™4е€ж—Ґжњ¬и€Єз©є266дѕїгЃ§зѕЅз”°з©єжёЇгЂ39е€жќ±дє¬гѓ»иµ¤еќ‚г®иЎ™ўи­°е“Ўе®їи€Ћг40е€йЃи—¤йЃёеЇѕе§”е“Ўй•·гЂ‚В
10/21/2021,202110,2021,10,21,202110,2021-10,2021-Oct,Fumio_Kishida,No,No,No,No,No,No,10жњ21ж—Ґ,в–Ѕ7ж™29е€жќ±дє¬гѓ»иµ¤еќ‚г®иЎ™ўи­°е“Ўе®їи€Ћз™єгЂ42е€јЄјІжќ±дє¬й§…г‚в–Ѕ9ж™31е€гЃ®гЃћгЃї13еЏ·гЃ§јЄјІеђЌеЏ¤е±‹й§…г‚в–Ѕ10ж™32е€гѓЇг‚¤гѓ‰гѓ“гѓҐгѓјгЃІгЃ5еЏ·гЃ§јЄјІзѕЋжї¤Єз”°й§…г46е€еІђйзњЊеЏЇе…ђеё‚г®гЃµг‚‹гЃ•гЃЁе·ќе¬ењ’г‚иЎ—й­жј”иЄ¬гЂ‚в–Ѕ11ж™47е€ж„›зџҐзњЊжҐж—Ґдє•её‚г®дё­е¤®и‡Єе‹•и»ЉйЃ“е†…жґҐеігѓ‘гјг‚­гѓіг‚°г‚ЁгѓЄг‚ўгЂ‚дј‘ж©гЂ‚в–Ѕ12ж™14е€еђЊеё‚г®е•Ґ­ж–ЅиЁ­гЂЊг‚¤гѓјг‚ўг‚№жҐж—Ґдє•гЌе‰ЌгЂ‚иЎ—й­жј”иЄ¬гЂ‚в–Ѕ13ж™21е€еђЌеЏ¤е±‹её‚дё­жќ‘еЊєгЃ®г‚ёг‚§г‚¤г‚ўгѓјгѓ«еђЌеЏ¤е±‹й«еі¶е±‹е‰ЌгЂ‚иЎ—й­жј”иЄ¬гЂ‚в–Ѕ14ж™31е€јЄјІдё‰жІіе®‰еџЋй§…е‰ЌгЂ‚дј‘ж©гЂ43е€еђЊзњЊе®‰еџЋеё‚г®и¤‡еђ€ж–ЅиЁ­гЂЊг‚ўгѓігѓ•г‚©гѓјгѓ¬гЂЌг‚иЎ—й­жј”иЄ¬гЂ‚в–Ѕ15ж™42е€еђЊзњЊеІЎеґЋеё‚г®и¤‡еђ€е•Ґ­ж–ЅиЁ­гЂЊг‚¦г‚¤гѓіг‚°г‚їг‚¦гѓіеІЎеґЋгЌг®й§ђи»ЉеґгЂ‚иЎ—й­жј”иЄ¬гЂ‚в–Ѕ17ж™2е€жµњжќѕеё‚еЊ—еЊєгЃ®жќ±еђЌй«йџйЃ“и·ЇжµњеђЌж№–г‚µгѓјгѓ“г‚№г‚ЁгѓЄг‚ўгЂ‚дј‘ж©гЂ46е€жµњжќѕеё‚дё­еЊєгЃ®г‚®гѓЈгѓ©гѓЄгѓјгѓўгѓјгѓ«гЂЊг‚Ѕгѓ©гѓўгЂЌг‚иЎ—й­жј”иЄ¬гЂ‚в–Ѕ18ж™16е€јЄјІжµњжќѕй§…г‚в–Ѕ20ж™17е€гЃ“гЃ гЃѕ742еЏ·гЃ§јЄјІжќ±дє¬й§…г39е€жќ±дє¬гѓ»иµ¤еќ‚г®иЎ™ўи­°е“Ўе®їи€Ћг‚В
10/22/2021,202110,2021,10,22,202110,2021-10,2021-Oct,Fumio_Kishida,No,No,No,No,No,No,10жњ22ж—Ґ,в–Ѕ7ж™8е€жќ±дє¬гѓ»иµ¤еќ‚г®иЎ™ўи­°е“Ўе®їи€Ћз™єгЂ31е€зѕЅз”°з©єжёЇгЂ‚в–Ѕ9ж™26е€ж—Ґжњ¬и€Єз©є551дѕїгЃ§ж—­е·ќз©єжёЇгЂ‚в–Ѕ10ж™13е€еЊ—жµ·йЃ“ж—­е·ќеё‚г®и¤‡еђ€ж–ЅиЁ­гЂЊг‚ўгѓ‚·гѓҐгЂЌе‰ЌгЂ‚иЎ—й­жј”иЄ¬гЂ‚в–Ѕ11ж™32е€еЊ—жµ·йЃ“з‚е·ќеё‚г®е•Ґ­ж–ЅиЁ­гЂЊз‚е·ќгѓЏг‚¤г‚¦г‚§г‚¤г‚Єг‚ўг‚·г‚№й¤ЁгЂЌг‚дј‘ж©гЂ‚ж—Ґжњ¬й…’г‚’иіје…ҐгЂ‚е€©з”Ёе®ўг‚‰гЃЁе†™зњџж’®еЅ±гЂ‚в–Ѕ12ж™22е€еЊ—жµ·йЃ“еІ©и¦‹жІўеё‚г®гЂЊеЊ—жµ·йЃ“г‚°гѓЄгѓјгѓігѓ©гѓігѓ‰ггѓ›гѓ†гѓ«г‚µгѓігѓ—гѓ©г‚¶гЂЌе‰ЌгЂ‚иЎ—й­жј”иЄ¬гЂ45е€еђЊггѓѓ«гЂ‚е®ґдјљеґгЃ§е…љиЎ™ўйЃёз«‹е™иЈњи…г‚‰гЃЁжјйЈџг‚в–Ѕ13ж™9е€еђЊеё‚г®е…љз«‹е™иЈњи…г®дє‹е‹™ж‰гЂ‚з«‹е™иЈњи…г‚‰гЃЁйќўдјљг‚в–Ѕ14ж™19е€жњ­е№Њеё‚дё­е¤®еЊєгЃ®з™ѕиІЁеє—гЊжњ­е№Њдё‰и¶ЉгЌе‰ЌгЂ‚иЎ—й­жј”иЄ¬гЂ‚в–Ѕ15ж™‚геђЊеЊєгЃ®гЂЊе°‚й–Ђе­¦ж ЎеЊ—жµ·йЃ“гѓЄгѓЏгѓ“гѓЄгѓјг‚·гѓ§гѓіе¤§е­¦ж ЎгЂЌг‚е­¦з”џгЃЁи»Љеє§гЃ§ж„Џи¦‹дє¤жЏ›г‚иЁеїµж’®еЅ±гЂ‚в–Ѕ16ж™50е€еЊ—жµ·йЃ“и‹«е°Џз‰§её‚г®е…љиЎ™ўйЃёз«‹е™иЈњи…г®дє‹е‹™ж‰е‰Ќг‚иЎ—й­жј”иЄ¬гЂ‚в–Ѕ17ж™43е€ж–°еЌ­із©єжёЇгЂ‚в–Ѕ19ж™36е€ж—Ґжњ¬и€Єз©є522дѕїгЃ§зѕЅз”°з©єжёЇгЂ‚в–Ѕ20ж™17е€е…¬й‚ёгЂ‚е…љиЎ™ўйЃёз«‹е™иЈњи…еђ‘гЃ‘г®гѓ“гѓ‡г‚ЄгѓЎгѓ‚»гѓјг‚ёеЏЋйЊІгЂ‚в–Ѕ22ж™35е€жќ±дє¬гѓ»иµ¤еќ‚г®иЎ™ўи­°е“Ўе®їи€Ћг‚В
10/23/2021,202110,2021,10,23,202110,2021-10,2021-Oct,Fumio_Kishida,No,No,No,No,No,No,10жњ23ж—Ґ,в–Ѕ8ж™18е€жќ±дє¬гѓ»иµ¤еќ‚г®иЎ™ўи­°е“Ўе®їи€Ћз™єгЂ45е€зѕЅз”°з©єжёЇгЂ‚в–Ѕ10ж™44е€е…Ёж—Ґз©є245дѕїгЃ§з¦ЏеІЎз©єжёЇгЂ‚в–Ѕ12ж™3е€дЅђиізњЊж­¦й›ё‚г®г‚·гѓ§гѓѓ”гѓіг‚°г‚»гѓіг‚їгѓјгЂЊг‚†г‚Ѓг‚їг‚¦гѓіж­¦й›Ќг®й§ђи»ЉеґгЂ‚иЎ—й­жј”иЄ¬гЂ31е€еђЊеё‚г®йЈІйЈџеє—гЊе±…йЈџдє­гЂи±ЉгЌг‚е°Џжќѕж”їеё‚й•·е‡єиїЋгЃ€гЂ‚иї‘е№ґгЃ®ж°ґе®ігЃ§иў«е®іг‚’еЏ—гЃ‘гЃџеЂ‹дєєдє‹жҐ­дё»г‚‰гЃЁи»Љеє§гЃ§ж„Џи¦‹дє¤жЏ›г‚жјйЈџг‚в–Ѕ14ж™8е€јЄјІдЅђиій§…е‰ЌгЂ‚иЎ—й­жј”иЄ¬гЂ54е€дЅђиіеё‚г®й•·еґЋи‡Єе‹•и»ЉйЃ“й‡‘з«‹г‚µгѓјгѓ“г‚№г‚ЁгѓЄг‚ўгЂ‚дј‘ж©гЂ‚в–Ѕ15ж™39е€з¦ЏеІЎзњЊе¤§й‡ЋеџЋеё‚г®иҐїй‰™ЅжњЁеЋџй§…е‰ЌгЂ‚иЎ—й­жј”иЄ¬гЂ‚в–Ѕ16ж™19е€з¦ЏеІЎеё‚дё­е¤®еЊєгЃ®иҐїй‰¦ЏеІЎй§…е‰ЌгЂ‚иЎ—й­жј”иЄ¬гЂ‚в–Ѕ17ж™7е€з¦ЏеІЎзњЊеЏ¤иіеё‚г®д№ќе·ћи‡Єе‹•и»ЉйЃ“еЏ¤иіг‚µгѓјгѓ“г‚№г‚ЁгѓЄг‚ўгЂ‚дј‘ж©гЂ46е€еЊ—д№ќе·ћеё‚е«е№ЎиҐїеЊєгЃ®гЂЊй»’еґЋгІгЃігЃ—г‚“гѓ›гјгѓ«гЂЌе‰ЌгЂ‚иЎ—й­жј”иЄ¬гЂ‚в–Ѕ18ж™27е€еђЊеё‚е°Џе‰еЊ—еЊєгЃ®гЂЊеЊ—д№ќе·ћг‚Ѕгѓ¬г‚¤гѓ¦гѓ›гјгѓ«гЂЌг‚е…љиЎ™ўйЃёеЂ™иЈњи…г®жј”иЄ¬дјљгЃ«е‡єеё­гЃ—гЃжј”иЄ¬гЂ‚в–Ѕ19ж™12е€еЊ—д№ќе·ћз©єжёЇгЂ‚в–Ѕ20ж™50е€е…Ёж—Ґз©є3890дѕїгЃ§зѕЅз”°з©єжёЇгЂ‚в–Ѕ21ж™36е€жќ±дє¬гѓ»иµ¤еќ‚г®иЎ™ўи­°е“Ўе®їи€Ћг‚В
10/24/2021,202110,2021,10,24,202110,2021-10,2021-Oct,Fumio_Kishida,No,No,No,No,YES!,No,10жњ24ж—Ґ,в–Ѕ6ж™54е€жќ±дє¬гѓ»иµ¤еќ‚г®иЎ™ўи­°е“Ўе®їи€Ћз™єгЂ‚в–Ѕ7ж™6е€жќ±дє¬гѓ»еЏ°е ґгЃ®гѓ•г‚ёгѓѓ¬гѓ“г30е€е ±йЃ“з•ЄзµЃ«е‡єжј”г‚в–Ѕ8ж™47е€жќ±дє¬гѓ»зґе°ѕдє•з”єгЃ®ј®јЁј«еЌ»Јз”°ж”ѕйЂЃдјљй¤ЁгЂ‚в–Ѕ9ж™‚ге ±йЃ“з•ЄзµЃ«е‡єжј”г‚в–Ѕ10ж™50е€зѕЅз”°з©єжёЇгЂ‚в–Ѕ12ж™12е€е…Ёж—Ґз©є21дѕїгЃ§е¤§йЄз©єжёЇгЂ‚е¤љиіи°·дїЉеЏІе…ље¤§йЄеєњйЈе№№дє‹й•·е‡єиїЋгЃ€гЂ‚в–Ѕ13ж™23е€е¤§йЄеєњжі‰дЅђй‡жеё‚г®г‚·гѓ§гѓѓ”гѓіг‚°г‚»гѓіг‚їгѓјгЂЊг‚¤г‚Єгѓіж—Ґж №й‡Ћеє—гЌе‰ЌгЂ‚иЎ—й­жј”иЄ¬гЂ‚в–Ѕ14ж™3е€еђЊеєњеІёе’Њз”°её‚г®йЄе’Њи‡Єе‹•и»ЉйЃ“еІёе’Њз”°г‚µгѓјгѓ“г‚№г‚ЁгѓЄг‚ўгЂ‚дј‘ж©гЂ40е€еђЊеєњеЇЊз”°жћ—её‚г®иї‘й‰„еЇЊз”°жћ—й§…е‰ЌгЂ‚иЎ—й­жј”иЄ¬гЂ‚в–Ѕ15ж™33е€е єеё‚еєеЊєгЃ®еЌ—жµ·е єжќ±й§…е‰ЌгЂ‚иЎ—й­жј”иЄ¬гЂ‚в–Ѕ16ж™23е€е¤§йЄеё‚иҐїж€ђеЊєеЅ№ж‰е‰Ќг‚иЎ—й­жј”иЄ¬гЂ‚в–Ѕ17ж™2е€еђЊеё‚е¤©зЋ‹еЇєеЊєгЃ®г‚·гѓ§гѓѓ”гѓіг‚°г‚»гѓіг‚їгѓјгЂЊе¤©зЋ‹еЇєгѓџг‚ЄгЂЌе‰ЌгЂ‚иЎ—й­жј”иЄ¬гЂ42е€еђЊеё‚еџЋжќ±еЊєгЃ®е¤§йЄеєњи­¦жњ¬йѓЁй–ўз›®е€Ґй¤ЁгЂ‚дј‘ж©гЂ58е€еђЊеєње®€еЏЈеё‚г®дє¬йЄе®€еЏЈеё‚й§…е‰ЌгЂ‚иЎ—й­жј”иЄ¬гЂ‚в–Ѕ18ж™52е€е¤§йЄеё‚еЊ—еЊєгЃ®е®¶й›»й‡ЏиІ©еє—гЊгѓЁгѓ‰гѓђг‚·г‚«гѓЎгѓ©гЂгѓћгѓ«гѓЃгѓЎгѓ‚Јг‚ўжў…з”°гЂЌе‰ЌгЂ‚иЎ—й­жј”иЄ¬гЂ‚в–Ѕ19ж™40е€е¤§йЄз©єжёЇгЂ‚в–Ѕ21ж™20е€е…Ёж—Ґз©є40дѕїгЃ§зѕЅз”°з©єжёЇгЂ‚в–Ѕ22ж™11е€жќ±дє¬гѓ»иµ¤еќ‚г®иЎ™ўи­°е“Ўе®їи€Ћг12е€ј®јЁј«гЃ®г‚¤гѓіг‚їгѓ“гѓҐгѓјгЂ‚В
10/25/2021,202110,2021,10,25,202110,2021-10,2021-Oct,Fumio_Kishida,No,No,No,No,YES!,No,10жњ25ж—Ґ,в–Ѕ7ж™18е€е ±йЃ“еђ„з¤ѕгЃ®г‚¤гѓіг‚їгѓ“гѓҐгѓјгЂ22е€жќ±дє¬гѓ»иµ¤еќ‚г®иЎ™ўи­°е“Ўе®їи€Ћз™єгЂ46е€зѕЅз”°з©єжёЇгЂ‚в–Ѕ9ж™1е€е…Ёж—Ґз©є15дѕїгЃ§е¤§йЄз©єжёЇгЂ44е€јЄјІж–°е¤§йЄй§…е‰ЌгЂ‚иЎ—й­жј”иЄ¬гЂ‚в–Ѕ10ж™44е€е¤§йЄеєњжќ±е¤§йЄеё‚г®иї‘й‰„её–Ѕй§…е‰ЌгЂ‚иЎ—й­жј”иЄ¬гЂ‚в–Ѕ11ж™54е€еђЊеєњеЇќе±‹е·ќеё‚г®дє¬йЄеЇќе±‹е·ќеё‚й§…е‰ЌгЂ‚иЎ—й­жј”иЄ¬гЂ‚в–Ѕ12ж™39е€дє¬йѓЅеєњдє¬з”°иѕєеё‚г®з¬¬2дє¬йЄйЃ“и·Їдє¬з”°иѕєгѓ‘гјг‚­гѓіг‚°г‚ЁгѓЄг‚ўгЂ‚дј‘ж©гЂ‚в–Ѕ13ж™14е€дє¬йѓЅеё‚еЅ№ж‰е‰Ќг‚иЎ—й­жј”иЄ¬гЂ55е€еђЊеё‚дё‹дє¬еЊєгЃ®гѓЄгѓјг‚¬гѓ­г‚¤гѓ¤гѓ«гѓ›гѓ†гѓ«дє¬йѓЅгЂ‚е®ґдјљеґгЂЊгѓ©гЂг‚·г‚ґгѓјгѓ‹гѓҐгЂЌгЃ§иѕІжҐ­й–ўдї‚и…гЃЁи»Љеє§гЃ§ж„Џи¦‹дє¤жЏ›г‚в–Ѕ14ж™31е€јЄјІдє¬йѓЅй§…г59е€гЃ®гЃћгЃї33еЏ·гЃ§јЄјІж–°е¤§йЄй§…г‚в–Ѕ16ж™8е€гЃ•гЃЏг‚561еЏ·гЃ§јЄјІз¦Џе±±й§…г‚ж”ЇжЏґиЂ…гЃ‹г‚‰иЉ±жќџеЏ—гЃ‘еЏ–г‚Љг‚иЁеїµж’®еЅ±гЂ‚в–Ѕ17ж™‚гјЄјІе°ѕйЃ“й§…е‰ЌгЂ‚иЎ—й­жј”иЄ¬гЂ‚в–Ѕ18ж™14е€еєі¶з©єжёЇгЂ16е€дё­жњ¬йљї—е…љеєі¶зњЊйЈдјљй•·д»Јзђ‚в–Ѕ19ж™50е€е…Ёж—Ґз©є684дѕїгЃ§зѕЅз”°з©єжёЇгЂ‚в–Ѕ20ж™36е€е…љжњ¬йѓЁгЂ37е€е…љиЎ™ўйЃёеЂ™иЈњи…еђ‘гЃ‘г®гѓ“гѓ‡г‚ЄгѓЎгѓ‚»гѓјг‚ёеЏЋйЊІгЂ‚в–Ѕ21ж™‚гйє»з”џе‰Їз·ЏиЈЃгЃз”е€©е№№дє‹й•·гЂЃ и—¤йЃёеЇѕе§”е“Ўй•·гЂ59е€жќ±дє¬гѓ»иµ¤еќ‚г®иЎ™ўи­°е“Ўе®їи€Ћг‚В
10/26/2021,202110,2021,10,26,202110,2021-10,2021-Oct,Fumio_Kishida,No,No,No,No,No,No,10жњ26ж—Ґ,в–Ѕ8ж™1е€жќ±дє¬гѓ»иµ¤еќ‚г®иЎ™ўи­°е“Ўе®їи€Ћз™єгЂ5е€е®й‚ёгЂ12е€ж–°гЃ—гЃ„иі‡жњ¬дё»зѕ©е®џзЏѕдјљи­°гЂ‚в–Ѕ9ж™47е€й–Ји­°гЂ‚в–Ѕ10ж™11е€еѕЊи—¤еЋљеЉґз›ёгЂ36е€жЈ®е¤–е‹™зњдє‹е±й•·гЂЃжµ…жІјеЋљеЉґзњЃеЌ±ж©џз®Ўзђ»еЊ»е‹™жЉЂиЎ“з·Џж‹¬еЇ©и­°е®г55е€зљ‡е±…г‚ееҐЏг‚в–Ѕ11ж™40е€жќ±дє¬гѓ»д№ќж®µеЌ—г®еЌ»Јз”°еЊєеЅ№ж‰гЂ‚иЎ™ўйЃёгЃ®дёЌењЁиЂ…жЉ•зҐЁгЂ‚в–Ѕ12ж™1е€е®й‚ёгЂ6е€ж°—е™е¤‰е‹•еЇѕз­–жЋЁйЂІгЃ®гЃџг‚ЃгЃ®жњ‰и­и…дјљи­°гЃ®е ±е‘Љж›ёеЏ—г_еЏ–г‚ЉгЂ18е€з§‹и‘‰е›Ѕе®¶е®‰е…Ёдїќйљње±й•·гЂ‚в–Ѕ14ж™‚гиЊЁеџЋзњЊгЃ¤гЃЏг°её‚г®е•Ґ­ж–ЅиЁ­гЂЊгѓ€гѓЉгѓЄг‚Ёгѓ»г‚Їгѓ¬г‚ЄгЂЌе‰ЌгЂ‚иЎ—й­жј”иЄ¬гЂ53е€еђЊзњЊе®€и°·её‚г®еёёзЈђи‡Єе‹•и»ЉйЃ“е®€и°·г‚µгѓјгѓ“г‚№г‚ЁгѓЄг‚ўгЂ‚дј‘ж©гЂ‚в–Ѕ15ж™41е€јЄјІжµ¦е’Њй§…жќ±еЏЈгЂ‚иЎ—й­жј”иЄ¬гЂ‚в–Ѕ16ж™31е€еџјзЋ‰зњЊе’Њееё‚г®жќ±дє¬е¤–з’°и‡Єе‹•и»ЉйЃ“е’ЊееЊ—й›†зґ–™й‡‘ж‰ЂгЂ‚дј‘ж©гЂ‚в–Ѕ17ж™14е€жќ±дє¬йѓЅиҐїжќ±дє¬её‚г®иҐїж­¦з”°з„Ўй§…еЊ—еЏЈгЂ‚иЎ—й­жј”иЄ¬гЂ‚в–Ѕ18ж™8е€жќ±дє¬йѓЅжќ±жќ‘е±±её‚г®иҐїж­¦д№…з±іе·ќй§…еЌ—еЏЈгЂ‚иЎ—й­жј”иЄ¬гЂ‚в–Ѕ19ж™9е€жќ±дє¬йѓЅз«‹е·ќеё‚г®з«‹е·ќи­¦еЇџзЅІгЂ‚дј‘ж©гЂ15е€јЄјІз«‹е·ќй§…еЊ—еЏЈгЂ‚иЎ—й­жј”иЄ¬гЂ‚в–Ѕ20ж™47е€жќ±дє¬гѓ»еЏ°е ґгЃ®гѓ•г‚ёгѓѓ¬гѓ“г‚в–Ѕ21ж™3е€јўјігѓ•г‚ёгЃ®е ±йЃ“з•ЄзµЃ«е‡єжј”г‚в–Ѕ22ж™21е€жќ±дє¬гѓ»иµ¤еќ‚г®иЎ™ўи­°е“Ўе®їи€Ћг‚В
10/27/2021,202110,2021,10,27,202110,2021-10,2021-Oct,Fumio_Kishida,No,No,No,No,YES!,No,10жњ27ж—Ґ,в–Ѕ9ж™28е€жќ±дє¬гѓ»иµ¤еќ‚г®иЎ™ўи­°е“Ўе®їи€Ћз™єгЂ‚в–Ѕ10ж™‚гјЄјІиµ¤зѕЅй§…жќ±еЏЈгЂ‚иЎ—й­жј”иЄ¬гЂ55е€е®й‚ёгЂ‚в–Ѕ11ж™30е€ж—Ґжњ¬гѓ»жќ±еЌ—г‚ўг‚ёг‚ўи«ёе›ЅйЂЈеђ€пј€пјЎјіјҐјЎј®ј‰й¦–и„ідјљи­°гЃ«гѓѓ¬гѓ“дјљи­°ж–№ејЏгЃ§е‡єеё­гЂ‚в–Ѕ13ж™25е€јЄјІеђ‰зҐҐеЇєй§…еЊ—еЏЈгЂ‚иЎ—й­жј”иЄ¬гЂ‚в–Ѕ14ж™17е€жќ±дє¬гѓ»з·ґй¦¬гЃ®иҐїж­¦з·ґй¦¬й§…еЊ—еЏЈгЂ‚иЎ—й­жј”иЄ¬гЂ‚в–Ѕ15ж™22е€е®й‚ёгЂ24е€ж»ќжІўе†…й–Јжѓ…е±е®г‚в–Ѕ16ж™2е€јЎјіјҐјЎј®гѓ—гѓ©г‚№3ј€ж—Ґдё­йџ“пј‰й¦–и„ідјљи­°гЃ«гѓѓ¬гѓ“дјљи­°ж–№ејЏгЃ§е‡єеё­гЂ‚в–Ѕ17ж™35е€јЄјІйїдЅђг‚±и°·й§…еЌ—еЏЈгЂ‚иЎ—й­жј”иЄ¬гЂ‚в–Ѕ18ж™34е€јЄјІж±иў‹й§…жќ±еЏЈгЂ‚иЎ—й­жј”иЄ¬гЂ‚в–Ѕ19ж™9е€жќ±дє¬гѓ»жҐж—ҐгЃ®ж–є¬еЊєз«‹з¤«е·ќе¬ењ’е‰ЌгЂ‚иЎ—й­жј”иЄ¬гЂ48е€е®й‚ёгЂ‚в–Ѕ21ж™18е€жќ±г‚ўг‚ёг‚ўг‚µгѓџгѓѓгѓ€гЃ«гѓѓ¬гѓ“дјљи­°ж–№ејЏгЃ§е‡єеё­гЂ33е€е ±йЃ“еђ„з¤ѕгЃ®г‚¤гѓіг‚їгѓ“гѓҐгѓјгЂ47е€жќ±дє¬гѓ»иµ¤еќ‚г®иЎ™ўи­°е“Ўе®їи€Ћг‚В
10/28/2021,202110,2021,10,28,202110,2021-10,2021-Oct,Fumio_Kishida,No,No,No,No,No,No,10жњ28ж—Ґ,в–Ѕ7ж™9е€жќ±дє¬гѓ»иµ¤еќ‚г®иЎ™ўи­°е“Ўе®їи€Ћз™єгЂ33е€зѕЅз”°з©єжёЇгЂ‚в–Ѕ8ж™48е€гѓЃгѓЈгѓјг‚їгѓјж©џгЃ§йќ’жЈ®з©єжёЇгЂ‚в–Ѕ9ж™21е€йќ’жЈ®её‚г®гЂЊйќ’гЃЈ®е…¬ењ’гЌг‚иЎ—й­жј”иЄ¬гЂ‚в–Ѕ10ж™38е€йќ’жЈ®зњЊе¤§й°ђз”єгЃ®жќ±еЊ—и‡Єе‹•и»ЉйЃ“йїй—Ќзѕ…гѓ‘гѓјг‚­гѓіг‚°г‚ЁгѓЄг‚ўгЂ‚дј‘ж©гЂ‚в–Ѕ11ж™12е€з§‹з”°зњЊе¤§й¤Ёеё‚г®гЂЊгЃ„гЃЁгЃЏе¤§й¤Ёг‚·гѓ§гѓѓ”гѓіг‚°г‚»гѓіг‚їгѓјгЂЌг®й§ђи»ЉеґгЂ‚иЎ—й­жј”иЄ¬гЂ‚в–Ѕ12ж™6е€е¤§й¤ЁиѓЅд»Јз©єжёЇгЂ‚в–Ѕ13ж™6е€гѓЃгѓЈгѓјг‚їгѓјж©џгЃ§ж–°жЅџз©єжёЇгЂ39е€јЄјІж–°жЅџй§…е‰ЌгЂ‚иЎ—й­жј”иЄ¬гЂ‚в–Ѕ14ж™39е€ж–°жЅџз©єжёЇгЂ‚в–Ѕ15ж™28е€гѓЃгѓЈгѓјг‚їгѓјж©џгЃ§иѓЅз™»з©єжёЇгЂ36е€е…љиЎ™ўйЃёеЂ™иЈњи…еђ‘гЃ‘г®гѓ“гѓ‡г‚ЄгѓЎгѓ‚»гѓјг‚ёеЏЋйЊІгЂ‚в–Ѕ16ж™7е€зџіе·ќзњЊијЄеі¶её‚г®гЂЊијЄеі¶гѓћгѓЄгѓіг‚їг‚¦гѓігЂЌг®й§ђи»ЉеґгЂ‚иЎ—й­жј”иЄ¬гЂ‚в–Ѕ17ж™11е€иѓЅз™»з©єжёЇгЂ‚в–Ѕ18ж™20е€гѓЃгѓЈгѓјг‚їгѓјж©џгЃ§й«жќѕз©єжёЇгЂ59е€й«жќѕеё‚г®гЂЊг‚µгѓігѓЎгѓ‚»й¦™е·ќгЌг‚е…љиЎ™ўйЃёеЂ™иЈњи…г®жј”иЄ¬дјљгЃ«е‡єеё­гЃ—гЃжј”иЄ¬гЂ‚в–Ѕ20ж™17е€й«жќѕз©єжёЇгЂ‚в–Ѕ21ж™36е€гѓЃгѓЈгѓјг‚їгѓјж©џгЃ§зѕЅз”°з©єжёЇгЂ‚в–Ѕ22ж™16е€жќ±дє¬гѓ»иµ¤еќ‚г®иЎ™ўи­°е“Ўе®їи€Ћг‚В
10/29/2021,202110,2021,10,29,202110,2021-10,2021-Oct,Fumio_Kishida,No,No,No,No,No,No,10жњ29ж—Ґ,в–Ѕ7ж™19е€жќ±дє¬гѓ»иµ¤еќ‚г®иЎ™ўи­°е“Ўе®їи€Ћз™єгЂ41е€зѕЅз”°з©єжёЇгЂ‚в–Ѕ9ж™32е€гѓЃгѓЈгѓјг‚їгѓјж©џгЃ§й№їе…ђеі¶з©єжёЇгЂ‚в–Ѕ10ж™17е€јЄјІй№їе…ђеі¶дё­е¤®й§…жќ±еЏЈгЂ‚иЎ—й­жј”иЄ¬гЂ‚в–Ѕ11ж™29е€й№їе…ђеі¶зњЊе§¶и‰Їеё‚г®јЄјЎгЃ‚гЃ„г‚‰е§¶и‰Їзµ±ж‹¬ж”Їеє—й§ђи»ЉеґгЂ‚иЎ—й­жј”иЄ¬гЂ‚в–Ѕ12ж™33е€еђЊзњЊж№§ж°ґз”єгЃ®д№ќе·ћи‡Єе‹•и»ЉйЃ“еђ‰жќѕгѓ‘гјг‚­гѓіг‚°г‚ЁгѓЄг‚ўгЂ‚дј‘ж©гЂ‚в–Ѕ13ж™45е€јЄјІе®®еґЋй§…иҐїеЏЈгЂ‚иЎ—й­жј”иЄ¬гЂ‚в–Ѕ14ж™33е€е®®еґЋз©єжёЇгЂ‚в–Ѕ16ж™11е€гѓЃгѓЈгѓјг‚їгѓјж©џгЃ§ж€ђз”°з©єжёЇгЂ59е€јЄјІж€ђз”°й§…жќ±еЏЈгЂ‚иЎ—й­жј”иЄ¬гЂ‚в–Ѕ18ж™25е€еЌ‘‰зњЊдЅђе‰её‚г®дє¬ж€ђгѓ¦гѓјг‚«гѓЄгЃЊдёй§…еЊ—еЏЈгЂ‚иЎ—й­жј”иЄ¬гЂ44е€еђЊеё‚г®дЅђе‰её‚е«иЎ—её‚й…’гЂ…дє•з”єж¶€йІзµђ€еї—жґҐж¶€йІзЅІгЂ‚дј‘ж©гЂ‚в–Ѕ19ж™18е€еђЊзњЊеЌ°иҐїеё‚г®еЊ—з·Џй‰„йЃ“еЌѓи‘‰гѓ‹гѓҐгѓјг‚їг‚¦гѓідё­е¤®й§…еЊ—еЏЈгЂ‚иЎ—й­жј”иЄ¬гЂ‚в–Ѕ20ж™47е€жќ±дє¬гѓ»иµ¤еќ‚г®г‚ёгѓЈгѓјгѓЉгѓЄг‚№гѓ€жЎњдє•г‚€гЃ—гЃ“ж°Џг®дє‹е‹™ж‰гЂ‚в–Ѕ21ж™‚гг‚¤гѓіг‚їгѓјгѓЌгѓѓгѓ€з•ЄзµЃ«е‡єжј”г‚в–Ѕ22ж™21е€жќ±дє¬гѓ»иµ¤еќ‚г®иЎ™ўи­°е“Ўе®їи€Ћг23е€иҐїжќ‘еє·зЁ”е‰ЌзµЊиІЎз›ёгЂ‚В
10/30/2021,202110,2021,10,30,202110,2021-10,2021-Oct,Fumio_Kishida,No,No,No,No,No,No,10жњ30ж—Ґ,в–Ѕ8ж™1е€жќ±дє¬гѓ»иµ¤еќ‚г®иЎ™ўи­°е“Ўе®їи€Ћз™єгЂ13е€јЄјІжќ±дє¬й§…г‚в–Ѕ9ж™1е€гЃЁгЃ307еЏ·гЃ§јЄјІз†Љи°·й§…г35е€еџјзЋ‰зњЊжќ±жќѕе±±её‚г®жќ±ж­¦жќ±дёЉз·љжќ±жќѕе±±й§…жќ±еЏЈгЂ‚иЎ—й­жј”иЄ¬гЂ‚в–Ѕ10ж™30е€еђЊзњЊж‰жІўеё‚г®жќ±ж—Ґжњ¬й«йџйЃ“и·Їж‰жІўз®Ўзђє‹е‹™ж‰гЂ‚дј‘ж©гЂ‚в–Ѕ11ж™8е€јЄјІеЌ—жµ¦е’Њй§…иҐїеЏЈгЂ‚иЎ—й­жј”иЄ¬гЂ‚в–Ѕ12ж™56е€жќ±дє¬йѓЅиЄїеёё‚г®гЃќг°еє—гЊйќ’жњЁе±‹гж·±е¤§еЇєеє—гЌг‚з§ж›ёе®гЃЁжјйЈџг‚ж”ЇжЏґиЂ…г‚‰гЃЁиЁеїµж’®еЅ±гЂ‚в–Ѕ13ж™23е€еђЊеё‚г®дє¬зЋ‹з·љиЄїеё§…еЊ—еЏЈгЂ‚иЎ—й­жј”иЄ¬гЂ‚в–Ѕ15ж™5е€з›ёжЁЎеЋџеё‚еЌ—еЊєгЃ®е°Џз”°жЂҐе°Џз”°еЋџз·љз›ёжЁЎе¤§й‡Ћй§…еЊ—еЏЈгЂ‚иЎ—й­жј”иЄ¬гЂ33е€жќ±дє¬йѓЅз”єз”°её‚г®е•Ґ­ж–ЅиЁ­гЂЊгѓ¬гѓџг‚Јз”єз”°гЂЌе‰ЌгЂ‚иЎ—й­жј”иЄ¬гЂ‚в–Ѕ16ж™53е€жЁЄжµњеё‚жёЇеЊ—еЊєгЃ®жќ±жЂҐжќ±жЁЄз·љж—Ґеђ‰й§…е‰ЌгЂ‚иЎ—й­жј”иЄ¬гЂ‚в–Ѕ17ж™56е€жќ±дє¬гѓ»е¤Єе­ђе‚г®г‚­гѓЈгѓ­гѓѓ€г‚їгѓЇгѓје‰Ќг‚иЎ—й­жј”иЄ¬гЂ‚в–Ѕ18ж™29е€јЄјІе››гѓ„и°·й§…г“з”єеЏЈе‰Ќг‚иЎ—й­жј”иЄ¬гЂ‚в–Ѕ19ж™22е€жќ±дє¬гѓ»е¤§дє•г®йЄжЂҐе¤§дє•з”єг‚¬гѓјгѓѓіе‰Ќг‚иЎ—й­жј”иЄ¬гЂ‚в–Ѕ20ж™8е€е®й‚ёгЂ55е€20г‚«е›Ѕгѓ»ењ°еџџй¦–и„ідјљи­°ј€пј§20г‚µгѓџгѓѓгѓ€пј‰гЃ«гѓѓ¬гѓ“дјљи­°ж–№ејЏгЃ§е‡єеё­гЂ‚в–Ѕ21ж™16е€жќ±дє¬гѓ»иµ¤еќ‚г®иЎ™ўи­°е“Ўе®їи€Ћг‚В
10/31/2021,202110,2021,10,31,202110,2021-10,2021-Oct,Fumio_Kishida,YES!,No,No,No,YES!,No,10жњ31ж—Ґгѓ»11жњ1ж—Ґ,гЂ31ж—ҐгЂ‰в–Ѕ11ж™58е€жќ±дє¬гѓ»иµ¤еќ‚г®иЎ™ўи­°е“Ўе®їи€Ћз™єгЂ‚в–Ѕ12ж™5е€жќ±дє¬гѓ»зґе°ѕдє•з”єгЃ®гѓ›гѓ†гѓ«гѓ‹гѓҐгѓјг‚Єгѓјг‚їгѓ‹г‚еђЊгѓ›гѓ†гѓ«е†…г®гЂЊгг‚ўг‚µгѓ­гѓіе¤§й‡ЋгЌгЃ§ж•Јй«ЄгЂ‚в–Ѕ13ж™36е€жќ±дє¬гѓ»иµ¤еќ‚г®иЎ™ўи­°е“Ўе®їи€Ћг‚в–Ѕ18ж™17е€жќ±дє¬гѓ»зґе°ѕдє•з”єгЃ®гѓ›гѓ†гѓ«гѓ‹гѓҐгѓјг‚Єгѓјг‚їгѓ‹г‚дё­е›Ѕж–™зђ†еє—гЊе¤§и¦іи‹‘гЌгЃ§з§ж›ёе®гЃЁйЈџдє‹г‚ж‰“гЃЎеђ€г‚ЏгЃ›г‚в–Ѕ19ж™43е€е…љжњ¬йѓЁгЂ‚в–Ѕ21ж™3е€жќ±дє¬гѓ»ж°ёз”°з”єгЃ®е…Ёе›Ѕз”єжќ‘дјљй¤ЁиҐїй¤ЁгЂ‚еІёз”°жґѕгЃ®дє‹е‹™ж‰гЃ§гЃ‚гЃ„гЃ•гЃ¤гЂ24е€е…љжњ¬йѓЁгЂ‚в–Ѕ22ж™‚ггѓѓ¬гѓ“еђ„з¤ѕгЃ®е ±йЃ“з•ЄзµЃ«е‡єжј”г49е€гѓ©г‚ёг‚Єеђ¤ѕгЃ®е ±йЃ“з•ЄзµЃ«е‡єжј”г‚в–Ѕ23ж™13е€г‚¤гѓіг‚їгѓјгѓЌгѓѓгѓ€е‹•з”»дё­з¶™г‚µг‚¤гѓ€гЊгѓ‹г‚ігѓ‹г‚іе‹•з”»гЂЌгЃ«е‡єжј”г‚г1ж—ҐгЂ‰в–Ѕ0ж™36е€е ±йЃ“еђ„з¤ѕгЃ®г‚¤гѓіг‚їгѓ“гѓҐгѓјгЂ43е€жќ±дє¬гѓ»иµ¤еќ‚г®иЎ™ўи­°е“Ўе®їи€Ћг‚В
11/1/2021,202111,2021,11,1,202111,2021-11,2021-Nov,Fumio_Kishida,No,No,No,No,YES!,No,11жњ1ж—Ґ,в–Ѕ10ж™44е€жќ±дє¬гѓ»иµ¤еќ‚г®иЎ™ўи­°е“Ўе®їи€Ћз™єгЂ52е€е…љжњ¬йѓЁгЂ53е€е ±йЃ“еђ„з¤ѕгЃ®г‚¤гѓіг‚їгѓ“гѓҐгѓјгЂ‚в–Ѕ11ж™31е€е…љи‡Ёж™‚еЅ№е“Ўдјљг‚в–Ѕ12ж™8е€е®й‚ёгЂ55е€е›Ѕдјљг58е€е±±еЏЈй‚ЈжґҐз”·е…¬жЋе…љд»ЈиЎЁгЃЁдёЋе…ље…љй¦–дјљи«‚в–Ѕ13ж™15е€е…љжњ¬йѓЁгЂ34е€йЃи—¤йЃёеЇѕе§”е“Ўй•·гЂЃе±±жњ¬дїЎжІ»е±±еЅўзњЊе¤©з«Ґеё‚й•·гЂ‚в–Ѕ14ж™‚гиЁи…дјљи¦‹г‚в–Ѕ17ж™21е€иЊ‚жњЁе¤–з›ёгЂ35е€з¦Џз”°з·Џе‹™дјљй•·гЂ43е€е ±йЃ“еђ„з¤ѕгЃ®г‚¤гѓіг‚їгѓ“гѓҐгѓјгЂ49е€е®й‚ёгЂ‚е±йЃ“еђ„з¤ѕгЃ®г‚¤гѓіг‚їгѓ“гѓҐгѓјгЂ55е€ж №жњ¬еЊе…ЋљеЉґз›ёгЂ‚в–Ѕ19ж™14е€жќ±дє¬гѓ»иµ¤еќ‚г®иЎ™ўи­°е“Ўе®їи€Ћг‚В
11/2/2021,202111,2021,11,2,202111,2021-11,2021-Nov,Fumio_Kishida,No,No,No,No,YES!,YES!,11жњ2ж—Ґ,ј€ж—Ґжњ¬ж™‚й–“ј‰в–Ѕ5ж™24е€жќ±дє¬гѓ»иµ¤еќ‚г®иЎ™ўи­°е“Ўе®їи€Ћз™єгЂ47е€зѕЅз”°з©єжёЇгЂ53е€е ±йЃ“еђ„з¤ѕгЃ®г‚¤гѓіг‚їгѓ“гѓҐгѓјгЂ‚в–Ѕ6ж™20е€з¬¬26е›ће›ЅйЂЈж°—е™е¤‰е‹•жћзµЃїжќЎзґ·зґ›Ѕдјљи­°ј€пјЈјЇј°26ј‰й¦–и„ізґљдјљеђ€гЃ«е‡єеё­гЃ®гЃџг‚ЃгЂЃж”їеєње°‚з”Ёж©џгЃ§и‹±еЊ—йѓЁг‚°гѓ©г‚№г‚ґгѓјгЃ«еђ‘г_е‡єз™єгЂ‚пј€зЏѕењ°ж™‚й–“ј‰геЌ€е‰ЌгЂг‚°гѓ©г‚№г‚ґгѓјз©єжёЇгЂ‚г‚°гѓ©г‚№г‚ґгѓјгЃ®јЈјЇј°26дјљеґгЃ§гѓђг‚¤гѓѓіз±іе¤§зµ±й гЃЁзџ­ж™‚й–“дјљи«‚г‚¤гѓігѓ•гѓ©й–‹з™єгЃЁж°—е™е¤‰е‹•гЃ«й–ўгЃ™г‚‹й¦–и„ізґљг‚µг‚¤гѓ‰г‚¤гѓ™гѓігѓ€гЃ«еЏ‚еЉ гЂ‚геЌ€еѕЊгјЈјЇј°26й¦–и„ізґљдјљеђ€гЃ§жј”иЄ¬гЂ‚еђЊг‚µг‚¤гѓ‰г‚¤гѓ™гѓігѓ€гЃ§жј”иЄ¬гЂ‚ж—Ґжњ¬гѓ‘гѓ“гѓЄг‚Єгѓіг‚’и¦–еЇџг‚г‚°гѓѓ¬г‚№е›ЅйЂЈдє‹е‹™з·Џй•·гЃЁдјљи«‚г‚ёгѓ§гѓіг‚Ѕгѓіи‹±й¦–з›ёгЃЁдјљи«‚г‚Єгѓјг‚№гѓ€гѓ©гѓЄг‚ўгЃ®гѓўгѓЄг‚Ѕгѓій¦–з›ёгЃЁдјљи«‚ггѓ€гѓЉгѓгЃ®гѓ•г‚Ўгѓгѓ»гѓџгѓігѓ»гѓЃгѓій¦–з›ёгЃЁдјљи«‚В
11/3/2021,202111,2021,11,3,202111,2021-11,2021-Nov,Fumio_Kishida,No,No,No,No,YES!,YES!,11жњ2ж—Ґгѓ»3ж—Ґ,ј€зЏѕењ°ж™‚й–“ј‰г2ж—ҐгЂ‰геЌ€еѕЊггѓ›гѓ†гѓ«гЂЊгѓЂгѓ–гѓ«гѓѓЄгѓјгѓђг‚¤гѓ’гѓ«гѓ€гѓігѓ»г‚°гѓ©г‚№г‚ґгѓјг‚»гѓігѓ€гѓ©гѓ«гЂЌгЃ§еђЊиЎЊиЁи…е›ЈгЃ®г‚¤гѓіг‚їгѓ“гѓҐгѓјгЂ‚ж”їеєње°‚з”Ёж©џгЃ§и‹±еЊ—йѓЁг‚°гѓ©г‚№г‚ґгѓјйѓЉе¤–г®г‚°гѓ©г‚№г‚ґгѓјз©єжёЇг‚’еєз™єгЂ‚пј€ж—Ґжњ¬ж™‚й–“ј‰г3ж—ҐгЂ‰в–Ѕ13ж™25е€и‹±е›ЅгЃ§гЃ®з¬¬26е›ће›ЅйЂЈж°—е™е¤‰е‹•жћзµЃїжќЎзґ·зґ›Ѕдјљи­°ј€пјЈјЇј°26ј‰й¦–и„ізґљдјљеђ€е‡єеё­г‚’зµ‚гЃ€гЂЃзѕЅз”°з©єжёЇгЂ‚в–Ѕ14ж™8е€жќ±дє¬гѓ»иµ¤еќ‚г®иЎ™ўи­°е“Ўе®їи€Ћг‚В
11/4/2021,202111,2021,11,4,202111,2021-11,2021-Nov,Fumio_Kishida,No,No,No,No,YES!,No,11жњ4ж—Ґ,в–Ѕ9ж™7е€жќ±дє¬гѓ»иµ¤еќ‚г®иЎ™ўи­°е“Ўе®їи€Ћз™єгЂ18е€зљ‡е±…г‚её°е›ЅгЃ®иЁеёігЂ38е€е®й‚ёгЂ50е€ж»ќеґЋе®ж€їе‰Їй•·е®иЈњгЃе¤–е‹™зњЃг®жЈ®ж¬Ўе®гЃеё‚е·ќеЊ—з±іе±й•·гЂ‚в–Ѕ10ж™24е€е ±йЃ“еђ„з¤ѕгЃ®г‚¤гѓіг‚їгѓ“гѓҐгѓјгЂ31е€е…љжњ¬йѓЁгЂ33е€з”е€©е№№дє‹й•·гЂ58е€е®й‚ёгЂ‚в–Ѕ11ж™26е€з”°дё­ж„›жІ»ж—Ґжњ¬з§Ѓз«‹е¤§е­¦йЂЈз›џдјљй•·гЂ‚в–Ѕ12ж™‚гй»’з”°жќ±еЅ¦ж—ҐйЉз·ЏиЈЃгЃЁдјљйЈџг‚в–Ѕ13ж™40е€и¶Љж™єе…‰е¤«еєі¶е¤§е­¦й•·гЂ55е€иЊ‚жњЁж–°е№№дє‹й•·гЂ‚в–Ѕ17ж™20е€ж №жњ¬еЊе…ЋљеЉґз›ёгЂ41е€з§‹и‘‰е›Ѕе®¶е®‰е…Ёдїќйљње±й•·гЂЃж»ќжІўе†…й–Јжѓ…е±е®гЃеІЎй‡Ће¤–е‹™зњЃз·Џеђ€е¤–дє¤ж”їз­–е±й•·гЂІиЎ›зњЃгЃ®еў—з”°йІиЎ›ж”їз­–е±й•·гЂЃе±±еґЋзµ±еђ€е№•ей•·гЂ‚в–Ѕ18ж™25е€е±±еґЋеЏ‚дёЋг‚в–Ѕ20ж™38е€жќ±дє¬гѓ»иµ¤еќ‚г®иЎ™ўи­°е“Ўе®їи€Ћг‚В
11/5/2021,202111,2021,11,5,202111,2021-11,2021-Nov,Fumio_Kishida,No,No,No,No,No,No,11жњ5ж—Ґ,в–Ѕ9ж™51е€жќ±дє¬гѓ»иµ¤еќ‚г®иЎ™ўи­°е“Ўе®їи€Ћз™єгЂ56е€е®й‚ёгЂ‚в–Ѕ10ж™4е€й–Ји­°гЂ18е€еѕЊи—¤еЋљеЉґз›ёгЂ20е€е±±еЏЈз’°еў›ёгЂ24е€и‹Ґе®®дё‡еЌљз›ёгЂ27е€иђ©з”џз”°зµЊз”Јз›ёгЂ43е€й€ґжњЁиІЎе‹™з›ёгЂЃиІЎе‹™зњЃгЃ®зџўй‡Ћж¬Ўе®гЃиЊ¶и°·дё»иЁ€е±й•·гЂ‚в–Ѕ11ж™37е€иІЎе‹™з›ёгЂ45е€жЈ®з”°дјљиЁ€ж¤њжџ»й™ўй•·гЃ‹г‚‰2020е№ґеє¦ж±єз®—ж¤њжџ»е ±е‘ЉеЏ—гЃ‘еЏ–г‚Љг‚в–Ѕ14ж™5е€ж»ќжІўе†…й–Јжѓ…е±е®г49е€ж°‘й–“ж”ѕйЂ70е‘Ёе№ґиЁеїµе…Ёе›Ѕе¤§дјљеђ‘гЃ‘г®гѓ“гѓ‡г‚ЄгѓЎгѓ‚»гѓјг‚ёеЏЋйЊІгЂ‚в–Ѕ15ж™‚ги—¤дє•е®ж€їе‰Їй•·е®иЈњгЃиї«дє•ж–°ећ‹г‚ігѓ­гѓЉг‚¦г‚¤гѓ«г‚№ж„џжџ“з—‡еЇѕз­–жЋЁйЂІе®¤й•·гЂЃеЋљеЉґзњЃг®еђ‰з”°ж¬Ўе®гЃз¦Џеі¶еЊ»е‹™жЉЂз›ЈгЂЃдјЉеЋџеЊ»ж”їе±й•·гЂЃдЅђеЋџеЃҐеє·е±й•·гЂ‚в–Ѕ16ж™6е€йЃи—¤йЃёеЇѕе§”е“Ўй•·гЂ55е€е±±йљ›зµЊиІЎз›ёгЂЃжњЁеЋџе®ж€їе‰Їй•·е®гЃи—¤дє•е‰Їй•·е®иЈњгЃж–°еЋџж–°гЃ—гЃ„иі‡жњ¬дё»зѕ©е®џзЏѕжњ¬йѓЁдє‹е‹™е±й•·д»ЈзђЃей–Јеєњг®з”°е’Њж¬Ўе®гЃжќ‘зЂ¬ж”їз­–зµ±ж‹¬е®г‚в–Ѕ17ж™35е€еі¶з”°йІиЎ›ж¬Ўе®г‚в–Ѕ19ж™32е€жќ±дє¬гѓ»иµ¤еќ‚г®иЎ™ўи­°е“Ўе®їи€Ћг‚В
11/6/2021,202111,2021,11,6,202111,2021-11,2021-Nov,Fumio_Kishida,No,No,No,No,No,No,11жњ6ж—Ґ,гЂзµ‚ж—ҐгЂЃжќ±дє¬гѓ»иµ¤еќ‚г®иЎ™ўи­°е“Ўе®їи€ЋгЃ§йЃЋгЃ”гЃ™г‚В
11/7/2021,202111,2021,11,7,202111,2021-11,2021-Nov,Fumio_Kishida,No,No,No,No,No,No,11жњ7ж—Ґ,в–Ѕ9ж™47е€жќ±дє¬гѓ»иµ¤еќ‚г®иЎ™ўи­°е“Ўе®їи€Ћз™єгЂ51е€е®й‚ёгЂ‚в–Ѕ10ж™19е€й™ёдёЉи‡ЄиЎ›йљЉгѓгѓЄг‚ігѓ—г‚їгѓјгЃ§жЁЄжµњеё‚дё­еЊєгЃ®жЁЄжµњжµ·дёЉдїќе®‰йѓЁжЁЄжµњжµ·дёЉйІзЃЅеџєењ°гЂ‚йЃЯе­ђз·Џе‹™з›ёгЂЃеІёйІиЎ›з›ёгЂЃдєЊд№‹ж№ЇйІзЃЅз›ёгЂ»’еІ©зҐђжІ»зҐћеҐ€е·ќзњЊзџҐдє‹гЃе±±дё­з«№жҐжЁЄжµњеё‚й•·г‚‰еєиїЋгЃ€гЂ32е€еђЊеё‚иҐїеЊєгЃ®гЂ9йѓЅзњЊеё‚еђ€еђЊйІзЃЅиЁ“з·ґгЂЌдјљеґгЂ35е€е€ќжњџж¶€зЃ«иЁ“з·ґг‚’дЅ“йЁ“г40е€ж•‘еєж•‘еЉ©иЁ“з·ґгЃЄгЃ©г‚’и¦–еЇџг‚в–Ѕ12ж™‚гй–‰дјљејЏгЃ«е‡єеё­гЂ‚гЃ‚гЃЃ•гЃ¤гЂ21е€жЁЄжµњжµ·дёЉдїќе®‰йѓЁжЁЄжµњжµ·дёЉйІзЃЅеџєењ°гЂ36е€й™ёи‡ЄгѓгѓЄгЃ§е®й‚ёе±‹дёЉггѓЄгѓќгјгѓ€г41е€е…¬й‚ёгЂ‚в–Ѕ13ж™24е€жњЁеЋџе®ж€їе‰Їй•·е®г‚в–Ѕ15ж™27е€й€ґжњЁиІЎе‹™з›ёгЂЃжњЁеЋџе‰Їй•·е®гЃиІЎе‹™зњЃгЃ®зџўй‡Ћж¬Ўе®гЃиЊ¶и°·дё»иЁ€е±й•·гЂ‚в–Ѕ18ж™8е€жњЁеЋџе‰Їй•·е®г17е€жќ±дє¬гѓ»иµ¤еќ‚г®иЎ™ўи­°е“Ўе®їи€Ћг‚В
11/8/2021,202111,2021,11,8,202111,2021-11,2021-Nov,Fumio_Kishida,No,No,No,No,No,No,11жњ8ж—Ґ,в–Ѕ9ж™19е€жќ±дє¬гѓ»иµ¤еќ‚г®иЎ™ўи­°е“Ўе®їи€Ћз™єгЂ22е€е®й‚ёгЂ23е€дё­и°·е…»е…ІиЎ›з›ёгЂ‚в–Ѕ10ж™1е€з§‹и‘‰е›Ѕе®¶е®‰е…Ёдїќйљње±й•·гЂЃе¤–е‹™зњЃг®жЈ®ж¬Ўе®гЃи€№и¶Љг‚ўг‚ёг‚ўе¤§жґ‹е·ће±й•·гЂ50е€зџіе·ќж‹‰и‡ґе•ЏйЎЊеЇѕз­–жњ¬йѓЁдє‹е‹™е±й•·гЂ‚в–Ѕ11ж™41е€дё‰жњЁи°·жµ©еЏІж–°зµЊжё€йЈз›џд»ЈиЎЁзђє‹г‚в–Ѕ13ж™36е€жќ±дє¬гѓ»е…µ¤еќ‚г®иµ¤еќ‚еѕЎз”Ёењ°гЂ‚з§‹зЇе®®й‚ёгЃ§ж•…е·ќе¶‹иѕ°еЅ¦е­¦зї’й™ўе¤§еђЌиЄ‰ж•™жЋ€г®еј”е•ЏгЃ®иЁеёігЂ45е€е®й‚ёгЂ‚в–Ѕ14ж™55е€е¤§ж©‹ее¤«е›Ѕж°‘ж”їжІ»еЌ”дјљд»ЈиЎЁзђє‹г»дјљй•·гЂ‚в–Ѕ15ж™19е€й€ґжњЁз›ґйЃ“еЊ—жµ·йЃ“зџҐдє‹гЃд»Ѓеќ‚еђ‰дјёе’Њж­Ње±±зњЊзџҐдє‹гЃжњЌйѓЁиЄе¤ЄйѓЋз¦ЏеІЎзњЊзџҐдє‹гЃеє¬е‹ќиІће¤§е€њЊзџҐдє‹гЃ‹г‚‰жЏђиЁж›ёеЏ—г_еЏ–г‚ЉгЂ41е€е®‡з”°дјёеєі¶зњЊи­°гЂ‚в–Ѕ16ж™3е€е±±йљ›зµЊиІЎз›ёгЂЃе¤§еі¶еЋљеЉґзњЃж”їз­–зµ±ж‹¬е®г17е€зµЊиІЎз›ёгЂЃей–Јеєњг®з”°е’Њж¬Ўе®гЃдє•дёЉей–ЈеєњеЇ©и­°е®гЃжћ—ж”їз­–зµ±ж‹¬е®г‚в–Ѕ17ж™‚гж–°гЃ—гЃ„иі‡жњ¬дё»зѕ©е®џзЏѕдјљи­°гЂ‚в–Ѕ19ж™59е€жќ±дє¬гѓ»иµ¤еќ‚г®иЎ™ўи­°е“Ўе®їи€Ћг‚В
11/9/2021,202111,2021,11,9,202111,2021-11,2021-Nov,Fumio_Kishida,No,No,No,No,No,No,11жњ9ж—Ґ,в–Ѕ9ж™7е€жќ±дє¬гѓ»иµ¤еќ‚г®иЎ™ўи­°е“Ўе®їи€Ћз™єгЂ14е€е…љжњ¬йѓЁгЂ31е€е…љеЅ№е“Ўдјљг56е€е®й‚ёгЂ‚в–Ѕ10ж™22е€зљ‡е±…г‚е¤§з¶¬з«и¦ЄжЋ€ејЏг57е€е®й‚ёгЂ58е€й€ґжњЁи‹±ж•¬иЎ™ўи­°е“ЎгЂ‚в–Ѕ11ж™20е€г‚ігѓ­гѓігѓ“г‚ўгЃ®гѓ©гѓџгѓ¬г‚№е‰Їе¤§зµ±й е…је¤–з›ёгЃ®иЎЁж•¬гЂ‚в–Ѕ12ж™2е€жќ±дє¬гѓ»иҐїж–°ж©‹г®жќ±дє¬ж…€жµдјљеЊ»е¤§д»е±ћз—…й™ўгЂ‚е®љжњџеЃҐеє·иЁєж–­гЂ‚в–Ѕ13ж™12е€е®й‚ёгЂ28е€ж №жњ¬еЊе…ЋљеЉґз›ёгЂ‚в–Ѕ14ж™2е€зљ‡е±…г‚й‡ее…‰з«дјќйЃ”ејЏг41е€е®й‚ёгЂ‚в–Ѕ15ж™19е€жњ›жњ€й§ђг‚¬гѓјгѓЉе¤§дЅїгЂ«ж©‹й§ђггѓ¬гѓјг‚·г‚ўе¤§дЅїгЂЃжћ—й§ђгѓ–гѓ©г‚ёгѓ«е¤§дЅїг‚‰г25е€з§‹и‘‰е›Ѕе®¶е®‰е…Ёдїќйљње±й•·гЂЃжЈ®е¤–е‹™ж¬Ўе®г36е€иЊ‚жњЁе№№дє‹й•·гЂ‚в–Ѕ16ж™11е€дё­з©єйє»еҐ€зµЊжё€иІЎж”їи«®е•Џдјљи­°и­°е“ЎгЃ«иѕћд»¤дє¤д»г‚е±±йљ›зµЊиІЎз›ёеђЊеё­гЂ21е€зµЊжё€иІЎж”їи«®е•Џдјљи­°гЂ‚в–Ѕ17ж™17е€е…Ёдё–д»Јећ‹з¤ѕдјљдїќйљњж§‹зЇ‰дјљи­°гѓ»е…¬зљѕЎж ји©•дѕЎж¤њиЁЋе§”е“Ўдјљеђ€еђЊдјљи­°гЂ49е€е¤§иҐїйІиЎ›ж”їе‹™е®г‚в–Ѕ18ж™31е€е›Ѕе®¶е®‰е…Ёдїќйљње±й•·гЂЃж»ќжІўе†…й–Јжѓ…е±е®гЃжЁЄе°ѕе…¬е®‰иЄїжџ»еєЃж¬Ўй•·гЂ51е€е†…й–Јжѓ…е±е®г‚в–Ѕ19ж™40е€жќ±дє¬гѓ»иµ¤еќ‚г®иЎ™ўи­°е“Ўе®їи€Ћг‚В
11/10/2021,202111,2021,11,10,202111,2021-11,2021-Nov,Fumio_Kishida,No,No,No,No,No,No,11жњ10ж—Ґ,в–Ѕ8ж™48е€жќ±дє¬гѓ»иµ¤еќ‚г®иЎ™ўи­°е“Ўе®їи€Ћз™єгЂ52е€е®й‚ёгЂ‚в–Ѕ9ж™1е€й–Ји­°гЂ31е€еІЎжќ‘еЏ‚дёЋг‚в–Ѕ10ж™10е€и‹Ґе®®гЃѕгЃЎгѓ»гЃІгЃЁгѓ»гЃ—гЃ”гЃЁе‰µз”џж‹…еЅ“з›ёгЂЃе°Џжћ—гѓ‚ёг‚їгѓ«е‰Їе¤§и‡ЈгЂЃжњЁеЋџе®ж€їе‰Їй•·е®гЃи—¤дє•е®ж€їе‰Їй•·е®иЈњг«еЋџгѓ‚ёг‚їгѓ«з”°ењ’йЅеё‚е›Ѕе®¶ж§‹жѓіе®џзЏѕдјљи­°дє‹е‹™е±й•·гЂЃжќ‘дёЉгѓ‡г‚ёг‚їгѓ«еєЃзµ±ж‹¬е®г‚в–Ѕ11ж™30е€е±±еЏЈй‚ЈжґҐз”·е…¬жЋе…љд»ЈиЎЁгЃЁдјљйЈџг‚в–Ѕ12ж™2е€иЊ‚жњЁе№№дє‹й•·гЂЃе¬жЋе…љгЃ®д»ЈиЎЁгЂЃзџідє•е•“дёе№№дє‹й•·гЂ18е€е…љжњ¬йѓЁгЂ21е€е…љдёЎй™ўи­°е“Ўз·Џдјљг53е€е›Ѕдјљг‚в–Ѕ13ж™2е€иЎ™ўжњ¬дјљи­°гЂ‚в–Ѕ14ж™58е€з¬¬101д»Јй¦–з›ёгЃ«жЊ‡еђЌгЂ‚в–Ѕ15ж™26е€иЎ™ўгЃ®ж­Је‰Їи­°й•·гЂЃдёЋй‡же…љеђ„дјљжґѕгЃ«гЃ‚гЃ„гЃ•гЃ¤е›ћг‚ЉгЂ‚е№№дє‹й•·гЂ«жњЁе›ЅеЇѕе§”е“Ўй•·еђЊиЎЊг46е€еЏ‚й™ўгЃ®ж­Је‰Їи­°й•·гЂЃи­°йЃ‹е§”е“Ўй•·гЂЃдёЋй‡же…љеђ„дјљжґѕгЃ«гЃ‚гЃ„гЃ•гЃ¤е›ћг‚ЉгЂ‚дё–и•еЏ‚й™ўе№№дє‹й•·гЂЃеІЎз”°еЏ‚й™ўе›ЅеЇѕе§”е“Ўй•·еђЊиЎЊг‚в–Ѕ16ж™13е€е®й‚ёгЂ14е€е…¬жЋе…љд»ЈиЎЁгЃЁдёЋе…ље…љй¦–дјљи«‚жќѕй‡Ће®ж€їй•·е®гЃе№№дє‹й•·гЂЃе¬жЋе…ље№№дє‹й•·еђЊеё­гЂ27е€зµ–Јжњ¬йѓЁиЁ­зЅ®гЂ35е€ж–°й–Јеѓљг®е‘јгЃіиѕјгЃїгЂ‚в–Ѕ17ж™7е€дё­и°·е…Ѓжќ‘дє•и‹±жЁ№дёЎиЎ™ўи­°е“ЎгЂЃжЈ®й›…е­ђеЏ‚й™ўи­°е“ЎгЂ42е€зљ‡е±…г‚ееҐЏг¦–з›ёд»»е‘ЅејЏг–ЈеѓљиЄЌиЁјејЏг‚в–Ѕ20ж™40е€е®й‚ёгЂ‚в–Ѕ21ж™1е€иЁи…дјљи¦‹г‚в–Ѕ22ж™‚геђ–ЈеѓљгЃ«иЈњи·иѕћд»¤дє¤д»г15е€е€ќй–Ји­°гЂ37е€й–ЈеѓљгЃЁиЁеїµж’®еЅ±гЂ40е€й¦–з›ёиЈњдЅђе®г‚‰гЃ«иѕћд»¤дє¤д»г47е€й¦–з›ёиЈњдЅђе®г‚‰гЃЁиЁеїµж’®еЅ±гЂ‚в–Ѕ23ж™16е€жќ±дє¬гѓ»иµ¤еќ‚г®иЎ™ўи­°е“Ўе®їи€Ћг‚В
11/11/2021,202111,2021,11,11,202111,2021-11,2021-Nov,Fumio_Kishida,No,No,No,No,No,No,11жњ11ж—Ґ,в–Ѕ9ж™8е€жќ±дє¬гѓ»иµ¤еќ‚г®иЎ™ўи­°е“Ўе®їи€Ћз™єгЂ12е€е®й‚ёгЂ17е€е°Џжћ—зµЊжё€е®‰дїќз›ёгЂЃз§‹и‘‰е›Ѕе®¶е®‰е…Ёдїќйљње±й•·гЂ57е€иЏ…е‰Ќй¦–з›ёг‚’еєиїЋгЃ€гЂ58е€е‰Ќй¦–з›ёгЂ‚в–Ѕ10ж™20е€е‰Ќй¦–з›ёг‚’и¦‹йЃг‚ЉгЂ32е€гѓ‚ёг‚їгѓ«з”°ењ’йЅеё‚е›Ѕе®¶ж§‹жѓіе®џзЏѕдјљи­°гЂ‚в–Ѕ11ж™29е€јЎј°јҐјЈгѓ“г‚ёгѓЌг‚№и«®е•Џе§”е“Ўдјљпј€пјЎјўјЎјЈј‰ж—Ґжњ¬е§”е“ЎгЃ®дё­ж›Ѕе®Џе¤§е’Њз·Џз”зђ†дє‹й•·г‚‰гЃ‹г‚‰жЏђиЁж›ёеЏ—г_еЏ–г‚ЉгЂ‚й€ґжњЁе¤–е‹™еЇ©и­°е®гЃжќѕе°ѕзµЊз”Јзњље•†ж”їз­–е±й•·еђЊеё­гЂ49е€е±±еЏЈзњЊг®жќ‘еІЎе—Јж”їзџҐдє‹гЃжџіе±…дїЉе­¦зњЊи­°дјљи­°й•·гЂЃз¦Џз”°и‰ЇеЅ¦еІ©е›Ѕеё‚й•·г‚‰г‚жќѕй‡Ће®ж€їй•·е®еђЊеё­гЂ‚в–Ѕ12ж™3е€жќ±дє¬гѓ»ж°ёз”°з”єгЃ®е…Ёе›Ѕз”єжќ‘дјљй¤ЁиҐїй¤ЁгЂ‚еІёз”°жґѕгЃ®дјљеђ€гЃ«е‡єеё­гЃ—гЃгЃ‚гЃЃ•гЃ¤гЂ51е€жќ±дє¬гѓ»дёёгЃ®е†…г®жќ±дє¬е›Ѕйљ›гѓ•г‚©гѓјгѓ©гѓгЂ‚е•†е·Ґдјље…Ёе›Ѕе¤§дјљгЃ«е‡єеё­гЃ—гЃгЃ‚гЃЃ•гЃ¤гЂ‚в–Ѕ13ж™27е€е®й‚ёгЂ55е€е›Ѕе®¶е®‰е…Ёдїќйљње±й•·гЂЃж»ќжІўе†…й–Јжѓ…е±е®гЃеІЎй‡Ће¤–е‹™зњЃз·Џеђ€е¤–дє¤ж”їз­–е±й•·гЂІиЎ›зњЃгЃ®еў—з”°йІиЎ›ж”їз­–е±й•·гЂЃе±±еґЋзµ±еђ€е№•ей•·гЂ‚в–Ѕ14ж™27е€г‚ўг‚­гѓЄгѓјгѓЋз±іг‚¤гѓігѓ‰е¤Єе№іжґ‹и»ЌеЏёд»¤е®г®иЎЁж•¬гЂ‚в–Ѕ15ж™1е€и‡Ёж™‚й–Ји­°гЂ7е€иђ©з”џз”°зµЊз”Јз›ёгЂ45е€еЌЃе‰й›…е’ЊзµЊе›ЈйЂЈдјљй•·гЂЃдё‰жќ‘жЋе¤«ж—Ґжњ¬е•·Ґдјљи­°ж‰дјљй­гЂЃжЎњз”°и¬™ж‚џзµЊжё€еђЊеЏ‹дјљд»ЈиЎЁе№№дє‹г‚в–Ѕ16ж™29е€зљ‡е±…г‚ееҐЏгЃе‰Їе¤§и‡ЈиЄЌиЁјејЏг‚в–Ѕ18ж™40е€е®й‚ёгЂ‚в–Ѕ19ж™21е€е‰Їе¤§и‡ЈгЃЁиЁеїµж’®еЅ±гЂ29е€е‰Їе¤§и‡Јдјљи­°гЂ‚в–Ѕ20ж™15е€ж”їе‹™е®гЃ«иѕћд»¤дє¤д»г30е€ж”їе‹™е®гЃЁиЁеїµж’®еЅ±гЂ36е€ж”їе‹™е®дјљеђ€гЂ‚в–Ѕ21ж™20е€г‚ўг‚ёг‚ўе¤Єе№іжґ‹зµЊжё€еЌ”еЉ›дјљи­°ј€пјЎј°јҐјЈј‰еЏ‚еЉе›Ѕй¦–и„ігЃЁјЎјўјЎјЈгЃЁгЃ®г‚Єгѓігѓ©г‚¤гѓіеЇѕи©±гЂ46е€жќ±дє¬гѓ»иµ¤еќ‚г®иЎ™ўи­°е“Ўе®їи€Ћг‚В
11/12/2021,202111,2021,11,12,202111,2021-11,2021-Nov,Fumio_Kishida,No,No,No,No,YES!,No,11жњ12ж—Ґ,в–Ѕ8ж™43е€жќ±дє¬гѓ»иµ¤еќ‚г®иЎ™ўи­°е“Ўе®їи€Ћз™єгЂ48е€е®й‚ёгЂ‚в–Ѕ9ж™1е€й–Ји­°гЂ20е€ж–°ећ‹г‚ігѓ­гѓЉг‚¦г‚¤гѓ«г‚№ж„џжџ“з—®ж”їеєњеЇѕз­–жњ¬йѓЁгЂ49е€зџіз”°зњџж•Џе…·Џе‹™з›ёгЂЃе®®жІўжґ‹дёе…µЊз”Јз›ёгЂ‚в–Ѕ10ж™40е€е›Ѕдјљг‚в–Ѕ11ж™1е€з¬¬206з‰№е€Ґе›Ѕдјљй–‹дјљејЏг12е€е®й‚ёгЂ40е€жќѕе·ќж­Је‰‡жІ–зёњЊе®њй‡жж№ѕеё‚й•·гЂ‚в–Ѕ12ж™5е€жќ±дє¬гѓ»ж°ёз”°з”єгЃ®г‚¶гѓ»г‚­гѓЈгѓ”гѓ€гѓ«гѓ›гѓ†гѓ«жќ±жЂҐгЂ‚дё­е›Ѕж–™зђ†еє—гЊжџг‚±еІЎгЂЌгЃ§е°Џй‡жеЇєдє”е…ёе…ІиЎ›з›ёгЂЃдїќеІЎе®Џж­¦иЎ™ўи­°е“ЎгЃЁдјљйЈџг58е€е®й‚ёгЂ‚в–Ѕ13ж™21е€з¦Џз”°з·Џе‹™дјљй•·гЂ51е€ж»ќеґЋе®ж€їе‰Їй•·е®иЈњгЃжЈ®е¤–е‹™ж¬Ўе®г‚в–Ѕ14ж™22е€жІій‡Ћеє±жњ¬йѓЁй•·гЂ48е€ж”їеєњзЁЋе€¶иЄїжџ»дјљг‚в–Ѕ15ж™1е€ж»ќжІўе†…й–Јжѓ…е±е®г37е€жќ±дє¬гѓ»дё‰з•Єз”єгЃ®е®®е†…еєЃееєЃигЂ‚е°±д»»гЃ®иЁеёігЂ54е€жќ±дє¬гѓ»е…µ¤еќ‚г®иµ¤еќ‚еѕЎз”Ёењ°гЂ‚з§‹зЇе®®й‚ёгЂЃдё‰з¬е®®жќ±й‚ёгЂЃдё‰з¬е®®й‚ёгЂ«ее®®й‚ёгЃ§е°±д»»гЃ®иЁеёігЂ‚в–Ѕ16ж™29е€жќ±дє¬гѓ»жќ±гЃ®еёёй™ёе®®й‚ёгЂ‚е°±д»»гЃ®иЁеёігЂ46е€е®й‚ёгЂ‚в–Ѕ17ж™4е€еѕЊи—¤еЋљеЉґз›ёгЂ32е€е›ЅгЃЁењ°ж–№гЃ®еЌ”и­°гЃ®е ґгЂ‚в–Ѕ18ж™19е€жќ±дє¬гѓ»зҐћз”°йЊ¦з”єгЃ®гЂЊгЃЎг‚€гЃ гѓ—гѓ©гѓѓ€гѓ•г‚©гѓјгѓг‚№г‚Їг‚¦г‚§г‚ўгЂЌг‚дјЃжҐ­зµЊе–¶иЂ…г‚‰гЃЁи»Љеє§гЃ§ж„Џи¦‹дє¤жЏ›г‚в–Ѕ19ж™11е€е ±йЃ“еђ„з¤ѕгЃ®г‚¤гѓіг‚їгѓ“гѓҐгѓјгЂ31е€е®й‚ёгЂ33е€еЋљеЉґз›ёгЂ‚в–Ѕ20ж™50е€г‚ўг‚ёг‚ўе¤Єе№іжґ‹зµЊжё€еЌ”еЉ›дјљи­°ј€пјЎј°јҐјЈј‰й¦–и„ігѓѓ¬гѓ“й›»и©±дјљи­°гЂ‚в–Ѕ21ж™41е€жќ±дє¬гѓ»иµ¤еќ‚г®иЎ™ўи­°е“Ўе®їи€Ћг‚В
11/13/2021,202111,2021,11,13,202111,2021-11,2021-Nov,Fumio_Kishida,YES!,No,No,No,No,No,11жњ13ж—Ґ,гЂеЌ€е‰Ќдё­гЃЇжќ±дє¬гѓ»иµ¤еќ‚г®иЎ™ўи­°е“Ўе®їи€ЋгЃ§йЃЋгЃ”гЃ™г‚в–Ѕ13ж™37е€иЎ™ўи­°е“Ўе®їи€Ћз™єгЂ45е€жќ±дє¬гѓ»е№іжІіз”єгЃ®з ‚йІдјљй¤Ёе€Ґй¤ЁгЂ‚в–Ѕ14ж™1е€дјљи­°е®¤гЂЊе€©ж №гЂЌгЃ§еЊ—жњќй®®гЃ«г‚€г‚‹ж‹‰и‡ґе•ЏйЎЊг®е›Ѕж°‘е¤§й›јљгЃ«е‡єеё­гЃ—гЃгЃ‚гЃЃ•гЃ¤гЂ54е€жќ±дє¬гѓ»иµ¤еќ‚г®иЎ™ўи­°е“Ўе®їи€Ћг‚в–Ѕ17ж™1е€жќ±дє¬гѓ»е…­з•Єз”єгЃ®гЂЊг‚«гѓѓ€гѓ»г‚¤гѓігѓ»г‚Ѕгѓјгѓ¬йє№з”єеє—гЌг‚ж•Јй«ЄгЂ‚в–Ѕ18ж™38е€жќ±дє¬гѓ»иµ¤еќ‚г®иЎ™ўи­°е“Ўе®їи€Ћг54е€жќ±дє¬гѓ»и‹Ґи‘‰г®гѓ•гѓ©гѓіг‚№ж–™зђ†еє—гЊг‚Єгѓѓ«гѓ»гѓ‰г‚Ґгѓ»гѓџг‚Їгѓ‹гЌг‚иЈ•е­ђе¤«дєєгЃЁйЈџдє‹г‚в–Ѕ21ж™20е€жќ±дє¬гѓ»иµ¤еќ‚г®иЎ™ўи­°е“Ўе®їи€Ћг‚В
11/14/2021,202111,2021,11,14,202111,2021-11,2021-Nov,Fumio_Kishida,No,No,No,No,No,No,,
11/15/2021,202111,2021,11,15,202111,2021-11,2021-Nov,Fumio_Kishida,No,No,No,No,No,No,11жњ14ж—Ґгѓ»15ж—Ґ,гЂ14ж—ҐгЂ‰гзµ‚ж—ҐгЂЃжќ±дє¬гѓ»иµ¤еќ‚г®иЎ™ўи­°е“Ўе®їи€ЋгЃ§йЃЋгЃ”гЃ™г‚г15ж—ҐгЂ‰в–Ѕ9ж™28е€иЎ™ўи­°е“Ўе®їи€Ћз™єгЂ31е€е®й‚ёгЂ‚в–Ѕ10ж™5е€е±±йљ›зµЊиІЎз›ёгЂЃей–Јеєњг®з”°е’Њж¬Ўе®гЃдє•дёЉей–ЈеєњеЇ©и­°е®гЃжћ—ж”їз­–зµ±ж‹¬е®г35е€зҐћз”°иІЎе‹™е®г‚в–Ѕ11ж™5е€з§‹и‘‰е›Ѕе®¶е®‰е…Ёдїќйљње±й•·гЂЃеІЎй‡Ће¤–е‹™зњЃз·Џеђ€е¤–дє¤ж”їз­–е±й•·гЂЃеў—з”°йІиЎ›зњЃйІиЎ›ж”їз­–е±й•·гЂ16е€дё­жєжі‰е›ЅйЂЈдє‹е‹™ж¬Ўй•·гѓ»и»Ќзё®ж‹…еЅ“дёЉзґљд»ЈиЎЁгЃ®иЎЁж•¬гЂ30е€з‰§еі¶гѓ‚ёг‚їгѓ«з›ёгЂЃе°Џжћ—гѓ‚ёг‚їгѓ«е‰Їе¤§и‡ЈгЂЃи—¤дє•е®ж€їе‰Їй•·е®иЈњгЃгѓ‡г‚ёг‚їгѓ«еєЃг®зџіеЂ‰гѓ‡г‚ёг‚їгѓ«з›ЈгЂЃиµ¤зџігѓ‚ёг‚їгѓ«еЇ©и­°е®гЃеЁе®‰зµ±ж‹¬е®г53е€еѕЊи—¤еЋљеЉґз›ёгЂ‚в–Ѕ13ж™53е€жќ‘дє•иЈњдЅђе®г‚в–Ѕ14ж™37е€е±±еЏЈз’°еў›ёгЂЃеҐ€й€й‡жзµЊз”ЈзњЃз”ЈжҐ­жЉиЎ“з’°еў±й•·гЂЃе°Џй‡жз’°еўњЃењ°зђ’°еў±й•·гЂ‚в–Ѕ15ж™10е€й•·еґЋе№ёе¤ЄйѓЋе±±жўЁзњЊзџҐдє‹г‚дё­и°·зњџдёиЎ™ўи­°е“Ўг‚‰еђЊеё­гЂ‚в–Ѕ17ж™3е€еєі¶зњЊеЊ—еєі¶з”єгЃ®з®•й‡жеЌљеЏёз”єй•·гЂЃж№ЉдїЉж–‡з”єи­°дјљи­°й•·гЂ35е€гѓ•гѓ©гѓіг‚№гЃ®гѓћг‚Їгѓ­гѓіе¤§зµ±й гЃЁй›»и©±гЂ‚в–Ѕ18ж™58е€жќ±дє¬гѓ»иµ¤еќ‚г®иЎ™ўи­°е“Ўе®їи€Ћг‚В
11/16/2021,202111,2021,11,16,202111,2021-11,2021-Nov,Fumio_Kishida,No,No,No,No,No,No,11жњ16ж—Ґ,в–Ѕ8ж™42е€жќ±дє¬гѓ»иµ¤еќ‚г®иЎ™ўи­°е“Ўе®їи€Ћз™єгЂ49е€е…љжњ¬йѓЁгЂ‚в–Ѕ9ж™‚гйє»з”џе‰Їз·ЏиЈЃгЃиЊ‚жњЁе№№дє‹й•·гЂ34е€е…љеЅ№е“Ўдјљг56е€е®й‚ёгЂ‚в–Ѕ10ж™‚гй–Ји­°гЂ‚в–Ѕ11ж™8е€ж–‰и—¤е›Ѕдє¤з›ёгЂЃи—¤дє•е›Ѕдє¤еЇ©и­°е®гЃе’Њз”°и¦іе…‰еє•·е®г58е€й‡‘е­ђз·Џе‹™з›ёгЂЃз·Џе‹™зњЃг®й»’з”°ж¬Ўе®гЃе¤§жќ‘ж–°ећ‹г‚ігѓ­гѓЉг‚¦г‚¤гѓ«г‚№ж„џжџ“з—‡еЇѕз­–ењ°ж–№йЂЈжђєз·Џж‹¬е®г‚в–Ѕ14ж™‚гж±з”°ж™І»еєі¶е•·Ґдјљи­°ж‰дјљй­гЂ35е€гЂЊе…Ёж—Ґжњ¬гЃЌг‚‚гЃ®иЈ…гЃ„гЃ®еҐізЋ‹гЌг®е®®жњ¬жЋеёЊгЃ•г‚“г‚‰гЃ«г‚€г‚‹иЎЁж•¬гЂ53е€е°ѕеґЋж­Јз›ґиЎ™ўи­°е“ЎгЂ‚в–Ѕ15ж™25е€дё­жі‰жќѕеЏёе‰ЌеЏ‚й™ўи­°е“ЎгЂ41е€дє•дёЉдїЎжІ»е‰Ќз§‘жЉЂз›ёгЂ‚в–Ѕ16ж™4е€е…љз¦ЏеІЎзњЊйЈгЃ®еЋџеЏЈе‰Јз”џдјљй•·гЂЃжќѕе°ѕзµ±з«е№№дє‹й•·гЂЃж—еЋџжё‰е…ље‰Ќз¦ЏеІЎзњЊи­°дјљи­°е“ЎгЂ‚еЏ¤иізЇ¤иЎ™ўи­°е“ЎеђЊеё­гЂ14е€еЏ¤иіиЎ™ўи­°е“ЎгЂ19е€иђ©з”џз”°зµЊз”Јз›ёгЂЃе¤љз”°зµЊз”Јж¬Ўе®гЃдїќеќ‚иі‡жєђг‚ЁгѓЌгѓ«г‚®гѓјеє•·е®г‚в–Ѕ17ж™1е€гѓ‚ёг‚їгѓ«и‡Ёж™‚иЎЊж”їиЄїжџ»дјљг54е€ж»ќеґЋе®ж€їе‰Їй•·е®иЈњгЃж»ќжІўе†…й–Јжѓ…е±е®гЃе®®е·ќей–ЈиЎ›жџжѓ…е±г‚»гѓіг‚їгѓјж‰й•·гЂ‚в–Ѕ18ж™10е€е†…й–Јжѓ…е±е®г21е€еѕЊи—¤еЋљеЉґз›ёгЂЃее†…гѓЇг‚ЇгѓЃгѓіз›ёгЂЃи—¤дє•е®ж€їе‰Їй•·е®иЈњгЃеЋљеЉґзњЃг®еђ‰з”°ж¬Ўе®гЃдЅђеЋџеЃҐеє·е±й•·гЂ‚в–Ѕ19ж™33е€жќ±дє¬гѓ»иµ¤еќ‚г®иЎ™ўи­°е“Ўе®їи€Ћг‚В
11/17/2021,202111,2021,11,17,202111,2021-11,2021-Nov,Fumio_Kishida,No,No,No,No,YES!,No,11жњ17ж—Ґ,в–Ѕ8ж™22е€жќ±дє¬гѓ»иµ¤еќ‚г®иЎ™ўи­°е“Ўе®їи€Ћз™єгЂ26е€жќ±дє¬гѓ»и™ЋгѓЋй–гЃ®гѓ›гѓ†гѓ«гЂЊпјґЅ€пЅ…гјЇЅ‹пЅ•пЅ’пЅЃгјґЅЏпЅ‹пЅ™пЅЏгЌг‚ж—Ґжњ¬ж–™зђ†еє—гЊе±±й‡ЊгЌгЃ§еҐҐз”°еЃҐе¤ЄйѓЋй‡жжќ‘иЁје€ёз¤ѕй•·гЂЃжќѕжњ¬е¤§гѓћгѓЌгѓ‚Їг‚№г‚°гѓ«гѓјгѓ—з¤ѕй•·гЃЁдјљйЈџг‚в–Ѕ9ж™49е€жќ±дє¬гѓ»иµ¤еќ‚г®иЎ™ўи­°е“Ўе®їи€Ћг‚в–Ѕ10ж™2е€иЎ™ўз¬¬1и­°е“Ўдјљй¤ЁгЂ‚в–Ѕ11ж™12е€е®й‚ёгЂ53е€жќ±дє¬гѓ»зґе°ѕдє•з”єгЃ®гѓ›гѓ†гѓ«гѓ‹гѓҐгѓјг‚Єгѓјг‚їгѓ‹г‚е…Ёе›Ѕз”єжќ‘й•·е¤§дјљгЃ«е‡єеё­гЃ—гЃгЃ‚гЃЃ•гЃ¤гЂ‚в–Ѕ12ж™27е€е®й‚ёгЂ‚в–Ѕ13ж™26е€е±±йљ›зµЊиІЎз›ёгЂЃи—¤дє•е®ж€їе‰Їй•·е®иЈњгЃиї«дє•ж–°ећ‹г‚ігѓ­гѓЉг‚¦г‚¤гѓ«г‚№з­‰ж„џжџ“з—‡еЇѕз­–жЋЁйЂІе®¤й•·гЂЃеђ‰з”°еЋљеЉґж¬Ўе®г‚в–Ѕ14ж™‚гжЈ®жґ‹е…Ёе›ЅзџіжІ№е•Ґ­зµђ€йЂЈеђ€дјљдјљй•·г‚‰г23е€2021е№ґгѓџг‚№гѓ»гѓ¦гѓ‹гѓђгѓјг‚№ж—Ґжњ¬д»ЈиЎЁгЃ®жёЎиѕєзЏзђЃ•г‚“г®иЎЁж•¬гЂ42е€й‡‘е­ђиѕІз›ёгЂЃиѕІж°ґзњЃг®жћќе…ѓж¬Ўе®гЃжЁЄе±±е®ж€їй•·гЂ‚в–Ѕ15ж™57е€ж №жњ¬еЊе…ЋљеЉґз›ёгЂ‚в–Ѕ16ж™18е€иђ©з”џз”°зµЊз”Јз›ёгЂЃе¤љз”°зµЊз”Јж¬Ўе®гЃдїќеќ‚иі‡жєђг‚ЁгѓЌгѓ«г‚®гѓјеє•·е®г55е€иЎ™ўз¬¬1и­°е“Ўдјљй¤ЁгЂ58е€е®‰еЌж™‹дё‰е…ѓй¦–з›ёгЂ‚в–Ѕ17ж™32е€е®й‚ёгЂ33е€е ±йЃ“еђ„з¤ѕгЃ®г‚¤гѓіг‚їгѓ“гѓҐгѓјгЂ‚в–Ѕ18ж™30е€гѓ•г‚ЈгѓЄгѓ”гѓігЃ®гѓ‰г‚Ґгѓѓ«гѓ¤§зµ±й гЃЁй›»и©±гЂ‚в–Ѕ19ж™35е€жќ±дє¬гѓ»иµ¤еќ‚г®иЎ™ўи­°е“Ўе®їи€Ћг‚В
11/18/2021,202111,2021,11,18,202111,2021-11,2021-Nov,Fumio_Kishida,No,No,No,No,No,No,11жњ18ж—Ґ,в–Ѕ8ж™50е€жќ±дє¬гѓ»иµ¤еќ‚г®иЎ™ўи­°е“Ўе®їи€Ћз™єгЂ55е€е®й‚ёгЂ‚в–Ѕ9ж™‚гй€ґжњЁиІЎе‹™з›ёгЂЃжњЁеЋџе®ж€їе‰Їй•·е®гЃиІЎе‹™зњЃгЃ®зџўй‡Ћж¬Ўе®гЃиЊ¶и°·дё»иЁ€е±й•·гЂ30е€з§‹и‘‰е›Ѕе®¶е®‰е…Ёдїќйљње±й•·гЂЃж»ќжІўе†…й–Јжѓ…е±е®гЃеІЎй‡Ће¤–е‹™зњЃз·Џеђ€е¤–дє¤ж”їз­–е±й•·гЂІиЎ›зњЃгЃ®е±±еґЋзµ±еђ€е№•ей•·гЂЃе¤§е’ЊйІиЎ›ж”їз­–е±ж¬Ўй•·гЂ‚в–Ѕ10ж™4е€гѓћг‚Їгѓ­зµЊжё€пј€жй•·гЃЁе€ј‰гЃ«й–ўгЃ™г‚‹жњ‰и­и…гЃЁи»Љеє§гЃ§гЃ®ж„Џи¦‹дє¤жЏ›г58е€е…љжњ¬йѓЁгЂ‚в–Ѕ11ж™‚гй–ўеЏЈеЏ‚й™ўи­°е“Ўдјљй•·гЂЃдё–и•еЏ‚й™ўе№№дє‹й•·гЂЃи—¤дє•еЏ‚й™ўж”їеЇ©дјљй•·гЂЃеІЎз”°еЏ‚й™ўе›ЅеЇѕе§”е“Ўй•·гЂ31е€йє»з”џе‰Їз·ЏиЈЃгЃиЊ‚жњЁе№№дє‹й•·гЂ‚в–Ѕ12ж™4е€е®й‚ёгЂ‚в–Ѕ13ж™35е€йЃи—¤йЃёеЇѕе§”е“Ўй•·гЂ55е€е°ЏжІўеђ‰еѕіж—Ґжњ¬еЏёжі•ж›ёеЈ«дјљйЈеђ€дјљдјљй•·гЂЃдє•дёЉйІеєі¶еЏёжі•ж›ёеЈ«дјљдјљй•·гЂ‚в–Ѕ14ж™2е€жќѕдє•дёе®џеєі¶её‚й•·гЂЃз”°дёЉеЇЊд№…й•·еґЋеё‚й•·гЃ®иЎЁж•¬гЂ23е€е…Ёе›Ѕй«йџйЃ“и·Їе»єиЁ­еЌ”и­°дјљдјљй•·гЃ®жќ‘дє•ежµ©е®®еџЋзњЊзџҐдє‹гЃе‰Їдјљй•·гЃ®жµњз”°зњЃеЏёй«зџҐзњЊзџҐдє‹г‚иЎ›и—¤еѕЃеЈ«йѓЋй«йџйЃ“и·Їе»єиЁ­жЋЁйЂІи­°е“ЎйЂЈз›џдјљй•·еђЊеё­гЂ‚в–Ѕ15ж™34е€зЋ‰еџЋгѓѓ‹гѓјжІ–зёњЊзџҐдє‹г‚в–Ѕ16ж™‚гж¤Ќз”°йљ­ђе…ѓж¬§е·ћйЈеђ€пј€пјҐјµј‰ж”їеєњд»ЈиЎЁйѓЁж¬Ўеё­е¤§дЅїгЂ41е€е±±еЅўзњЊз”єжќ‘дјљдјљй•·гЃ®еЋџз”°дїЉдєЊеђЊзњЊе·ќиҐїз”єй•·г‚‰г‚йЃёеЇѕе§”е“Ўй•·еђЊеё­гЂ‚в–Ѕ17ж™2е€иѕІжћ—ж°ґз”ЈжҐ­гѓ»ењ°еџџг®жґ»еЉ›е‰µйЂжњ¬йѓЁгЂ29е€е°Џжћ—зµЊжё€е®‰дїќз›ёгЂЃе›Ѕе®¶е®‰е…Ёдїќйљње±й•·гЂ52е€е±±йљ›зµЊиІЎз›ёгЂЃей–Јеєњг®з”°е’Њж¬Ўе®гЃдє•дёЉей–ЈеєњеЇ©и­°е®гЃжћ—ж”їз­–зµ±ж‹¬е®г‚в–Ѕ18ж™45е€г‚¤гѓігѓ‰гѓЌг‚·г‚ўгЃ®г‚ёгѓ§г‚іе¤§зµ±й гЃЁй›»и©±гЂ‚в–Ѕ19ж™1е€жЈ®е¤–е‹™зњдє‹е±й•·гЂ‚в–Ѕ20ж™3е€жќ±дє¬гѓ»зҐћжҐЅеќ‚г®жЇжІ™й–Ђе¤©е–›ЅеЇєе‰Ќг4е€еѕ’ж­©гЃ§жќ±дє¬гѓ»зҐћжҐЅеќ‚г®з„јгЃЌйіҐеє—гЊжњ¬е®¶гЃ‚гЃ№г‚ҐћжҐЅеќ‚еє—гЌг‚дє‹е‹™ж‰г‚№г‚їгѓѓ•гЃЁйЈџдє‹г‚в–Ѕ21ж™42е€еѕ’ж­©гЃ§жќ±дє¬гѓ»зҐћжҐЅеќ‚г®жЇжІ™й–Ђе¤©е–›ЅеЇєе‰Ќг58е€жќ±дє¬гѓ»иµ¤еќ‚г®иЎ™ўи­°е“Ўе®їи€Ћг‚В
11/19/2021,202111,2021,11,19,202111,2021-11,2021-Nov,Fumio_Kishida,No,No,No,No,YES!,No,11жњ19ж—Ґ,в–Ѕ9ж™20е€жќ±дє¬гѓ»иµ¤еќ‚г®иЎ™ўи­°е“Ўе®їи€Ћз™єгЂ24е€е®й‚ёгЂ‚е±йЃ“еђ„з¤ѕгЃ®г‚¤гѓіг‚їгѓ“гѓҐгѓјгЂ32е€ж”їеєњг»дёЋе…љж”їз­–ж‡•и«јљг48е€й–Ји­°гЂ‚в–Ѕ10ж™4е€зµЊжё€е®‰е…ЁдїќйљњжЋЁйЂІдјљи­°гЂ31е€еЉи—¤и‰Їдё‰ж—Ґз±іж–‡еЊ–ж•™и‚Ідє¤жµЃдјљи­°е§”е“Ўй•·гЃ®иЎЁж•¬гЂ‚в–Ѕ11ж™1е€жќ±дє¬гѓ»и™ЋгѓЋй–гЃ®г‚Єгѓ•г‚Јг‚№гѓ“гѓ«гЂЊжќ±дє¬и™ЋгѓЋй–г‚°гѓ­гѓјгѓђгѓ«г‚№г‚Їг‚Ёг‚ўгЂЌг‚зµЊжё€е®‰е…Ёдїќйљњжі•е€¶жє–е‚™е®¤гЃ®зњ‹жќїжЋ›г_гЂ11е€е®й‚ёгЂ23е€е°Џжё•е…љжІ–зёЊЇи€€иЄїжџ»дјљй•·гЂЃе›Ѕе ґе№ёд№‹еЉ©иЎ™ўи­°е“ЎгЂЃжњ‰жќ‘жІ»е­ђеЏ‚й™ўи­°е“ЎгЂ55е€еЏ¤е±‹е…љж†Іжі•ж”№ж­Је®џзЏѕжњ¬йѓЁй•·гЂЃж–°и—¤зѕ©е­ќиЎ™ўи­°е“ЎгЂ‚в–Ѕ14ж™9е€е†…й–ЈиЁи…дјљеЉ з›џе±йЃ“еђ„з¤ѕгЃ®г‚°гѓ«гѓјгѓ—г‚¤гѓіг‚їгѓ“гѓҐгѓјгЂ‚в–Ѕ16ж™20е€зµЊжё€иІЎж”їи«®е•Џдјљи­°гЂ52е€ж»ќжІўе†…й–Јжѓ…е±е®г‚в–Ѕ17ж™32е€и‡Ёж™‚й–Ји­°гЂ57е€е…¬й‚ёгЂ‚жњЁеЋџе®ж€їе‰Їй•·е®гЃЁдјљйЈџг‚в–Ѕ20ж™3е€жќ±дє¬гѓ»иµ¤еќ‚г®иЎ™ўи­°е“Ўе®їи€Ћг‚В
11/20/2021,202111,2021,11,20,202111,2021-11,2021-Nov,Fumio_Kishida,No,No,No,No,YES!,No,11жњ20ж—Ґ,в–Ѕ9ж™46е€жќ±дє¬гѓ»иµ¤еќ‚г®иЎ™ўи­°е“Ўе®їи€Ћз™єгЂ57е€жќ±дє¬гѓ»её‚и°·жњ¬жќ‘з”єгЃ®йІиЎ›зњЃгЂ‚и‡ЄиЎ›йљЉж®‰и·йљЉе“ЎиїЅж‚јејЏгЃ«еЏ‚егЃ—гЃиїЅж‚јгЃ®иѕћгЃзЊ®иЉ±гЂ‚в–Ѕ10ж™59е€жќ±дє¬гѓ»иµ¤еќ‚г®иЎ™ўи­°е“Ўе®їи€Ћг‚в–Ѕ11ж™55е€зѕЅз”°з©єжёЇгЂ‚в–Ѕ13ж™29е€е…Ёж—Ґз©є589дѕїгЃ§жќѕе±±з©єжёЇгЂ‚в–Ѕ14ж™3е€жќѕе±±её‚г®ж„›еЄ›зњЊз«‹жќѕе±±жќ±й«жЎгЂ‚г‚їгѓ–гѓ¬гѓѓ€з«Їжњ«г‚’дЅїгЃЈгЃџжЁЎж“¬жЋ€жҐ­г‚’дЅ“йЁ“г‚з”џеѕ’г‚‰гЃЁи»Љеє§гЃ§ж„Џи¦‹дє¤жЏ›г‚дё­жќ‘ж™‚еєњЊзџҐдє‹еђЊеё­гЂ‚в–Ѕ15ж™9е€еђЊеё‚г®жё©жі‰ж–ЅиЁ­гЂЊйЃ“еѕЊжё©жі‰жњ¬й¤ЁгЂЌе‰ЌгЂ‚й‡жеї—ед»Ѓеё‚й•·е‡єиїЋгЃ€гЂ15е€еѕ’ж­©гЃ§жё©жі‰ж–ЅиЁ­гЂЊйЃ“еѕЊжё©жі‰е€Ґй¤ЁгЂйЈ›йіҐд№№Їжі‰гЌг‚и¦іе…‰жҐ­й–ўдї‚и…г‚‰гЃЁи»Љеє§гЃ§ж„Џи¦‹дє¤жЏ›г‚зњЊзџҐдє‹еђЊеё­гЂ‚в–Ѕ16ж™6е€е ±йЃ“еђ„з¤ѕгЃ®г‚¤гѓіг‚їгѓ“гѓҐгѓјгЂ12е€еѕ’ж­©гЃ§гЂЊйЃ“еѕЊе•†еє—иЎ—гЌг‚и¦–еЇџг‚ењџз”Јз‰©еє—гЊзµЈе±‹жњ¬еє—гЌгЃ§гЃїгЃ‹г‚“г‚ёгѓҐгѓјг‚№г‚Ѓ‹гЃѕгЃјгЃ“гЃЄгЃ©г‚’иіје…ҐгЂ49е€еђЊеё‚г®жќѕе±±и¦іе…‰жёЇгЂ50е€еЎ©еґЋж­д№…е…ѓеЋљеЉґз›ёгЂ‚в–Ѕ18ж™13е€зЂ¬ж€ёе†…жµ·ж±Ѕи€№гЃ®й«йџи€№гЂЊг‚№гѓјгѓ‘гјг‚ёг‚§гѓѓ€гЂЌгЃ§еєі¶её‚еЌ—еЊєгЃ®еєі¶жёЇгЂ43е€еђЊеё‚дё­еЊєгЃ®гѓЄгѓјг‚¬гѓ­г‚¤гѓ¤гѓ«гѓ›гѓ†гѓ«еєі¶гЂ‚е®ґдјљеґгЂЊгѓ­г‚¤гѓ¤гѓ«гѓ›гјгѓ«гЂЌгЃ§йє»з”џе‰Їз·ЏиЈЃг®еѕЊжЏґдјљгЊдё­е›Ѕзґж·®дјљгЌг®г‚»гѓџгѓЉгѓјгЃ«е‡єеё­гЃ—гЃгЃ‚гЃЃ•гЃ¤гЂ‚в–Ѕ20ж™7е€еєі¶з©єжёЇгЂ‚в–Ѕ21ж™33е€е…Ёж—Ґз©є686дѕїгЃ§зѕЅз”°з©єжёЇгЂ‚в–Ѕ22ж™11е€жќ±дє¬гѓ»иµ¤еќ‚г®иЎ™ўи­°е“Ўе®їи€Ћг‚В
11/21/2021,202111,2021,11,21,202111,2021-11,2021-Nov,Fumio_Kishida,No,No,No,No,No,No,11жњ21ж—Ґ,гЂзµ‚ж—ҐгЂЃжќ±дє¬гѓ»иµ¤еќ‚г®иЎ™ўи­°е“Ўе®їи€ЋгЃ§йЃЋгЃ”гЃ™г‚В
11/22/2021,202111,2021,11,22,202111,2021-11,2021-Nov,Fumio_Kishida,No,No,No,No,No,No,11жњ22ж—Ґ,в–Ѕ9ж™38е€жќ±дє¬гѓ»иµ¤еќ‚г®иЎ™ўи­°е“Ўе®їи€Ћз™єгЂ42е€е®й‚ёгЂ‚в–Ѕ10ж™45е€з§‹и‘‰е›Ѕе®¶е®‰е…Ёдїќйљње±й•·гЂЃжЈ®е¤–е‹™ж¬Ўе®гЃеі¶з”°йІиЎ›ж¬Ўе®г‚в–Ѕ11ж™1е€й€ґжњЁиІЎе‹™з›ёгЂЃзџўй‡ЋиІЎе‹™ж¬Ўе®г58е€жќ±дє¬гѓ»зґе°ѕдє•з”єгЃ®гѓ›гѓ†гѓ«гѓ‹гѓҐгѓјг‚Єгѓјг‚їгѓ‹г‚ж—Ґжњ¬ж–™зђ†еє—гЊеЌѓзѕЅй¶ґгЂЌгЃ§йє»з”џе‰Їз·ЏиЈЃгЃиЊ‚жњЁе№№дє‹й•·гЂЃжќѕй‡Ће®ж€їй•·е®гЃЁдјљйЈџг‚в–Ѕ13ж™26е€е®й‚ёгЂ38е€еђ‘дє•е‰‡д№‹еєі¶е‘‰ењ°еЊєйѓµдѕїе±й•·дјљдјљй•·г‚‰г54е€е±±и°·гЃ€г‚Ље­ђе…љж‹‰и‡ґе•ЏйЎЊеЇѕз­–жњ¬йѓЁй•·гЂ‚в–Ѕ14ж™58е€еІЎж­Јж™¶гЂЃеєеѕ№дёЎжњй«иЈЃе€¤дє‹г‚в–Ѕ15ж™9е€зЊЄзЂ¬з›ґжЁ№е…ќ±дє¬йѓЅзџҐдє‹гЃдё­е®¤з‰§е­ђж…¶еїње¤§ж•™жЋ€гЂЃеЋџи‹±еЏІж”їз­–е·Ґж€їз¤ѕй•·гЂЃжќѕз”°е…¬е¤Єе…Џ‚й™ўи­°е“ЎгЂЃжќ‘дє•иЈњдЅђе®г23е€ж”їжІ»и§ЈиЄ¬иЂ…г®зЇеЋџж–‡д№џж°Џг‚в–Ѕ16ж™21е€й«еі¶иЄе…Ёе›ЅйЉиЎЊеЌ”дјљдјљй•·гЂ32е€зџіе·ќж‹‰и‡ґе•ЏйЎЊеЇѕз­–жњ¬йѓЁдє‹е‹™е±й•·гЂ‚в–Ѕ17ж™‚ге›Ѕе®¶е®‰е…Ёдїќйљње±й•·гЂЃе¤–е‹™ж¬Ўе®гІиЎ›ж¬Ўе®г50е€г‚їг‚¤гЃ®гѓ—гѓ©гѓ¦гѓѓ€й¦–з›ёгЃЁй›»и©±гЂ‚в–Ѕ18ж™20е€г‚·гѓіг‚¬гѓќгјгѓ«гЃ®гѓЄгѓјгѓ»г‚·г‚§гѓігѓ­гѓій¦–з›ёгЃЁй›»и©±гЂ‚в–Ѕ19ж™34е€жќ±дє¬гѓ»иµ¤еќ‚г®иЎ™ўи­°е“Ўе®їи€Ћг‚В
11/23/2021,202111,2021,11,23,202111,2021-11,2021-Nov,Fumio_Kishida,No,No,No,No,No,No,11жњ23ж—Ґ,гЂеЌ€е‰Ќдё­гЃЇжќ±дє¬гѓ»иµ¤еќ‚г®иЎ™ўи­°е“Ўе®їи€ЋгЃ§йЃЋгЃ”гЃ™г‚в–Ѕ17ж™18е€иЎ™ўи­°е“Ўе®їи€Ћз™єгЂ27е€зљ‡е±…г‚ж–°е—зҐ­зҐћеж®їгЃ®е„гЃ«еЏ‚егЂ‚в–Ѕ20ж™16е€жќ±дє¬гѓ»иµ¤еќ‚г®иЎ™ўи­°е“Ўе®їи€Ћг‚В
11/24/2021,202111,2021,11,24,202111,2021-11,2021-Nov,Fumio_Kishida,No,No,No,No,YES!,No,11жњ24ж—Ґ,в–Ѕ9ж™44е€жќ±дє¬гѓ»иµ¤еќ‚г®иЎ™ўи­°е“Ўе®їи€Ћз™єгЂ48е€е®й‚ёгЂ49е€е ±йЃ“еђ„з¤ѕгЃ®г‚¤гѓіг‚їгѓ“гѓҐгѓјгЂ‚в–Ѕ10ж™1е€й–Ји­°гЂ39е€иҐїйЉеѕ©и€€з›ёгЂ–‹е‡єеѕ©и€€еєЃж¬Ўе®г56е€й€ґжњЁиІЎе‹™з›ёгЂЃиІЎе‹™зњЃгЃ®зџўй‡Ћж¬Ўе®гЃиЊ¶и°·дё»иЁ€е±й•·гЂЃдЅЏжІўдё»зЁЋе±й•·гЂ‚в–Ѕ14ж™‚гйїйѓЁзњџдёе…Ёе›Ѕе•є—иЎ—жЊЇи€€зµђ€йЂЈеђ€дјљзђ†дє‹й•·гЂ22е€й«ж©‹и‹±з™»ж—Ґжњ¬ж­Їз§‘еЊ»её«йЂЈз›џдјљй•·гЂ38е€е ж†ІйѓЋж—Ґжњ¬ж­Їз§‘еЊ»её«дјљдјљй•·гЂ53е€е…ље›Ѕдјљи­°е“ЎгЃ®гѓ‘гјгѓ‚ЈгѓјгЃЄгЃ©гЃ«еђ‘г_гЃџгѓ“гѓ‚ЄгѓЎгѓ‚»гѓјг‚ёеЏЋйЊІгЂ‚в–Ѕ15ж™20е€е¤§е·ќе‹ќеЊ—жµ·йЃ“г‚ўг‚¤гѓЊеЌ”дјљзђ†дє‹й•·гЂ36е€е±±йљ›зµЊиІЎз›ёгЂЃей–Јеєњг®з”°е’Њж¬Ўе®гЃдє•дёЉей–ЈеєњеЇ©и­°е®гЃжћ—гЂЃжќ‘зЂ¬гЂЃжќ‘е±±еђ”їз­–зµ±ж‹¬е®г‚в–Ѕ16ж™32е€дёЉз”°е…‹еЅ¦ж—Ґжњ¬иЁєз™‚ж”ѕе°·љжЉЂеё«дјљдјљй•·гЂЃиЉіеЈ«ж€ёжІ»зѕ©ж—Ґжњ¬иЁєз™‚ж”ѕе°·љжЉЂеё«йЂЈз›џзђ†дє‹й•·гЂ‚з•¦е…°ђѕиЎ™ўи­°е“ЎеђЊеё­гЂ46е€з§‹и‘‰е›Ѕе®¶е®‰е…Ёдїќйљње±й•·гЂЃе¤–е‹™зњЃг®жЈ®ж¬Ўе®гЃе±±з”°е¤–е‹™еЇ©и­°е®г‚в–Ѕ17ж™16е€е›Ѕе®¶е®‰е…Ёдїќйљње±й•·гЂЃж»ќжІўе†…й–Јжѓ…е±е®гІиЎ›зњЃгЃ®еў—з”°йІиЎ›ж”їз­–е±й•·гЂЃзґЌеЁжѓ…е±жњ¬йѓЁй•·гЂ28е€е†…й–Јжѓ…е±е®г‚в–Ѕ18ж™1е€гѓ™гѓ€гѓЉгѓ гЃ®гѓЃгѓій¦–з›ёг‚’еєиїЋгЃ€гЂ‚иЁеїµж’®еЅ±гЂ2е€е„д»—пј€гЃЋгЃг‚‡гЃј‰йљЉгЃ«г‚€г‚‹ж Є‰з¤јгЂЃе„Ђд»—г16е€гѓЃгѓій¦–з›ёгЃЁй¦–и„ідјљи«‚в–Ѕ19ж™14е€ж–‡ж›ёдє¤жЏ›ејЏгЃе±еђЊиЁи…з™єиЎЁгЂ43е€еѕ’ж­©гЃ§е…¬й‚ёгЂ‚еІёз”°й¦–з›ёдё»е‚¬гЃ®е¤•йЈџдјљг‚в–Ѕ21ж™16е€гѓЃгѓій¦–з›ёг‚’и¦‹йЃг‚ЉгЂ41е€жќ±дє¬гѓ»иµ¤еќ‚г®иЎ™ўи­°е“Ўе®їи€Ћг‚В
11/25/2021,202111,2021,11,25,202111,2021-11,2021-Nov,Fumio_Kishida,No,No,No,No,YES!,No,11жњ25ж—Ґ,в–Ѕ9ж™23е€жќ±дє¬гѓ»иµ¤еќ‚г®иЎ™ўи­°е“Ўе®їи€Ћз™єгЂ30е€е…љжњ¬йѓЁгЂ34е€е…љж–°гЃ—гЃ„иі‡жњ¬дё»зѕ©е®џиЎЊжњ¬йѓЁгЃ«е‡єеё­гЃ—гЃгЃ‚гЃЃ•гЃ¤гЂ47е€е®й‚ёгЂ‚в–Ѕ10ж™1е€гЂЊеҐ€и‰ЇгЃ®жџїј°јІгѓ¬гѓ‚ЈгЂЌг®еє¬йє»зђҐ€гЃ•г‚“г‚‰гЃ®иЎЁж•¬гЂ‚й«её‚ж”їиЄїдјљй•·еђЊеё­гЂ28е€жќ±дє¬гѓ»еЌ—е…ѓз”єгЃ®дєЊи‘‰еЌ—е…ѓдїќи‚Іењ’г‚ењ’е…ђгЃЁдє¤жµЃг‚дїќи‚ІеЈ«г‚‰гЃЁи»Љеє§гЃ§ж„Џи¦‹дє¤жЏ›г‚еѕЊи—¤еЋљеЉґз›ёеђЊиЎЊг‚в–Ѕ11ж™28е€е ±йЃ“еђ„з¤ѕгЃ®г‚¤гѓіг‚їгѓ“гѓҐгѓјгЂ33е€ењ’ег‚‰гЃЁе†™зњџж’®еЅ±гЂ44е€е®й‚ёгЂ57е€жќ±дє¬гѓ»ж°ёз”°з”єгЃ®е…Ёе›Ѕз”єжќ‘дјљй¤ЁиҐїй¤ЁгЂ‚еІёз”°жґѕгЃ®дјљеђ€гЃ«е‡єеё­гЃ—гЃгЃ‚гЃЃ•гЃ¤гЂ‚в–Ѕ12ж™31е€е®й‚ёгЂ‚в–Ѕ13ж™33е€е±±йљ›зµЊиІЎз›ёгЂЃжњЁеЋџе®ж€їе‰Їй•·е®гЃи—¤дє•е®ж€їе‰Їй•·е®иЈњгЃж–°еЋџж–°гЃ—гЃ„иі‡жњ¬дё»зѕ©е®џзЏѕжњ¬йѓЁдє‹е‹™е±й•·д»ЈзђЃз”°е’Њей–Јеєњж¬Ўе®г‚в–Ѕ14ж™10е€з§‹и‘‰е›Ѕе®¶е®‰е…Ёдїќйљње±й•·гЂЃж»ќжІўе†…й–Јжѓ…е±е®гЃеІЎй‡Ће¤–е‹™зњЃз·Џеђ€е¤–дє¤ж”їз­–е±й•·гЂІиЎ›зњЃгЃ®еў—з”°йІиЎ›ж”їз­–е±й•·гЂ€ґжњЁзµ±еђ€е№•ее‰Їй•·гЂ45е€еІЎйѓЁеЏ‚дёЋг‚в–Ѕ15ж™10е€жёЎе…·зџҐж­¦и±ЉжІ–зёњЊеђЌи­·её‚й•·гЂ‚еі¶е°»е®‰дјЉе­ђе…ѓжІ–зё»еЊ—ж–№з›ёеђЊеё­гЂ55е€жњ«жќѕж–‡з§‘з›ёгЂЃзѕ©жњ¬ж–‡з§‘ж¬Ўе®г‚в–Ѕ16ж™32е€жњ€дѕ‹зµЊжё€е±е‘Љй–ўдї‚й–Јеѓљдјљи­°гЂ49е€зµЊжё€иІЎж”їи«®е•Џдјљи­°гЂ‚в–Ѕ18ж™47е€жЁЄжµњеё‚иҐїеЊєгЃ®гѓЁг‚ігѓЏгг‚°гѓ©гѓігѓ‰г‚¤гѓіг‚їгѓјг‚ігѓігѓЃгѓЌгѓіг‚їгѓ«гѓ›гѓ†гѓ«гЂ‚е®ґдјљеґгЂЊг‚¤гѓіг‚їгѓјг‚ігѓігѓЃгѓЌгѓіг‚їгѓ«гѓњгјгѓ«гѓ«гѓјгѓгЂЌгЃ§е…Ёе›Ѕдё­е°ЏдјЃжҐ­е›ЈдЅ“дё­е¤®дјље…Ёе›Ѕе¤§дјљг®ж‡‡и¦ЄдјљгЃ«е‡єеё­гЃ—гЃгЃ‚гЃЃ•гЃ¤гЂ‚в–Ѕ19ж™59е€жќ±дє¬гѓ»иµ¤еќ‚г®иЎ™ўи­°е“Ўе®їи€Ћг‚В
11/26/2021,202111,2021,11,26,202111,2021-11,2021-Nov,Fumio_Kishida,No,No,No,No,No,No,11жњ26ж—Ґ,в–Ѕ9ж™21е€жќ±дє¬гѓ»иµ¤еќ‚г®иЎ™ўи­°е“Ўе®їи€Ћз™єгЂ26е€е®й‚ёгЂ27е€й‡Ћз”°е°‘е­ђеЊ–з›ёгЂЃи—¤дє•е®ж€їе‰Їй•·е®иЈњгЃи°·е†…ей–ЈеЇ©и­°е®г‚в–Ѕ10ж™2е€й–Ји­°гЂ20е€еѕ©и€€жЋЁйЂІдјљи­°гЂ40е€жІ–з”°е†…й–ЈеЌ±ж©џз®Ўзђ›ЈгЂЃз§‹и‘‰е›Ѕе®¶е®‰е…Ёдїќйљње±й•·гЂ«ж©‹е®ж€їе‰Їй•·е®иЈњгЃеІЎй‡Ће¤–е‹™зњЃз·Џеђ€е¤–дє¤ж”їз­–е±й•·гЂІиЎ›зњЃгЃ®еў—з”°йІиЎ›ж”їз­–е±й•·гЂЃе±±еґЋзµ±еђ€е№•ей•·гЂ‚в–Ѕ11ж™1е€и’Іеі¶йѓЃе¤«з†Љжњ¬зњЊзџҐдє‹г‚‰гЂ20е€з«№е†…й§ђгѓўгѓ«гѓ‚Јгѓ–е¤§дЅїгЂЃеІЎеє­й§ђг‚±гѓ‹г‚ўе¤§дЅїгЂЃд№…дїќй§ђгѓЏг‚¤гѓЃе¤§дЅїгЂЃз›ёжњЁй§ђг‚їг‚ёг‚­г‚№г‚їгѓіе¤§дЅїгЂЃз¦Џеі¶й§ђгѓ‘гѓЉге¤§дЅїгЂЃжЈ®й‡Ћй§ђг‚Їг‚¦г‚§гѓјгѓ€е¤§дЅїгЂЃдёж–№дє•й§ђг‚ігѓјгѓ€г‚ёгѓњгѓЇгѓјгѓ«е¤§дЅїгЂ53е€жќ±дє¬гѓ»е…µ¤еќ‚г®жЋжІ»иЁеїµй¤ЁгЂ‚е®ґдјљеґгЂЊеЇЊеЈ«гЂЌгЃ§з”єжќ‘и­°дјљи­°й•·е…Ёе›Ѕе¤§дјљгЃ«е‡єеё­гЃ—гЃгЃ‚гЃЃ•гЃ¤гЂ‚в–Ѕ12ж™31е€е®й‚ёгЂ‚в–Ѕ13ж™2е€ж–°гЃ—гЃ„иі‡жњ¬дё»зѕ©е®џзЏѕдјљи­°гЂ‚в–Ѕ14ж™15е€е›Ѕе®¶е®‰е…Ёдїќйљње±й•·гЂЃе¤–е‹™зњЃг®жЈ®ж¬Ўе®гЃи€№и¶Љг‚ўг‚ёг‚ўе¤§жґ‹е·ће±й•·гЂ‚в–Ѕ15ж™5е€еѕЊи—¤еЋљеЉґз›ёгЂЃее†…гѓЇг‚ЇгѓЃгѓіз›ёгЂЃеђ‰з”°еЋљеЉґж¬Ўе®г29е€е°Џи°·й‡Ћдє”й›„е…љеџјзЋ‰зњЊйЂЈе№№дє‹й•·гЂ‚жќ‘дє•иЈњдЅђе®еђЊеё­гЂ40е€й‡Ћз”°з”·еҐіе…±еђЊеЏ‚з”»з›ёгЂЃжћ—е†…й–Јеєњз”·еҐіе…±еђЊеЏ‚з”»е±й•·гЂ‚в–Ѕ16ж™18е€ж»ќжІўе†…й–Јжѓ…е±е®г51е€и‡Ёж™‚й–Ји­°гЂ‚в–Ѕ17ж™5е€и—¤дє•е‰Їй•·е®иЈњгЃжЈ®е¤–е‹™зњдє‹е±й•·гЂЃжµ…жІјеЋљеЉґзњЃеЌ±ж©џз®Ўзђ»еЊ»е‹™жЉЂиЎ“з·Џж‹¬еЇ©и­°е®г16е€е›Ѕе®¶е®‰е…Ёдїќйљњдјљи­°гЂ‚в–Ѕ18ж™‚ге…Ёе›ЅйѓЅйЃ“еєњзњЊзџҐдє‹дјљи­°гЂ‚в–Ѕ19ж™‚гг‚Єгѓігѓ©г‚¤гѓіеЅўејЏг®г‚ўг‚ёг‚ўж¬§е·ћдјљи­°ј€пјЎјіјҐј­ј‰й¦–и„ідјљи­°гЂ‚в–Ѕ20ж™54е€жќ±дє¬гѓ»иµ¤еќ‚г®иЎ™ўи­°е“Ўе®їи€Ћг‚В
11/27/2021,202111,2021,11,27,202111,2021-11,2021-Nov,Fumio_Kishida,YES!,No,No,No,YES!,No,11жњ27ж—Ґ,в–Ѕ9ж™34е€жќ±дє¬гѓ»иµ¤еќ‚г®иЎ™ўи­°е“Ўе®їи€Ћз™єгЂ36е€е®й‚ёгЂ54е€й™ёдёЉи‡ЄиЎ›йљЉгѓгѓЄг‚ігѓ—г‚їгѓјгЃ§жќ±дє¬гѓ»е¤§жі‰е­¦ењ’з”єгЃ®й™ёи‡Єжњќйњћй§ђе±Їењ°гЂ‚в–Ѕ10ж™15е€и¦ій–ІејЏгЃ«е‡єеё­гЂ‚иЁ“з¤єгЂ59е€еђ‰з”°йІиЎ›зњЃй™ёдёЉе№•ей•·г‚‰гЃ‹г‚‰зЉ¶жіЃе±е‘Љг‚еІёйІиЎ›з›ёгЂІиЎ›зњЃгЃ®еі¶з”°ж¬Ўе®гЃе±±еґЋзµ±еђ€е№•ей•·еђЊеё­гЂ‚в–Ѕ11ж™39е€йљЉе“ЎгЃЁи»Љеє§гЃ§ж„Џи¦‹дє¤жЏ›г‚в–Ѕ12ж™13е€ж©џе‹•ж€¦й—и»ЉгЃЄгЃ©г‚’и¦–еЇџг‚в–Ѕ13ж™1е€жќ±йѓЁж–№йќўз·Џз›ЈйѓЁеєЃигЃ§йІиЎ›з›ёгЂІиЎ›зњЃгЃ®ж¬Ўе®гЃзµ±еђ€е№•ей•·г‚‰гЃЁдјљйЈџг‚в–Ѕ14ж™29е€жќ±дє¬йѓЅж­¦и”µй‡Ћеё‚г®гЂЊпј®јґјґж­¦и”µй‡Ћз”з©¶й–‹з™єг‚»гѓіг‚їгЂЌг‚жњЂе…€з«ЇйЂљдїЎжЉиЎ“гЃ«й–ўгЃ™г‚‹е±•з¤єг‚’и¦–еЇџг‚йЃЯе­ђз·Џе‹™з›ёеђЊиЎЊг52е€з ”з©¶иЂ…гЃжЉЂиЎ“е€©з”ЁиЂ…гЃЁи»Љеє§гЃ§ж„Џи¦‹дє¤жЏ›г‚в–Ѕ15ж™48е€е ±йЃ“еђ„з¤ѕгЃ®г‚¤гѓіг‚їгѓ“гѓҐгѓјгЂ‚в–Ѕ17ж™12е€жќ±дє¬гѓ»е…­з•Єз”єгЃ®гЂЊг‚«гѓѓ€гѓ»г‚¤гѓігѓ»г‚Ѕгѓјгѓ¬йє№з”єеє—гЌг‚ж•Јй«ЄгЂ‚в–Ѕ18ж™46е€жќ±дє¬гѓ»иµ¤еќ‚г®з„јгЃЌи‚‰еє—гЊеЏ™гЂ…и‹‘жёёзЋє­иµ¤еќ‚гЌг‚ењ°е…є‹е‹™ж‰г‚№г‚їгѓѓ•гЃЁйЈџдє‹г‚в–Ѕ21ж™17е€жќ±дє¬гѓ»иµ¤еќ‚г®иЎ™ўи­°е“Ўе®їи€Ћг‚В
11/28/2021,202111,2021,11,28,202111,2021-11,2021-Nov,Fumio_Kishida,No,No,No,No,No,No,11жњ28ж—Ґ,гЂеЌ€е‰Ќдё­гЃЇжќ±дє¬гѓ»иµ¤еќ‚г®иЎ™ўи­°е“Ўе®їи€ЋгЃ§йЃЋгЃ”гЃ™г‚в–Ѕ13ж™2е€иЎ™ўи­°е“Ўе®їи€Ћз™єгЂ10е€жќ±дє¬гѓ»йљјз”єгЃ®гѓ›гѓ†гѓ«г‚°гѓ©гѓігѓ‰г‚ўгѓјг‚ЇеЌЉи”µй–гЂ31е€е®ґдјљеґгЂЊеЇЊеЈ«гЃ®й–“гЌгЃ§е…Ёе›Ѕж®‰и·и­¦еЇџи·е“Ўгѓ»и­¦еЇџеЌ”еЉ›ж®‰й›ЈиЂ…ж°йњЉзҐ­гЃ«еЏ‚егЃ—гЃиїЅж‚јгЃ®иѕћгЃзЊ®иЉ±гЂ‚в–Ѕ14ж™25е€жќ±дє¬гѓ»иµ¤еќ‚г®иЎ™ўи­°е“Ўе®їи€Ћг‚В
11/29/2021,202111,2021,11,29,202111,2021-11,2021-Nov,Fumio_Kishida,No,No,No,No,YES!,No,11жњ29ж—Ґ,в–Ѕ9ж™15е€жќ±дє¬гѓ»иµ¤еќ‚г®иЎ™ўи­°е“Ўе®їи€Ћз™єгЂ18е€е®й‚ёгЂ19е€е ±йЃ“еђ„з¤ѕгЃ®г‚¤гѓіг‚їгѓ“гѓҐгѓјгЂ22е€ж–Ћи—¤ж™єд№џе›Ѕз«‹ж„џжџ“з—‡з ”з©¶ж‰ж„џжџ“з—‡еЌ±ж©џз®Ўзђ”з©¶г‚»гѓіг‚їгѓјй•·гЂ‚з¦Џеі¶еЋљеЉґзњЃеЊ»е‹™жЉЂз›ЈеђЊеё­гЂ‚в–Ѕ10ж™58е€е±±иҐїеЃҐдёйѓЋж—Ґжњ¬и¦іе…‰жЊЇи€€еЌ”дјљдјљй•·г‚‰г‚в–Ѕ11ж™13е€гЃ“гЃ©г‚‚ж”їз­–г®жЋЁйЂІгЃ«й–ўгЃ™г‚‹жњ‰и­и…дјљи­°гЃ®жё…е®¶зЇ¤еє§й•·гЃ‹г‚‰е ±е‘Љж›ёеЏ—г_еЏ–г‚ЉгЂ‚жќѕй‡Ће®ж€їй•·е®г‡жз”°е°‘е­ђеЊ–з›ёеђЊеё­гЂ39е€й«ж©‹и‹±еЇЊеєі¶зњЊеЊ»и–¬е“ЃеЌёеЌ”еђЊзµђ€зђє‹й•·г‚‰г‚в–Ѕ12ж™1е€ж”їеєњг»дёЋе…љйЂЈзµЎдјљи­°гЂ35е€еЏ¤е·ќжі•з›ёгЂЃжћ—е¤–з›ёгЂЃеѕЊи—¤еЋљеЉґз›ёгЂЃж–‰и—¤е›Ѕдє¤з›ёгЂЃе®ж€їй•·е®г‚в–Ѕ13ж™15е€е ±йЃ“еђ„з¤ѕгЃ®г‚¤гѓіг‚їгѓ“гѓҐгѓјгЂ30е€е°Џж±з™ѕеђ€е­ђжќ±дє¬йѓЅзџҐдє‹гЃ‹г‚‰ж–°ећ‹г‚ігѓ­гѓЉг‚¦г‚¤гѓ«г‚№ж„џжџ“з—‡еЇѕз­–гЃ«й–ўгЃ™г‚‹и¦Ѓжњ›ж›ёеЏ—г_еЏ–г‚ЉгЂ‚в–Ѕ14ж™38е€ж‰‹еЎљж­ЈеЅ¦ж—Ґжњ¬е…¬иЄЌдјљиЁ€еЈ«еЌ”дјљдјљй•·гЂЃжЈ®е…¬й«ж—Ґжњ¬е…¬иЄЌдјљиЁ€еЈ«ж”їжІ»йЂЈз›џдјљй•·гЂ‚й·Іе°ѕе‰Їе№№дє‹й•·г‚‰еђЊеё­гЂ‚в–Ѕ15ж™26е€й€ґжњЁиІЎе‹™з›ёгЂЃжњЁеЋџе®ж€їе‰Їй•·е®гЃиІЎе‹™зњЃгЃ®зџўй‡Ћж¬Ўе®гЃиЊ¶и°·дё»иЁ€е±й•·гЂ52е€иІЎе‹™з›ёгЂ‚в–Ѕ16ж™12е€иЉідє•ж•¬дёдЅЏе®…з”џз”Је›ЈдЅ“йЈеђ€дјљдјљй•·гЂ‚в–Ѕ17ж™‚гз”·еҐіе…±еђЊеЏ‚з”»дјљи­°гЂ‚в–Ѕ18ж™‚гж¬§е·ћйЈеђ€пј€пјҐјµј‰г®гѓџг‚·г‚§гѓ«е¤§зµ±й гЃЁй›»и©±гЂ‚в–Ѕ19ж™16е€жќ±дє¬гѓ»йЉеє§гЃ®г‚¤г‚їгѓЄг‚ўж–™зђ†еє—гЊгѓЄг‚№гѓ€гѓ©гѓігѓг‚Їгѓ­гѓ‚ЈгѓјгѓЋгЌг‚е°Џжћ—гѓ‚ёг‚їгѓ«е‰Їе¤§и‡ЈгЂЃжќ‘дє•иЈњдЅђе®гЃЁдјљйЈџг‚в–Ѕ21ж™19е€жќ±дє¬гѓ»иµ¤еќ‚г®иЎ™ўи­°е“Ўе®їи€Ћг‚В
11/30/2021,202111,2021,11,30,202111,2021-11,2021-Nov,Fumio_Kishida,No,No,No,No,No,No,11жњ30ж—Ґ,в–Ѕ9ж™20е€жќ±дє¬гѓ»иµ¤еќ‚г®иЎ™ўи­°е“Ўе®їи€Ћз™єгЂ27е€е…љжњ¬йѓЁгЂ33е€е…љеЅ№е“Ўдјљг50е€е®й‚ёгЂ‚в–Ѕ10ж™‚гй–Ји­°гЂ9е€еѕЊи—¤еЋљеЉґз›ёгЂ42е€е¤–е‹™зњЃг®жЈ®ж¬Ўе®гЃжµ·йѓЁи»Ќзё®дёЌж‹Ўж•Јгѓ»з§‘е­¦йѓЁй•·гЂ‚в–Ѕ11ж™23е€е¤–е‹™ж¬Ўе®г31е€жµњй‡жжµ©дєЊж—Ґжњ¬ж—…й¤ЁеЌ”дјљдјљй•·г‚‰г47е€йїйѓЁзњџдёе…Ёе›Ѕе•є—иЎ—жЊЇи€€зµђ€йЂЈеђ€дјљзђ†дє‹й•·г‚‰г‚в–Ѕ13ж™28е€е®‰еЌж™‹дё‰е…ѓй¦–з›ёгЂ59е€зµЊжё€е›ЈдЅ“гЃЄгЃ©гЃЊдё»е‚¬гЃ™г‚‹е›Ѕйљ›дјљи­°гЂЊпј§јєјҐјІјЇг‚µгѓџгѓѓгѓ€гЌеђ‘гЃ‘г®гѓ“гѓ‡г‚ЄгѓЎгѓ‚»гѓјг‚ёеЏЋйЊІгЂ‚в–Ѕ14ж™25е€е…љжњ¬йѓЁгЂ27е€йє»з”џе‰Їз·ЏиЈЃгЃиЊ‚жњЁе№№дє‹й•·гЂ‚в–Ѕ15ж™36е€е®й‚ёгЂ‚в–Ѕ16ж™31е€е®‰е®љзљ„гЃЄзљЅЌз¶™ж‰їз­–г‚’и­°и«–гЃ™г‚‹жњ‰и­и…дјљи­°гЂ57е€жћ—е¤–з›ёгЂЃеЋљеЉґз›ёгЂЃж–‰и—¤е›Ѕдє¤з›ёгЂЃжќѕй‡Ће®ж€їй•·е®гЃжґҐеі¶жі•е‹™е‰Їе¤§и‡ЈгЂЃжњЁеЋџе®ж€їе‰Їй•·е®гЃи—¤дє•е®ж€їе‰Їй•·е®иЈњг‚в–Ѕ19ж™35е€жќ±дє¬гѓ»иµ¤еќ‚г®иЎ™ўи­°е“Ўе®їи€Ћг‚В
12/1/2021,202112,2021,12,1,202112,2021-12,2021-Dec,Fumio_Kishida,No,No,No,No,No,No,12жњ1ж—Ґ,в–Ѕ9ж™32е€жќ±дє¬гѓ»иµ¤еќ‚г®иЎ™ўи­°е“Ўе®їи€Ћз™єгЂ36е€е®й‚ёгЂ38е€ж–‰и—¤е›Ѕдє¤з›ёгЂЃе¤©зѕЅжћ—й‡жеє•·е®гЃе®‡же›Ѕдє¤зњЅеё‚е±й•·гЂ‚в–Ѕ10ж™30е€г‚«гѓігѓњг‚ёг‚ўгЃ®гѓ•гѓігѓ»г‚»гѓій¦–з›ёгЃЁгѓѓ¬гѓ“дјљи­°гЂ‚в–Ѕ11ж™6е€еі¶з”°йІиЎ›ж¬Ўе®г16е€е‰Ќз”°еЊЎеЏІе›Ѕйљ›еЌ”еЉ›йЉЂиЎЊз·ЏиЈЃг59е€жњ«жќѕж–‡з§‘з›ёгЂЃдєЊд№‹ж№Їе›Ѕе®¶е…¬е®‰е§”е“Ўй•·гЂЃее†…гѓЇг‚ЇгѓЃгѓіз›ёгЃЁдјљйЈџг‚в–Ѕ14ж™2е€еЊ—ж–№й ењџйљЈжЋҐењ°еџџжЊЇи€€еЇѕз­–ж№е®¤з®Ўе†…её‚з”єйЂЈзµЎеЌ”и­°дјљг®зџіећЈй›…ж•ЏеЊ—жµ·йЃ“ж№е®¤её‚й•·г‚‰г®иЎЁж•¬гЂ‚иҐїйЉжІ–зё»еЊ—ж–№з›ёгЂ€ґжњЁе®—з”·ж—Ґжњ¬з¶­ж–°гЃ®дјљеЏ‚й™ўи­°е“ЎеђЊеё­гЂ16е€е°Џжћ—з§зџ©еєі¶зњЊей™ёйѓЁжЊЇи€€еЇѕз­–еЌ”и­°дјљйЎ§е•Џг36е€и‹…з”°зџҐи‹±дё­е›ЅзµЊжё€йЈеђ€дјљдјљй•·гЂ51е€иµ¤еќ‚зҐђдєЊе®љжњџи€Єз©єеЌ”дјљдјљй•·гЂ‚з››е±±ж­Јд»ЃиЎ™ўи­°е“ЎеђЊеё­гЂ‚в–Ѕ16ж™‚геќ‚жњ¬е­ќеЏёјґј«јЈе…Ёе›Ѕдјљдјљй•·гЂ20е€еЂ‰жћ—е®Џе№іж—Ґе€Љеєі¶ж–°иЃћз¤ѕеЏ–з·еЅ№гЂ35е€ж №жњ¬еЊе…ЋљеЉґз›ёгЂ‚в–Ѕ17ж™‚гж°ёе±±жІ»гѓђг‚¤г‚Єг‚¤гѓігѓг‚№гѓ€гѓЄгѓјеЌ”дјљд»ЈиЎЁзђє‹г»зђє‹й•·гЂ‚е®®жІўзЁЋиЄїдјљй•·еђЊеё­гЂ11е€зЁЋиЄїдјљй•·гЂ48е€гѓ€гѓ«г‚ігЃ®г‚Ёгѓ«гѓ‰г‚ўгѓіе¤§зµ±й гЃЁй›»и©±гЂ‚в–Ѕ19ж™26е€жќ±дє¬гѓ»иµ¤еќ‚г®иЎ™ўи­°е“Ўе®їи€Ћг‚В
12/2/2021,202112,2021,12,2,202112,2021-12,2021-Dec,Fumio_Kishida,No,No,No,No,YES!,No,12жњ2ж—Ґ,в–Ѕ9ж™50е€жќ±дє¬гѓ»иµ¤еќ‚г®иЎ™ўи­°е“Ўе®їи€Ћз™єгЂ53е€е®й‚ёгЂ54е€е ±йЃ“еђ„з¤ѕгЃ®г‚¤гѓіг‚їгѓ“гѓҐгѓјгЂ‚в–Ѕ10ж™22е€гѓћгѓ¬гѓјг‚·г‚ўгЃ®г‚¤г‚№гѓћг‚¤гѓ«г‚µгѓ–гѓЄй¦–з›ёгЃЁй›»и©±гЂ‚в–Ѕ11ж™‚ге…«еќ‚жі°еЏёе…Ёе›Ѕйќ’и‰Із”іе‘Љдјљз·ЏйЈеђ€дјљй•·гЂ29е€з§‹и‘‰е›Ѕе®¶е®‰е…Ёдїќйљње±й•·гЂЃж»ќжІўе†…й–Јжѓ…е±е®гЃеІЎй‡Ће¤–е‹™зњЃз·Џеђ€е¤–дє¤ж”їз­–е±й•·гЂІиЎ›зњЃгЃ®еў—з”°йІиЎ›ж”їз­–е±й•·гЂЃе±±еґЋзµ±еђ€е№•ей•·гЂ‚в–Ѕ12ж™47е€жќ±дє¬гѓ»дёёгЃ®е†…г®гѓ‘гѓ¬г‚№гѓ›гѓ†гѓ«жќ±дє¬гЂ‚е®ґдјљеґгЂЊи‘µгЂЌгЃ§ж•…з·’ж–№е·§дё‰з¬иЈЅи–¬дјљй•·гЃ®гЃЉе€Ґг‚Њг®дјљгЃ«е‡єеё­гЂ‚в–Ѕ13ж™3е€е®й‚ёгЂ47е€и±Љз”°з«з”·гѓ€гѓЁг‚їи‡Єе‹•и»Љз¤ѕй•·гЂ‚в–Ѕ15ж™7е€е…ље›Ѕйљ›дїќеЃҐж€¦з•Ґз‰№е€Ґе§”е“Ўдјљг®ж­¦и¦‹ж•¬дё‰е§”е“Ўй•·гЂЃи‡Єи¦‹и‹±е­ђдє‹е‹™е±й•·гЃ‹г‚‰гЂЊгѓ¦гѓ‹гѓђгѓјг‚µгѓ«гѓ»гѓгѓ«г‚№гѓ»г‚«гѓђгѓ¬гѓ‚ёгЂЌжЋЁйЂІгЃ«еђ‘г_гЃџжЏђиЁж›ёеЏ—г_еЏ–г‚ЉгЂ‚е°Џй‡же¤–е‹™зњЃењ°зђ¦ЏжЁЎиЄІйЎЊеЇ©и­°е®еђЊеё­гЂ38е€дєЊд№‹ж№Їе›Ѕе®¶е…¬е‹™е“Ўе€¶еє¦з›ёгЂ‚в–Ѕ17ж™37е€жІій‡Ћеє±жњ¬йѓЁй•·гЂ58е€е±±йљ›зµЊиІЎз›ёгЂЃей–Јеєњг®з”°е’Њж¬Ўе®гЃдє•дёЉей–ЈеєњеЇ©и­°е®гЃжћ—гЂЃжќ‘зЂ¬дёЎж”їз­–зµ±ж‹¬е®г‚в–Ѕ19ж™8е€жќ±дє¬гѓ»иµ¤еќ‚г®иЎ™ўи­°е“Ўе®їи€Ћг‚В
12/3/2021,202112,2021,12,3,202112,2021-12,2021-Dec,Fumio_Kishida,No,No,No,No,YES!,No,12жњ3ж—Ґ,в–Ѕ9ж™8е€жќ±дє¬гѓ»иµ¤еќ‚г®иЎ™ўи­°е“Ўе®їи€Ћз™єгЂ11е€е®й‚ёгЂ12е€е ±йЃ“еђ„з¤ѕгЃ®г‚¤гѓіг‚їгѓ“гѓҐгѓјгЂ25е€з±ігѓћг‚¤г‚Їгѓ­г‚Ѕгѓ•гѓ€е‰µжҐ­иЂ…г®гѓ“гѓ«гѓ»г‚Іг‚¤гѓ°ЏгЃЁй›»и©±гЂ‚в–Ѕ10ж™1е€й–Ји­°гЂ40е€еѕЊи—¤еЋљеЉґз›ёгЂ45е€еЇєз”°иЈњдЅђе®гЃ«иѕћд»¤дє¤д»г‚в–Ѕ11ж™1е€жќ±дє¬гѓ»йњћгЃЊй–ўгЃ®дё­е¤®еђ€еђЊеєЃи7еЏ·й¤ЁгЂ‚ж•™и‚ІжњЄжќҐе‰µйЂдјљи­°ж‹…еЅ“е®¤гЃ®зњ‹жќїжЋ›г_гЂ‚жњ«жќѕж–‡з§‘з›ёеђЊеё­гЂ11е€е®й‚ёгЂ20е€е®®жІўзЁЋиЄїдјљй•·гЂ55е€жќ±дє¬гѓ»ж°ёз”°з”єгЃ®г‚¶гѓ»г‚­гѓЈгѓ”гѓ€гѓ«гѓ›гѓ†гѓ«жќ±жЂҐгЂ‚дё­е›Ѕж–™зђ†еє—гЊжџг‚±еІЎгЂЌгЃ§йє»з”џе‰Їз·ЏиЈЃгЃиЊ‚жњЁе№№дє‹й•·гЂЃе¬жЋе…љгЃ®е±±еЏЈй‚ЈжґҐз”·д»ЈиЎЁгЂЃеЊ—еЃґдёй›‰Їд»ЈиЎЁгЂЃзџідє•е•“дёе№№дє‹й•·гЃЁдјљйЈџг‚в–Ѕ13ж™5е€е›Ѕдјљг11е€е®й‚ёгЂ15е€ж —з”џе®ж€їе‰Їй•·е®гЃи—¤дє•е®ж€їе‰Їй•·е®иЈњгЃжЈ®е¤–е‹™зњдє‹е±й•·гЂЃеЋљеЉґзњЃг®еђ‰з”°ж¬Ўе®гЃз¦Џеі¶еЊ»е‹™жЉЂз›ЈгЂ‚в–Ѕ14ж™‚гжќ±дє¬гѓ»е¤§ж‰‹з”єгЃ®зµЊе›ЈйЂЈдјљй¤ЁгЂ‚пјґј­ј©з·Џеђ€жі•еѕ‹дє‹е‹™ж‰гЃЄгЃ©дё»е‚¬гЃ®гЂЊйІиЎ›г»зµЊжё€е®‰е…Ёдїќйљњг‚·гѓігѓќг‚ёг‚¦гѓгЂЌгЃ«е‡єеё­гЃ—гЃгЃ‚гЃЃ•гЃ¤гЂ25е€е®й‚ёгЂ‚в–Ѕ15ж™1е€ж–°иЃћг»йЂљдїЎеђ¤ѕгЃ®и«–иЄ¬е§”е“Ўг‚‰гЃЁж‡‡и«33е€ењЁдє¬ж°‘ж”ѕеђ¤ѕгЃ®и§ЈиЄ¬е§”е“Ўг‚‰гЃЁж‡‡и«‚в–Ѕ16ж™2е€е†…й–ЈиЁи…дјљеЉ з›џе±йЃ“еђ„з¤ѕгЃ®г‚­гѓЈгѓгЃЁж‡‡и«46е€е›Ѕйљ›дјљи­°еђ‘г_гЃ®гѓ“гѓ‡г‚ЄгѓЎгѓ‚»гѓјг‚ёеЏЋйЊІгЂ55е€е¤§иҐїе®Џе№ёе…Ў™ўи­°е“ЎгЂ‚в–Ѕ17ж™30е€зµЊжё€иІЎж”їи«®е•Џдјљи­°гЂ‚в–Ѕ18ж™50е€еЋљеЉґз›ёгЂЃжќѕй‡Ће®ж€їй•·е®гЃж—з”џе‰Їй•·е®гЃи—¤дє•е‰Їй•·е®иЈњгЃе¤–е‹™зњдє‹е±й•·гЂЃеЋљеЉґж¬Ўе®г‚в–Ѕ19ж™21е€жќ±дє¬гѓ»зґе°ѕдє•з”єгЃ®гѓ›гѓ†гѓ«гѓ‹гѓҐгѓјг‚Єгѓјг‚їгѓ‹г‚ж—Ґжњ¬ж–™зђ†еє—гЊеЌѓзѕЅй¶ґгЂЌгЃ§ж №жњ¬еЊе…ЋљеЉґз›ёгЂЃе¤§иҐїгЂЃе·¦и—¤з«дёЎе…Ў™ўи­°е“ЎгЃЁдјљйЈџг‚в–Ѕ21ж™18е€жќ±дє¬гѓ»иµ¤еќ‚г®иЎ™ўи­°е“Ўе®їи€Ћг‚В
12/4/2021,202112,2021,12,4,202112,2021-12,2021-Dec,Fumio_Kishida,No,No,No,No,YES!,No,12жњ4ж—Ґ,в–Ѕ8ж™32е€жќ±дє¬гѓ»иµ¤еќ‚г®иЎ™ўи­°е“Ўе®їи€Ћз™єгЂ45е€јЄјІжќ±дє¬й§…г‚в–Ѕ10ж™12е€г‚ЃѕгЃігЃ129еЏ·гЃ§јЄјІйѓЎе±±й§…г‚в–Ѕ11ж™25е€з¦Џеі¶зњЊдјљжґҐи‹Ґжќѕеё‚г®ј©јґй–ўйЂЈж‹з‚№ж–ЅиЁ­гЂЊг‚№гѓћгјгѓ€г‚·гѓ‚ЈјЎЅ‰пјЈјґгЂЌг28е€ењ°е……’йЂзµђ€гЃ«г‚€г‚‹г‚Єгѓігѓ©г‚¤гѓіиІ©еЈІдјљг‚’и¦–еЇџг36е€е¤§з”»йќўг‚Єгѓігѓ©г‚¤гѓідјљи­°г‚·г‚№гѓѓ г‚’и¦–еЇџг‚в–Ѕ12ж™‚ги‡Єиє«гЃ®еѕЊжЏґдјљг®г‚»гѓџгѓЉгѓјгЃ«г‚Єгѓігѓ©г‚¤гѓігЃ§е‡єеё­гЃ—гЃи¬›жј”г44е€з¦Џеі¶зњЊг®е†…ей›…й›„зџҐдє‹гЃе®¤дє•з…§е№ідјљжґҐи‹Ґжќѕеё‚й•·гЂЃдё­жќ‘еЅ°дєЊжњ—г‚№гѓјгѓ‘гјг‚·гѓ‚ЈјЎЅ‰пјЈјґг‚ігѓіг‚Ѕгѓјг‚·г‚ўгѓд»ЈиЎЁзђє‹гЃе®®еґЋж•ЏжЋдјљжґҐе¤§е­¦й•·г‚‰гЃЁдјљйЈџг‚в–Ѕ13ж™46е€ењ°ж–№гЃ®гѓ‚ёг‚їгѓ«еЊ–гЃ«еЏ–г‚Љзµењ°е…–ўдї‚и…гЃЁи»Љеє§гЃ§ж„Џи¦‹дє¤жЏ›г‚в–Ѕ14ж™42е€гѓЇг‚ЇгѓЃгѓіжЋҐзЁ®гЃ®й›»е­ђиЁјжЋж›ёг‚’жґ»з”ЁгЃ™г‚‹еє—иг‚’и¦–еЇџг46е€и‡Єе‹•иµ°иЎЊгѓ­гѓњгѓѓгѓ€гЃ«г‚€г‚‹й…ЌйЃг‚µгѓјгѓ“г‚№г‚’и¦–еЇџг‚в–Ѕ15ж™14е€еђЊеё‚г®й‡‘е·ќз”єе…ђз«Ґдјљй¤ЁгЂ15е€г‚їг‚Їг‚·гѓјгЃ®з›ёд№—г‚Љг‚µгѓјгѓ“г‚№г‚’и¦–еЇџг‚жЈ®иЈњдЅђе®гЃе®¤дє•её‚й•·г‚‰еђЊиЎЊг30е€е ±йЃ“еђ„з¤ѕгЃ®г‚¤гѓіг‚їгѓ“гѓҐгѓјгЂ‚в–Ѕ16ж™47е€јЄјІйѓЎе±±й§…г54е€ж №жњ¬еЊе…ЋљеЉґз›ёгЂ‚в–Ѕ18ж™47е€г‚ЃѕгЃігЃ150еЏ·гЃ§јЄјІжќ±дє¬й§…г‚в–Ѕ19ж™8е€жќ±дє¬гѓ»иµ¤еќ‚г®иЎ™ўи­°е“Ўе®їи€Ћг‚В
12/5/2021,202112,2021,12,5,202112,2021-12,2021-Dec,Fumio_Kishida,No,No,No,No,No,No,12жњ5ж—Ґ,в–Ѕ9ж™11е€жќ±дє¬гѓ»иµ¤еќ‚г®иЎ™ўи­°е“Ўе®їи€Ћз™єгЂ14е€иЎ™ўз¬¬1и­°е“Ўдјљй¤ЁгЂ‚в–Ѕ10ж™30е€и‡Єиє«гЃ®еѕЊжЏґдјљг®г‚»гѓџгѓЉгѓјгЃ«г‚Єгѓігѓ©г‚¤гѓігЃ§е‡єеё­гЃ—гЃи¬›жј”г‚в–Ѕ11ж™34е€е…¬й‚ёгЂ‚в–Ѕ12ж™‚гжњЁеЋџе®ж€їе‰Їй•·е®г‚в–Ѕ13ж™8е€й€ґжњЁиІЎе‹™з›ёгЂЃжњЁеЋџе‰Їй•·е®гЃиІЎе‹™зњЃгЃ®зџўй‡Ћж¬Ўе®гЃиЊ¶и°·дё»иЁ€е±й•·гЂ‚в–Ѕ14ж™10е€з§‹и‘‰е›Ѕе®¶е®‰е…Ёдїќйљње±й•·гЂЃж»ќжІўе†…й–Јжѓ…е±е®г55е€жќ±дє¬гѓ»иµ¤еќ‚г®иЎ™ўи­°е“Ўе®їи€Ћг‚в–Ѕ15ж™50е€зљ‡е±…г‚иЈ•е­ђе¤«дєєгЃЁе…±гЃ«е¤©зљЃзљ‡еђЋдёЎй™›дё‹г®й•·еҐіж„›е­ђгЃ•гЃѕгЃ®ж€ђе№ґиЎЊдє‹г‚в–Ѕ16ж™49е€жќ±дє¬гѓ»иµ¤еќ‚г®иЎ™ўи­°е“Ўе®їи€Ћг‚В
12/6/2021,202112,2021,12,6,202112,2021-12,2021-Dec,Fumio_Kishida,No,No,No,No,No,No,12жњ6ж—Ґ,в–Ѕ8ж™51е€жќ±дє¬гѓ»иµ¤еќ‚г®иЎ™ўи­°е“Ўе®їи€Ћз™єгЂ56е€е®й‚ёгЂ‚в–Ѕ9ж™1е€и‡Ёж™‚й–Ји­°гЂ11е€зџіеЋџеЏ‚дёЋгЃ«иѕћд»¤дє¤д»г‚в–Ѕ11ж™54е€е›Ѕдјљг‚в–Ѕ12ж™2е€иЎ™ўжњ¬дјљи­°гЂ13е€е®й‚ёгЂ39е€е›Ѕдјљг‚в–Ѕ13ж™1е€з¬¬207и‡Ёж™‚е›Ѕдјљй–‹дјљејЏг13е€е®й‚ёгЂ53е€е›Ѕдјљг‚в–Ѕ14ж™2е€иЎ™ўжњ¬дјљи­°гЂ‚ж‰ЂдїЎиЎЁжЋжј”иЄ¬гЂ‚в–Ѕ15ж™1е€еЏ‚й™ўжњ¬дјљи­°гЂ‚ж‰ЂдїЎиЎЁжЋжј”иЄ¬гЂ45е€е®й‚ёгЂ‚в–Ѕ16ж™57е€е›Ѕдјљг‚в–Ѕ17ж™‚ге…љеЅ№е“Ўдјљг16е€е®й‚ёгЂ58е€жќ±дє¬гѓ»иЉќе¬ењ’г®жќ±дє¬гѓ—гѓЄгѓіг‚№гѓ›гѓ†гѓ«гЂ‚е®ґдјљеґгЂЊйііе‡°гЃ®й–“гЌгЃ§е®‰еЌжґѕгЃ®гѓ‘гјгѓ‚ЈгѓјгЃ«е‡єеё­гЃ—гЃгЃ‚гЃЃ•гЃ¤гЂ‚в–Ѕ18ж™42е€жќ±дє¬гѓ»е¤§ж‰‹з”єгЃ®иЄ­еЈІж–°иЃћжќ±дє¬жњ¬з¤ѕгЂ‚гЊй•·е¶‹иЊ‚й›°Џг®ж–‡еЊ–е‹Із«еЏ—з«г‚’гЃЉзҐќгЃ„гЃ™г‚‹дјљгЌгЃ«е‡єеё­гЃ—гЃгЃ‚гЃЃ•гЃ¤гЂ‚в–Ѕ19ж™34е€жќ±дє¬гѓ»иµ¤еќ‚г®иЎ™ўи­°е“Ўе®їи€Ћг‚В
12/7/2021,202112,2021,12,7,202112,2021-12,2021-Dec,Fumio_Kishida,No,No,No,No,YES!,No,12жњ7ж—Ґ,в–Ѕ9ж™25е€жќ±дє¬гѓ»иµ¤еќ‚г®иЎ™ўи­°е“Ўе®їи€Ћз™єгЂ29е€е®й‚ёгЂ‚в–Ѕ10ж™2е€й–Ји­°гЂ12е€еѕЊи—¤еЋљеЉґз›ёгЂЃиђ©з”џз”°зµЊз”Јз›ёгЂЃж–‰и—¤е›Ѕдє¤з›ёгЂЃе±±йљ›зµЊиІЎз›ёгЂЃи‹Ґе®®ж¶€иІ»иЂ…з›ёгЂЃж–°еЋџж–°гЃ—гЃ„иі‡жњ¬дё»зѕ©е®џзЏѕжњ¬йѓЁдє‹е‹™е±й•·д»Јзђ31е€еЋљеЉґз›ёгЂ‚в–Ѕ11ж™19е€е ±йЃ“еђ„з¤ѕгЃ®г‚¤гѓіг‚їгѓ“гѓҐгѓјгЂ26е€е…љжњ¬йѓЁгЂ30е€е…љиІЎж”їеЃҐе…ЁеЊ–жЋЁйЂІжњ¬йѓЁеЅ№е“Ўдјљг57е€е®й‚ёгЂ‚в–Ѕ12ж™‚геЏ¤е·ќжі•з›ёгЂЃз‰§еі¶гѓ‚ёг‚їгѓ«з›ёгЂ‡жз”°е°‘е­ђеЊ–з›ёгЂЃж¶€иІ»иЂ…з›ёгЃЁдјљйЈџг‚в–Ѕ13ж™50е€йќ’е±±з№Ѓж™ґеЏ‚й™ўи­°е“Ўг‚‰гЃ‹г‚‰дё­е›ЅгЃ®дєєжЁ©дѕµе®ігЃ«й–ўгЃ™г‚‹жЏђиЁж›ёеЏ—г_еЏ–г‚ЉгЂ‚в–Ѕ14ж™27е€й€ґжњЁиІЎе‹™з›ёгЂЃиІЎе‹™зњЃгЃ®зџўй‡Ћж¬Ўе®гЃзҐћз”°иІЎе‹™е®гЃиЊ¶и°·дё»иЁ€е±й•·гЂ39е€иІЎе‹™з›ёгЂЃиІЎе‹™зњЃгЃ®ж¬Ўе®гЃдё»иЁ€е±й•·гЂ48е€иІЎе‹™з›ёгЂЃиІЎе‹™ж¬Ўе®г‚в–Ѕ15ж™22е€й‡‘е­ђз·Џе‹™з›ёгЂ»’з”°з·Џе‹™ж¬Ўе®г50е€з§‹и‘‰е›Ѕе®¶е®‰е…Ёдїќйљње±й•·гЂЃе¤–е‹™зњЃг®жЈ®ж¬Ўе®гЃе±±з”°е¤–е‹™еЇ©и­°е®гЃеё‚е·ќеЊ—з±іе±й•·гЂ‚в–Ѕ16ж™40е€ж¦Љей–Јеєњж”їз­–зµ±ж‹¬е®гЃзҐћи°·ж°ґз”Јеє•·е®гЃжќѕжІўз’°еўњЃж°ґгѓ»е¤§ж°—з’°еў±й•·гЂ‚в–Ѕ17ж™4е€е›Ѕе®¶е®‰е…Ёдїќйљње±й•·гЂЃж»ќжІўе†…й–Јжѓ…е±е®гЃе®®е·ќей–ЈиЎ›жџжѓ…е±г‚»гѓіг‚їгѓјж‰й•·гЂ18е€е†…й–Јжѓ…е±е®г‚в–Ѕ18ж™15е€жќ±дє¬гѓ»йЉеє§гЃ®ж—Ґжњ¬ж–™зђ†еє—гЊж–°гЃ°гЃ—йЃЯз”°дё­гЂЌг‚е›Ѕе€–‡д№џдёёзґ…дјљй•·гЃЁдјљйЈџг‚в–Ѕ19ж™45е€жќ±дє¬гѓ»дёёгЃ®е†…г®гѓ‘гѓ¬г‚№гѓ›гѓ†гѓ«жќ±дє¬гЂ‚е®ґдјљеґгЂЊи‘µгЂЌгЃ§жќ±дє¬ж ¤Љг‚µгѓџгѓѓгѓ€гЃ«е‡єеё­гЃ—гЃгЃ‚гЃЃ•гЃ¤гЂ‚в–Ѕ20ж™56е€жќ±дє¬гѓ»иµ¤еќ‚г®иЎ™ўи­°е“Ўе®їи€Ћг‚В
12/8/2021,202112,2021,12,8,202112,2021-12,2021-Dec,Fumio_Kishida,No,No,No,No,No,No,12жњ8ж—Ґ,в–Ѕ8ж™55е€жќ±дє¬гѓ»иµ¤еќ‚г®иЎ™ўи­°е“Ўе®їи€Ћз™єгЂ59е€е®й‚ёгЂ‚в–Ѕ9ж™2е€жњЁеЋџе®ж€їе‰Їй•·е®г‚в–Ѕ11ж™30е€еѕЊи—¤еЋљеЉґз›ёгЂЃжќѕй‡ЋгЃжњЁеЋџгЃж—з”џж­Је‰Їе®ж€їй•·е®гЃи—¤дє•е®ж€їе‰Їй•·е®иЈњгЃжЈ®е¤–е‹™зњдє‹е±й•·гЂЃеђ‰з”°еЋљеЉґж¬Ўе®г‚в–Ѕ12ж™54е€е›Ѕдјљг57е€иЊ‚жњЁе№№дє‹й•·гЂ‚в–Ѕ13ж™2е€иЎ™ўжњ¬дјљи­°гЂ‚в–Ѕ15ж™55е€е®й‚ёгЂ‚в–Ѕ16ж™23е€е…љи­°е“ЎйЂЈз›џгЊе›Ѕж°‘еЊ»з™‚г‚’е®€г‚‹и­°е“ЎгЃ®дјљгЌг®еЉи—¤е‹ќдїЎдјљй•·гЃ‹г‚‰жЏђиЁж›ёеЏ—г_еЏ–г‚ЉгЂ50е€е…љг®дЅђи—¤ж­Јд№…е¤–дє¤йѓЁдјљй•·гЂЃиЎ›и—¤еѕЃеЈ«йѓЋе¤–дє¤иЄїжџ»дјљй•·гЂ‚в–Ѕ17ж™1е€з‰§еі¶иЎЊж”їж”№йќ©з›ёгЂ59е€е›Ѕйљ›дјљи­°гЃЄгЃ©гЃ«еђ‘г_гЃџгѓ“гѓ‚ЄгѓЎгѓ‚»гѓјг‚ёеЏЋйЊІгЂ‚в–Ѕ18ж™16е€еЋљеЉґз›ёгЂЃжќѕй‡ЋгЃжњЁеЋџгЃж—з”џж­Је‰Їй•·е®гЃи—¤дє•е‰Їй•·е®иЈњгЃе¤–е‹™зњдє‹е±й•·гЂЃеЋљеЉґж¬Ўе®г‚в–Ѕ19ж™32е€жќ±дє¬гѓ»иµ¤еќ‚г®иЎ™ўи­°е“Ўе®їи€Ћг‚В
12/9/2021,202112,2021,12,9,202112,2021-12,2021-Dec,Fumio_Kishida,No,No,No,No,No,No,12жњ9ж—Ґгѓ»10ж—Ґ,гЂ9ж—ҐгЂ‰в–Ѕ6ж™58е€жќ±дє¬гѓ»иµ¤еќ‚г®иЎ™ўи­°е“Ўе®їи€Ћз™єгЂ‚в–Ѕ7ж™2е€е®й‚ёгЂ5е€зЈЇеґЋе®ж€їе‰Їй•·е®г52е€жњЁеЋџе®ж€їе‰Їй•·е®г‚в–Ѕ9ж™53е€е›Ѕдјљг‚в–Ѕ10ж™1е€еЏ‚й™ўжњ¬дјљи­°гЂ‚в–Ѕ11ж™41е€е®й‚ёгЂ‚в–Ѕ12ж™39е€зљ‡е±…г‚иЈ•е­ђе¤«дєєгЃЁе…±гЃ«зљ‡еђЋй™›дё‹иЄ•з”џж—ҐзҐќиігЃ«е‡єеё­гЂ‚в–Ѕ13ж™24е€е®й‚ёгЂ52е€е›Ѕдјљг‚в–Ѕ14ж™2е€иЎ™ўжњ¬дјљи­°гЂ‚в–Ѕ17ж™14е€е®й‚ёгЂ40е€дё­и°·иЈњдЅђе®г55е€гЂЊгѓ‡г‚Јг‚№г‚«гѓђгјиѕІе±±жјЃжќ‘гЃ®е®ќгЌйЃёе®љдє‹жҐ­иЂ…гЃЁиЁеїµж’®еЅ±гЂ‚дє¤жµЃдјљгЃ§гЃ‚гЃ„гЃ•гЃ¤гЂ‚в–Ѕ18ж™15е€иЎЊж”їж”№йќ©жЋЁйЂІдјљи­°гЂ37е€дёЉе·ќе№№дє‹й•·д»Јзђ‚в–Ѕ19ж™2е€ж №жњ¬еЊе…ЋљеЉґз›ёгЂ20е€еЏ¤иізЇ¤иЎ™ўи­°е“ЎгЂ45е€еѕЊи—¤еЋљеЉґз›ёгЂЃжќѕй‡ЋгЃжњЁеЋџгЃзЈЇеґЋгЃж—з”џж­Је‰Їе®ж€їй•·е®гЃи—¤дє•е®ж€їе‰Їй•·е®иЈњгЃжЈ®е¤–е‹™зњдє‹е±й•·гЂЃеђ‰з”°еЋљеЉґж¬Ўе®г‚в–Ѕ20ж™17е€еЋљеЉґз›ёгЂЃеЋљеЉґж¬Ўе®г‚в–Ѕ21ж™‚гж ёи»Ќзё®гЃ®е®џиіЄзљЃЄйЂІе±•г®гЃџг‚ЃгЃ®е®ж°‘дјљеђ€гЃ«г‚Єгѓігѓ©г‚¤гѓігЃ§е‡єеё­гЂ19е€жќ±дє¬гѓ»иµ¤еќ‚г®иЎ™ўи­°е“Ўе®їи€Ћг‚в–Ѕ23ж™45е€е®й‚ёгЂ47е€гЂЊж°‘дё»дё»зѕ©г‚µгѓџгѓѓгѓ€гЌгЃ«г‚Єгѓігѓ©г‚¤гѓігЃ§е‡єеё­гЂ‚г10ж—ҐгЂ‰в–Ѕ0ж™33е€жќ±дє¬гѓ»иµ¤еќ‚г®иЎ™ўи­°е“Ўе®їи€Ћг‚В
12/10/2021,202112,2021,12,10,202112,2021-12,2021-Dec,Fumio_Kishida,No,No,No,No,YES!,No,12жњ10ж—Ґ,в–Ѕ6ж™58е€жќ±дє¬гѓ»иµ¤еќ‚г®иЎ™ўи­°е“Ўе®їи€Ћз™єгЂ‚в–Ѕ7ж™2е€е®й‚ёгЂ12е€зЈЇеґЋе®ж€їе‰Їй•·е®г‚в–Ѕ9ж™1е€й–Ји­°гЂ16е€зЈЇеґЋе‰Їй•·е®г54е€е›Ѕдјљг‚в–Ѕ10ж™1е€еЏ‚й™ўжњ¬дјљи­°гЂ‚в–Ѕ11ж™45е€е®й‚ёгЂ‚в–Ѕ12ж™53е€е›Ѕдјљг‚в–Ѕ13ж™1е€еЏ‚й™ўжњ¬дјљи­°гЂ‚в–Ѕ15ж™40е€е®й‚ёгЂ‚в–Ѕ16ж™7е€е›Ѕдјљг15е€иЎ™ўдє€з®—е§”е“Ўдјљг25е€е®й‚ёгЂ‚в–Ѕ17ж™5е€жќ±дє¬гѓ»ж°ёз”°з”єгЃ®г‚¶гѓ»г‚­гѓЈгѓ”гѓ€гѓ«гѓ›гѓ†гѓ«жќ±жЂҐгЂ‚е®ґдјљеґгЂЊйііе‡°гЂЌгЃ§иѕІжћ—ж°ґз”Јз‰©з­‰ијёе‡єдїІе…Ёе›ЅеЌ”и­°дјљз·ЏдјљгЃ«е‡єеё­гЃ—гЃгЃ‚гЃЃ•гЃ¤гЂ‚иЁеїµж’®еЅ±гЂ18е€е®й‚ёгЂ23е€з§‹и‘‰е›Ѕе®¶е®‰е…Ёдїќйљње±й•·гЂЃж»ќжІўе†…й–Јжѓ…е±е®г37е€е†…й–Јжѓ…е±е®г‚в–Ѕ19ж™11е€е ±йЃ“еђ„з¤ѕгЃ®г‚¤гѓіг‚їгѓ“гѓҐгѓјгЂ27е€жќ±дє¬гѓ»иµ¤еќ‚г®иЎ™ўи­°е“Ўе®їи€Ћг‚В
12/11/2021,202112,2021,12,11,202112,2021-12,2021-Dec,Fumio_Kishida,No,No,No,No,YES!,No,12жњ11ж—Ґ,гЂеЌ€е‰Ќдё­гЃЇжќ±дє¬гѓ»иµ¤еќ‚г®иЎ™ўи­°е“Ўе®їи€ЋгЃ§йЃЋгЃ”гЃ™г‚в–Ѕ16ж™43е€иЎ™ўи­°е“Ўе®їи€Ћз™єгЂ46е€иЎ™ўи­°е“Ўе®їи€ЋгЃ‹г‚‰е¬й‚ёгЃ«еј•гЃЈи¶ЉгЃ—гЂ47е€е ±йЃ“еђ„з¤ѕгЃ®г‚¤гѓіг‚їгѓ“гѓҐгѓјгЂ‚в–Ѕ19ж™1е€жќ±дє¬гѓ»йЉеє§гЃ®гЂЊгг‚­г‚·гѓ»гѓ‰г»гѓ“гѓ«гЂЌг‚еђЊгѓ“гѓ«е†…г®гЃ™гЃ—еє—гЊй®ЁгЂй«е±±гЂЌгЃ§иЈ•е­ђе¤«дєєгЂЃењ°е…є‹е‹™ж‰г‚№г‚їгѓѓ•гЃЁйЈџдє‹г‚в–Ѕ21ж™28е€е…¬й‚ёгЂ‚В
12/12/2021,202112,2021,12,12,202112,2021-12,2021-Dec,Fumio_Kishida,No,No,No,No,No,No,,
12/13/2021,202112,2021,12,13,202112,2021-12,2021-Dec,Fumio_Kishida,YES!,No,No,No,YES!,No,12жњ12ж—Ґгѓ»13ж—Ґ,гЂ12ж—ҐгЂ‰в–Ѕ10ж™13е€е…¬й‚ёз™єгЂ19е€жќ±дє¬гѓ»зґе°ѕдє•з”єгЃ®гѓ›гѓ†гѓ«гѓ‹гѓҐгѓјг‚Єгѓјг‚їгѓ‹г‚еђЊгѓ›гѓ†гѓ«е†…г®гЂЊгг‚ўг‚µгѓ­гѓіе¤§й‡ЋгЌгЃ§ж•Јй«ЄгЂ‚в–Ѕ12ж™12е€е…¬й‚ёгЂ‚в–Ѕ17ж™2е€еѕЊи—¤еЋљеЉґз›ёгЂЃи—¤дє•е®ж€їе‰Їй•·е®иЈњгЃеЋљеЉґзњЃг®еђ‰з”°ж¬Ўе®гЃз¦Џеі¶еЊ»е‹™жЉЂз›ЈгЂ45е€з§‹и‘‰е›Ѕе®¶е®‰е…Ёдїќйљње±й•·гЂЃеі¶з”°йІиЎ›ж¬Ўе®г€ґжњЁйІиЎ›иЈ…е‚™еє•·е®г‚г13ж—ҐгЂ‰в–Ѕ7ж™42е€е…¬й‚ёе‰ЌгЃ§е ±йЃ“еђ„з¤ѕгЃ®г‚¤гѓіг‚їгѓ“гѓҐгѓјгЂ44е€е®й‚ёгЂ46е€жњЁеЋџе®ж€їе‰Їй•·е®г‚в–Ѕ8ж™49е€е›Ѕдјљг56е€иЎ™ўдє€з®—е§”е“Ўдјљг‚в–Ѕ12ж™6е€е®й‚ёгЂ30е€й–ўеЏЈеЏ‚й™ўи­°е“Ўдјљй•·гЂЃзѕЅз”џз”°дїЉеЏ‚й™ўи­°е“ЎгЂ54е€е›Ѕдјљг‚в–Ѕ13ж™‚гиЎ™ўдє€з®—е§”г‚в–Ѕ17ж™6е€е…љеЅ№е“Ўдјљг27е€е®й‚ёгЂ59е€е ±йЃ“еђ„з¤ѕгЃ®г‚¤гѓіг‚їгѓ“гѓҐгѓјгЂ‚в–Ѕ18ж™12е€жќ±дє¬гѓ»иЉќе¬ењ’г®гѓ›гѓ†гѓ«гЂЊг‚¶гѓ»гѓ—гѓЄгѓіг‚№гѓ‘гјг‚Їг‚їгѓЇгѓјжќ±дє¬гЂЌг‚е®ґдјљеґгЂЊг‚ігѓігѓ™гѓіг‚·гѓ§гѓігѓ›гјгѓ«гЂЌгЃ§гЂЃиЊ‚жњЁжґѕгЃ®гѓ‘гјгѓ‚ЈгѓјгЃ«е‡єеё­гЃ—гЃгЃ‚гЃЃ•гЃ¤гЂ38е€е…¬й‚ёгЂ‚В
12/14/2021,202112,2021,12,14,202112,2021-12,2021-Dec,Fumio_Kishida,No,No,No,No,No,No,12жњ14ж—Ґ,в–Ѕ6ж™28е€е…¬й‚ёгЃ‹г‚‰е®й‚ёгЂ33е€жњЁеЋџе®ж€їе‰Їй•·е®г‚в–Ѕ8ж™16е€й–Ји­°гЂ50е€е›Ѕдјљг58е€иЎ™ўдє€з®—е§”е“Ўдјљг‚в–Ѕ12ж™5е€е®й‚ёгЂ53е€е›Ѕдјљг‚в–Ѕ13ж™‚гиЎ™ўдє€з®—е§”г‚в–Ѕ17ж™10е€е®й‚ёгЂ35е€й«её‚ж”їиЄїдјљй•·г‚‰гЃ‹г‚‰еЊ—дє¬е†¬е­Јдє”ијЄгЃ®гЂЊе¤–дє¤гѓњг‚¤г‚ігѓѓ€гЂЌгЃ«й–ўгЃ™г‚‹е…±еђЊеЈ°жЋеЏ—гЃ‘еЏ–г‚Љг56е€й‡Ћз”°е°‘е­ђеЊ–з›ёгЂЃи—¤дє•е®ж€їе‰Їй•·е®иЈњгЃи°·е†…ей–ЈеЇ©и­°е®г‚в–Ѕ18ж™30е€гѓ‰г‚¤гѓ®г‚·гѓ§гѓ«гѓ¦–з›ёгЃЁй›»и©±гЂ‚в–Ѕ19ж™‚гж–°е·ќиІЎе‹™зњЃе®ж€їй•·гЂ46е€е…¬й‚ёгЂ‚В
12/15/2021,202112,2021,12,15,202112,2021-12,2021-Dec,Fumio_Kishida,No,No,No,No,YES!,No,12жњ15ж—Ґ,в–Ѕ6ж™58е€е…¬й‚ёгЃ‹г‚‰е®й‚ёгЂ‚в–Ѕ7ж™1е€жњЁеЋџе®ж€їе‰Їй•·е®г‚в–Ѕ8ж™53е€е›Ѕдјљг‚в–Ѕ9ж™‚гиЎ™ўдє€з®—е§”е“Ўдјљг‚в–Ѕ12ж™8е€е®й‚ёгЂ‚в–Ѕ15ж™56е€е›Ѕдјљг58е€еЏ¤е±‹ењ­еЏёиЎ™ўи­°е“ЎгЂ‚в–Ѕ16ж™1е€иЎ™ўжњ¬дјљи­°гЂ‚в–Ѕ17ж™15е€иЎ™ўгЃ®зґ°з”°гЂЃжµ·ж±џз”°ж­Је‰Їи­°й•·гЂЃе±±еЏЈи­°й™ўйЃ‹е–¶е§”е“Ўй•·гЂЃи‡Єж°‘е…љгЂЃе¬жЋе…љгЃ«гЃ‚гЃ„гЃ•гЃ¤е›ћг‚ЉгЂ‚й€ґжњЁиІЎе‹™з›ёгЂЃжќѕй‡ЋгЃжњЁеЋџж­Је‰Їе®ж€їй•·е®г«жњЁе›ЅеЇѕе§”е“Ўй•·гЂЃдЅђи—¤иЊ‚жЁ№е…¬жЋе…ље›ЅеЇѕе§”е“Ўй•·еђЊиЎЊг26е€е®й‚ёгЂ42е€з›®ж™‚ж”їеЅ¦ж¬Ўжњџдё‡е›ЅйѓµдѕїйЂЈеђ€пј€пјµј°јµј‰е›Ѕйљ›дє‹е‹™е±й•·гЂ‚йЃЯе­ђз·Џе‹™з›ёгЂЃе°Џй‡же¤–е‹™зњЃењ°зђ¦ЏжЁЎиЄІйЎЊеЇ©и­°е®еђЊеё­гЂ54е€е ±йЃ“еђ„з¤ѕгЃ®г‚¤гѓіг‚їгѓ“гѓҐгѓјгЂ‚в–Ѕ18ж™3е€жќ±дє¬гѓ»зґе°ѕдє•з”єгЃ®гѓ›гѓ†гѓ«гѓ‹гѓҐгѓјг‚Єгѓјг‚їгѓ‹г‚е®ґдјљеґгЂЊиЉ™и“‰г®й–“гЌгЃ§жќ±дє¬йѓЅи­°дјљи‡Єж°‘е…љз‰№е€Ґз·ЏдјљгЃ«е‡єеё­гЃ—гЃгЃ‚гЃЃ•гЃ¤гЂ25е€е…¬й‚ёгЂ‚В
12/16/2021,202112,2021,12,16,202112,2021-12,2021-Dec,Fumio_Kishida,No,No,No,No,No,No,12жњ16ж—Ґ,в–Ѕ6ж™28е€е…¬й‚ёгЃ‹г‚‰е®й‚ёгЂ32е€зЈЇеґЋе®ж€їе‰Їй•·е®г‚в–Ѕ8ж™43е€е›Ѕдјљг50е€еЏ‚й™ўдє€з®—е§”е“Ўдјљг‚в–Ѕ12ж™4е€жќ±дє¬гѓ»зґе°ѕдє•з”єгЃ®гѓ›гѓ†гѓ«гѓ‹гѓҐгѓјг‚Єгѓјг‚їгѓ‹г‚е®ґдјљеґгЂЊй¶ґгЃ®й–“гЌгЃ§ж•…дё­иҐїе®Џже‰ЌзµЊе›ЈйЂЈдјљй•·гЃ®гЃЉе€Ґг‚Њг®дјљгЃ«е‡єеё­гЂ17е€е®й‚ёгЂ52е€е›Ѕдјљг‚в–Ѕ13ж™‚геЏ‚й™ўдє€з®—е§”г‚в–Ѕ17ж™27е€е®й‚ёгЂ‚в–Ѕ18ж™7е€з”°жќ‘жІд№…е‰ЌеЋљеЉґз›ёгЂЃе°ѕиѕ»з§д№…е…ѓеЋљеЉґз›ёгЂ23е€й€ґжњЁиІЎе‹™з›ёгЂЃиІЎе‹™зњЃгЃ®зџўй‡Ћж¬Ўе®гЃиЊ¶и°·дё»иЁ€е±й•·гЂЃдЅЏжІўдё»зЁЋе±й•·гЂ‚в–Ѕ19ж™1е€жќ±дє¬гѓ»ж–°ж©‹г®з¬¬дёгѓ›гѓ†гѓ«жќ±дє¬гЂ‚е®ґдјљеґгЂЊггѓЄгѓћгѓґг‚§гѓјгѓ©ј©ј©гЂЌгЃ§ж—©е¤§е‡єиє«гЃ®и‡Єж°‘е…ље›Ѕдјљи­°е“ЎгЃ§гЃ¤гЃЏг‚‹гЂЊи‡Єж°‘е…ље›ЅдјљзЁІй–дјљгЌз·ЏдјљгЃ«е‡єеё­гЃ—гЃгЃ‚гЃЃ•гЃ¤гЂ26е€е…¬й‚ёгЂ‚В
12/17/2021,202112,2021,12,17,202112,2021-12,2021-Dec,Fumio_Kishida,No,No,No,No,YES!,No,12жњ17ж—Ґ,в–Ѕ5ж™55е€е…¬й‚ёгЃ§з±іиЈЅи–¬е¤§ж‰‹гѓ•г‚Ўг‚¤г‚¶гѓјз¤ѕгЃ®гѓ–гјгѓ©жњй«зµЊе–¶иІ¬д»»иЂ…пј€пјЈјҐјЇј‰гЃЁй›»и©±гЂ‚в–Ѕ6ж™9е€е®й‚ёгЂ25е€зЈЇеґЋе®ж€їе‰Їй•·е®г‚в–Ѕ8ж™22е€й–Ји­°гЂ43е€зЈЇеґЋе‰Їй•·е®г54е€е›Ѕдјљг‚в–Ѕ9ж™2е€еЏ‚й™ўдє€з®—е§”е“Ўдјљг‚в–Ѕ12ж™‚ге®й‚ёгЂ2е€зЈЇеґЋе‰Їй•·е®г53е€е›Ѕдјљг56е€жћ—е¤–з›ёгЂ‚в–Ѕ13ж™‚геЏ‚й™ўдє€з®—е§”г‚в–Ѕ16ж™40е€е®й‚ёгЂ‚в–Ѕ17ж™10е€е ±йЃ“еђ„з¤ѕгЃ®г‚¤гѓіг‚їгѓ“гѓҐгѓјгЂ55е€з§‹и‘‰е›Ѕе®¶е®‰е…Ёдїќйљње±й•·гЂЃж»ќжІўе†…й–Јжѓ…е±е®г‚в–Ѕ18ж™18е€е›Ѕйљ›дјљи­°еђ‘г_гЃ®гѓ“гѓ‡г‚ЄгѓЎгѓ‚»гѓјг‚ёеЏЋйЊІгЂ50е€ж¬§е·ћйЈеђ€пј€пјҐјµј‰г®гѓ•г‚©гѓігѓ‚ўгѓ©г‚¤г‚Ёгѓіж¬§е·ће§”е“Ўй•·гЃЁй›»и©±гЂ‚в–Ѕ19ж™21е€е†…й–Јжѓ…е±е®г‚в–Ѕ20ж™45е€е…¬й‚ёгЂ‚В
12/18/2021,202112,2021,12,18,202112,2021-12,2021-Dec,Fumio_Kishida,No,No,No,No,YES!,No,12жњ18ж—Ґ,гЂеЌ€е‰Ќдё­гЃЇжќҐе®ўгЃЄгЃЏгЃе¬й‚ёгЃ§йЃЋгЃ”гЃ™г‚в–Ѕ14ж™15е€е…¬й‚ёз™єгЂ28е€жќ±дє¬гѓ»ж—Ґжњ¬ж©‹е®¤з”єгЃ®ж—Ґжњ¬ж©‹дё‰и¶Љжњ¬еє—г31е€гЂ2021е№ґе ±йЃ“езњџе±•гЌг‚’и¦іиіћг56е€е ±йЃ“еђ„з¤ѕгЃ®г‚¤гѓіг‚їгѓ“гѓҐгѓјгЂ‚в–Ѕ15ж™25е€е…¬й‚ёгЂ43е€жњЁеЋџе®ж€їе‰Їй•·е®г‚в–Ѕ16ж™36е€ж №жњ¬еЊиЎ™ўдє€з®—е§”е“Ўй•·гЂ‚В
12/19/2021,202112,2021,12,19,202112,2021-12,2021-Dec,Fumio_Kishida,No,No,No,No,No,No,12жњ19ж—Ґ,гЂеЌ€е‰Ќдё­гЃЇжќҐе®ўгЃЄгЃЏгЃе¬й‚ёгЃ§йЃЋгЃ”гЃ™г‚в–Ѕ12ж™58е€зЈЇеґЋе®ж€їе‰Їй•·е®г‚в–Ѕ15ж™34е€еѕЊи—¤еЋљеЉґз›ёгЂЃжµњи°·дїќй™єе±й•·гЂ49е€й€ґжњЁиІЎе‹™з›ёгЂЃиІЎе‹™зњЃгЃ®зџўй‡Ћж¬Ўе®гЃиЊ¶и°·дё»иЁ€е±й•·гЂ‚в–Ѕ16ж™13е€иІЎе‹™з›ёгЂЃеЋљеЉґз›ёгЂЃиІЎе‹™зњЃгЃ®ж¬Ўе®гЃдё»иЁ€е±й•·гЂЃеЋљеЉґзњЃдїќй™єе±й•·гЂ55е€еЋљеЉґз›ёгЂЃеЋљеЉґзњЃг®еђ‰з”°ж¬Ўе®гЃдЅђеЋџеЃҐеє·е±й•·гЂ‚в–Ѕ17ж™32е€з§‹и‘‰е›Ѕе®¶е®‰е…Ёдїќйљње±й•·гЂЃжЈ®е¤–е‹™ж¬Ўе®г45е€е›Ѕе®¶е®‰е…Ёдїќйљње±й•·гЂЃе¤–е‹™ж¬Ўе®гЃзµЊз”ЈзњЃг®еє¬зµЊз”ЈеЇ©и­°е®гЃжќѕе°ѕйЂље•†ж”їз­–е±й•·гЂ‚В
12/20/2021,202112,2021,12,20,202112,2021-12,2021-Dec,Fumio_Kishida,No,No,No,No,No,No,12жњ20ж—Ґ,в–Ѕ8ж™29е€е…¬й‚ёгЃ‹г‚‰е®й‚ёгЂ33е€зЈЇеґЋе®ж€їе‰Їй•·е®г53е€е›Ѕдјљг‚в–Ѕ9ж™‚геЏ‚й™ўдє€з®—е§”е“Ўдјљг‚в–Ѕ11ж™51е€е®й‚ёгЂ‚в–Ѕ12ж™2е€жњЁеЋџе®ж€їе‰Їй•·е®гЃе›Ѕе ґе№ёд№‹еЉ©гЂЃЯе­ђдїЉе№ігЂ•·и°·е·ќж·ідєЊеђ„иЎ™ўи­°е“ЎгЃЁдјљйЈџг45е€жњЁеЋџе‰Їй•·е®гЃЯе­ђг•·и°·е·ќдёЎиЎ™ўи­°е“ЎгЂ‚в–Ѕ14ж™5е€зџіеЋџе®Џй«иЎ™ўи­°е“ЎгЂ20е€з§‹и‘‰е›Ѕе®¶е®‰е…Ёдїќйљње±й•·гЂЃжЈ®е¤–е‹™ж¬Ўе®гЃеі¶з”°йІиЎ›ж¬Ўе®г44е€жќ‘дє•иЈњдЅђе®г‚в–Ѕ15ж™3е€е±±йљ›зµЊиІЎз›ёгЂЃз¤ѕдјљдїќйљњж”№йќ©ж‹…еЅ“е®¤гЃ®и°·е†…е®¤й•·гЂЃе¤§еі¶ж¬Ўй•·гЂ30е€з‰‡е±±гЃ•гЃ¤гЃЌе…љй‡‘ићЌиЄїжџ»дјљй•·г‚‰г‚в–Ѕ16ж™2е€е›Ѕдјљг8е€жћ—е¤–з›ёгЂ11е€еЏ‚й™ўжњ¬дјљи­°гЂ‚в–Ѕ17ж™29е€еЏ‚й™ўгЃ®е±±жќ±гЂЃе°Џе·ќж­Је‰Їи­°й•·гЂЃз¦ЏеІЎи­°й™ўйЃ‹е–¶е§”е“Ўй•·гЂЃи‡Єж°‘е…љгЂЃе¬жЋе…љгЃЄгЃ©гЃ«гЃ‚гЃ„гЃ•гЃ¤е›ћг‚ЉгЂ‚й€ґжњЁиІЎе‹™з›ёгЂЃжќѕй‡ЋгЃзЈЇеґЋж­Је‰Їе®ж€їй•·е®гЃеІЎз”°гЂЃе¬жЋе…љгЃ®е±±жњ¬еЌљеЏёдёЎеЏ‚й™ўе›ЅеЇѕе§”е“Ўй•·еђЊиЎЊг42е€е…љеЅ№е“Ўдјљг‚в–Ѕ18ж™6е€е®й‚ёгЂ8е€е е†…дє”ијЄз›ёгЂ‚в–Ѕ19ж™5е€зџіе·ќж‹‰и‡ґе•ЏйЎЊеЇѕз­–жњ¬йѓЁдє‹е‹™е±й•·гЂ‚в–Ѕ20ж™23е€е…¬й‚ёгЂ‚В
12/21/2021,202112,2021,12,21,202112,2021-12,2021-Dec,Fumio_Kishida,No,No,No,No,No,No,12жњ21ж—Ґ,в–Ѕ7ж™31е€е…¬й‚ёгЃ‹г‚‰е®й‚ёгЂ35е€зЈЇеґЋе®ж€їе‰Їй•·е®г‚в–Ѕ8ж™40е€ењ°ж–№е€Ё©ж”№йќ©жЋЁйЂІжњ¬йѓЁгЂ54е€й–Ји­°гЂ‚в–Ѕ9ж™16е€зЈЇеґЋе‰Їй•·е®г37е€жџеЋџйЂЏе…ље®®еґЋзњЊйЂЈдјљй•·г‚‰г‚ж­¦дє•дїЉиј”иЎ™ўи­°е“ЎеђЊеё­гЂ50е€е›Ѕдјљг‚в–Ѕ10ж™1е€еЏ‚й™ўжњ¬дјљи­°гЂ‚в–Ѕ12ж™18е€жќ±дє¬гѓ»зґе°ѕдє•з”єгЃ®гѓ›гѓ†гѓ«гѓ‹гѓҐгѓјг‚Єгѓјг‚їгѓ‹г‚дё­е›Ѕж–™зђ†еє—гЊе¤§и¦іи‹‘гЌгЃ§иђ©з”џз”°зµЊз”Јз›ёгЃЁдјљйЈџг57е€е®й‚ёгЂ‚в–Ѕ13ж™19е€з•™е®€иЊ‚е№ёе…љдЅђиізњЊйЈдјљй•·гЂ‚еІ©з”°е’Њи¦ЄиЎ™ўи­°е“ЎеђЊеё­гЂ32е€жњ€дѕ‹зµЊжё€е±е‘Љй–ўдї‚й–Јеѓљдјљи­°гЂ‚в–Ѕ14ж™2е€е›ЅгЃЁењ°ж–№гЃ®еЌ”и­°гЃ®е ґгЂ‚в–Ѕ15ж™11е€е…љжњ¬йѓЁгЂ18е€е…љжІжі•ж”№ж­Је®џзЏѕжњ¬йѓЁгЂ29е€е®й‚ёгЂ‚в–Ѕ16ж™46е€ј®јЁј«з•Єзµ®еЏЋйЊІгЂ‚в–Ѕ17ж™55е€е¤§жІјз‘ћз©‚е‰ЌеЏ‚й™ўи­°е“ЎгЂ‚в–Ѕ19ж™‚гиЁи…дјљи¦‹г‚в–Ѕ20ж™41е€е…¬й‚ёгЂ‚В
12/22/2021,202112,2021,12,22,202112,2021-12,2021-Dec,Fumio_Kishida,No,No,No,No,YES!,No,12жњ22ж—Ґ,в–Ѕ7ж™28е€е…¬й‚ёз™єгЂ34е€жќ±дє¬гѓ»иµ¤еќ‚г®јЎј®јЎг‚¤гѓіг‚їгѓјг‚ігѓігѓЃгѓЌгѓіг‚їгѓ«гѓ›гѓ†гѓ«жќ±дє¬гЂ‚е®ґдјљеґгЂЊггѓ­гѓџгѓЌгѓіг‚№гЂЌгЃ§и‡Єиє«гЃ®дє‹е‹™ж‰дё»е‚¬гЃ®г‚»гѓџгѓЉгѓјгЃ«е‡єеё­гЃ—гЃи¬›жј”г‚в–Ѕ8ж™55е€е…¬й‚ёгЂ‚в–Ѕ9ж™7е€е®й‚ёгЂ18е€жЈљж©‹е…љиЎЊж”їж”№йќ©жЋЁйЂІжњ¬йѓЁй•·гЃ‹г‚‰жЏђиЁж›ёеЏ—г_еЏ–г‚ЉгЂ31е€дё­жњ¬йљї—еєі¶зњЊи­°дјљи­°й•·гЂ49е€й‡‘е­ђз·Џе‹™з›ёгЂЃз‰§еі¶гѓ‚ёг‚їгѓ«з›ёгЂЃе°Џжћ—гѓ‚ёг‚їгѓ«е‰Їе¤§и‡ЈгЂЃи—¤дє•е®ж€їе‰Їй•·е®иЈњгЃз·Џе‹™зњЃг®з«№е†…з·Џе‹™еЇ©и­°е®гЃеђ‰з”°жѓ…е±жµљиЎЊж”їе±й•·гЂЃдєЊе®®з·Џеђ€йЂљдїЎеџєз›¤е±й•·гЂ52е€гѓ‚ёг‚їгѓ«з›ёгЂЃгѓ‡г‚ёг‚їгѓ«е‰Їе¤§и‡ЈгЂЃи—¤дє•е‰Їй•·е®иЈњгЃз·Џе‹™зњЃг®з·Џе‹™еЇ©и­°е®гЃжѓ…е ±жµљиЎЊж”їе±й•·гЂЃз·Џеђ€йЂљдїЎеџєз›¤е±й•·гЂ‚в–Ѕ10ж™18е€е±±йљ›зµЊиІЎз›ёгЂЃей–Јеєњг®з”°е’Њж¬Ўе®гЃдє•дёЉей–ЈеєњеЇ©и­°е®гЃжћ—гЂЃжќ‘зЂ¬дёЎж”їз­–зµ±ж‹¬е®г‚в–Ѕ11ж™51е€еѕЎе®¤еЃҐдёйѓЋе…Ёе›ЅдїЎз”Ёй‡‘еє«еЌ”дјљдјљй•·гЃ®иЎЁж•¬гЂ‚в–Ѕ12ж™‚ге±±еЏЈй‚ЈжґҐз”·е…¬жЋе…љд»ЈиЎЁгЃЁдјљйЈџг‚в–Ѕ13ж™6е€й€ґжњЁиІЎе‹™з›ёгЂЃиІЎе‹™зњЃгЃ®зџўй‡Ћж¬Ўе®гЃиЊ¶и°·дё»иЁ€е±й•·гЂЃи§’з”°зђІЎе±й•·гЂ‚в–Ѕ14ж™‚ге†…й–ЈгЂЃей–Јеєњж°ёе№ґе‹¤з¶љи…иЎЁеЅ°ејЏг40е€жќ±дє¬гѓ»е†…е№ёз”єгЃ®еёќе›Ѕгѓ›гѓ†гѓ«гЂ41е€иЄ­еЈІж–°иЃћг‚°гѓ«гѓјгѓ—жњ¬з¤ѕгЃ®иЂЃе·ќзҐҐдёдјљй•·гЂЃе±±еЏЈеЇїдёз¤ѕй•·г‚‰г‚в–Ѕ15ж™‚ге®ґдјљеґгЂЊе­”й›Ђжќ±гЃ®й–“гЌгЃ§иЄ­еЈІе›Ѕйљ›зµЊжё€ж‡•и©±дјљгЃ«е‡єеё­гЃ—гЃи¬›жј”г57е€е®й‚ёгЂ‚в–Ѕ16ж™10е€е°ѕеґЋгЃзґЌеЁж–°ж—§йІиЎ›зњЃжѓ…е±жњ¬йѓЁй•·г‚‰г30е€е…¬зљѕЎж ји©•дѕЎж¤њиЁЋе§”е“Ўдјљг®еў—з”°еЇ›д№џеє§й•·гЃ‹г‚‰дё­й–“ж•ґзђЏ—гЃ‘еЏ–г‚Љг39е€гѓ‚ёг‚їгѓ«и‡Ёж™‚иЎЊж”їиЄїжџ»дјљг‚в–Ѕ17ж™28е€е®‰е®љзљ„гЃЄзљЅЌз¶™ж‰їз­–г‚’и­°и«–гЃ™г‚‹жњ‰и­и…дјљи­°гЂ57е€е ±йЃ“еђ„з¤ѕгЃ®г‚¤гѓіг‚їгѓ“гѓҐгѓјгЂ‚в–Ѕ18ж™10е€жќ±дє¬гѓ»е№іжІіз”єгЃ®гѓ›гѓ†гѓ«гЂЊгѓ«гѓќгјгѓ«йє№з”єгЂЌг‚е®ґдјљеґгЂЊгѓ­г‚¤гѓ¤гѓ«г‚ЇгѓЄг‚№г‚їгѓ«гЂЌгЃ§ж”їжІ»и§ЈиЄ¬иЂ…г®зЇеЋџж–‡д№џж°Џг®ж‡‡и¦ЄдјљгЃ«е‡єеё­гЃ—гЃгЃ‚гЃЃ•гЃ¤гЂ27е€е®й‚ёгЂ42е€ењџе±‹е“Ѓе­ђиЎ™ўи­°е“ЎгЂ‚в–Ѕ19ж™19е€ж»ќеґЋе®ж€їе‰Їй•·е®иЈњгЃж»ќжІўе†…й–Јжѓ…е±е®гЃе®®е·ќей–ЈиЎ›жџжѓ…е±г‚»гѓіг‚їгѓјж‰й•·гЂ33е€е†…й–Јжѓ…е±е®г‚в–Ѕ20ж™49е€е…¬й‚ёгЂ‚В
12/23/2021,202112,2021,12,23,202112,2021-12,2021-Dec,Fumio_Kishida,No,No,No,No,YES!,No,12жњ23ж—Ґ,в–Ѕ7ж™40е€е…¬й‚ёз™єгЂ47е€жќ±дє¬гѓ»е†…е№ёз”єгЃ®еёќе›Ѕгѓ›гѓ†гѓ«гЂ‚е®ґдјљеґгЂЊеЇЊеЈ«гЃ®й–“гЌгЃ§ж—Ґжњ¬зµЊжё€з”з©¶г‚»гѓіг‚їгѓјгЃЄгЃ©дё»е‚¬гЃ®и¬›жј”дјљгЃ«е‡єеё­гЃ—гЃгЃ‚гЃЃ•гЃ¤гЂ‚в–Ѕ8ж™22е€е®й‚ёгЂ45е€и—¤дє•е®ж€їе‰Їй•·е®иЈњгЃиї«дє•ж–°ећ‹г‚ігѓ­гѓЉг‚¦г‚¤гѓ«г‚№ж„џжџ“з—‡еЇѕз­–жЋЁйЂІе®¤й•·гЂЃе‰Ќз”°з·Џе‹™зњЃи‡ЄжІ»иІЎж”їе±й•·гЂ54е€дёЉе·ќе№№дє‹й•·д»Јзђ‚в–Ѕ9ж™21е€е…љг®е®®жІўеЌљиЎЊе›ЅйІйѓЁдјљй•·гЂЃе°Џй‡жеЇєдє”е…ёе®‰е…ЁдїќйљњиЄїжџ»дјљй•·г‚‰г43е€еЊ—жµ·йЃ“г®иќ¦еђЌе¤§д№џй‡§и·Їеё‚й•·гЂЃзџіећЈй›…ж•Џж №е®¤её‚й•·гЃ‹г‚‰еЌі¶жµ·жєќењ°йњ®жґҐжіўйІзЃЅеЇѕз­–гЃ«й–ўгЃ™г‚‹и¦Ѓжњ›ж›ёеЏ—г_еЏ–г‚ЉгЂ‚й€ґжњЁиІґе­ђиЎ™ўи­°е“ЎеђЊеё­гЂ‚в–Ѕ10ж™1е€и‡Ёж™‚й–Ји­°гЂ21е€е…љжњ¬йѓЁгЂ‚йє»з”џе‰Їз·ЏиЈЃгЃиЊ‚жњЁе№№дє‹й•·гЂ‚в–Ѕ11ж™22е€е®й‚ёгЂ30е€ж”їеєњг»дёЋе…љж”їз­–ж‡•и«јљг53е€жќ±дє¬гѓ»ж°ёз”°з”єгЃ®е…Ёе›Ѕз”єжќ‘дјљй¤ЁиҐїй¤ЁгЂ‚еІёз”°жґѕгЃ®дјљеђ€гЃ«е‡єеё­гЃ—гЃгЃ‚гЃЃ•гЃ¤гЂ‚в–Ѕ12ж™32е€жќ±дє¬гѓ»е¤§ж‰‹з”єгЃ®зµЊе›ЈйЂЈдјљй¤ЁгЂ‚зµЊе›ЈйЂЈеЇ©и­°е“ЎдјљгЃ«е‡єеё­гЃ—гЃгЃ‚гЃЃ•гЃ¤гЂ‚в–Ѕ13ж™12е€е®й‚ёгЂ46е€зЋ‰еІЎдє‹±зџіе·ќзњЊијЄеі¶её‚и­°г‚‰г‚иҐїз”°ж­дєЊиЎ™ўи­°е“ЎеђЊеё­гЂ57е€йІзЃЅжЋЁйЂІе›Ѕж°‘дјљи­°гЂ‚в–Ѕ14ж™50е€жќ±дє¬гѓ»й«ијЄгЃ®д»™жґћд»®еѕЎж‰гЂ‚дёЉзљ‡гЃ•гЃѕиЄ•з”џж—ҐзҐќиігЃ«е‡єеё­гЂ‚в–Ѕ15ж™11е€жќ±дє¬гѓ»й«ијЄгЃ®г‚°гѓ©гѓігѓ‰ггѓЄгѓіг‚№гѓ›гѓ†гѓ«й«ијЄгЂ‚е®ґдјљеґгЂЊггѓЄгѓіг‚№гѓ«гѓјгѓгЂЌгЃ§е†…е¤–жѓ…е‹ўиЄїжџ»дјље…Ёе›Ѕж‡‡и«јљгЃ«е‡єеё­гЃ—гЃи¬›жј”г‚в–Ѕ16ж™51е€иЎ™ўз¬¬1и­°е“Ўдјљй¤ЁгЂ52е€е®‰еЌж™‹дё‰е…ѓй¦–з›ёгЂ‚в–Ѕ17ж™21е€е®й‚ёгЂ22е€е ±йЃ“еђ„з¤ѕгЃ®г‚¤гѓіг‚їгѓ“гѓҐгѓјгЂ45е€зµЊжё€иІЎж”їи«®е•Џдјљи­°гЂ‚в–Ѕ18ж™30е€з§‹и‘‰е›Ѕе®¶е®‰е…Ёдїќйљње±й•·гЂЃеІЎй‡Ће¤–е‹™зњЃз·Џеђ€е¤–дє¤ж”їз­–е±й•·гЂІиЎ›зњЃгЃ®еў—з”°йІиЎ›ж”їз­–е±й•·гЂЃе±±еґЋзµ±еђ€е№•ей•·гЂ53е€е…¬й‚ёгЂ‚в–Ѕ19ж™5е€жќ±дє¬гѓ»зґе°ѕдє•з”єгЃ®гѓ›гѓ†гѓ«гЂЊг‚¶гѓ»гѓ—гѓЄгѓіг‚№г‚®гѓЈгѓ©гѓЄгѓјжќ±дє¬зґе°ѕдє•з”єгЂЌг‚гѓ¬г‚№гѓ€гѓ©гѓігЂЊпј·јЎјіјЁјЇј«јµгЂи’је¤©гЂјіјЇјµјґјҐј®гЂЌгЃ§жќѕй‡ЋгЃжњЁеЋџгЃзЈЇеґЋгЃж—з”џж­Је‰Їе®ж€їй•·е®гЃЁдјљйЈџг‚в–Ѕ21ж™29е€е…¬й‚ёгЂ‚В
12/24/2021,202112,2021,12,24,202112,2021-12,2021-Dec,Fumio_Kishida,No,No,No,No,YES!,No,12жњ24ж—Ґ,в–Ѕ7ж™58е€е…¬й‚ёгЃ‹г‚‰е®й‚ёгЂ‚в–Ѕ8ж™4е€ж»ќжІўе†…й–Јжѓ…е±е®г26е€еЏ¤е·ќжі•з›ёгЂЃжћ—е¤–з›ёгЂЃеѕЊи—¤еЋљеЉґз›ёгЂЃЯе­ђиѕІз›ёгЂЃе±±еЏЈз’°еў›ёгЂЃеІёйІиЎ›з›ёгЂЃз‰§еі¶гѓ‚ёг‚їгѓ«з›ёгЂЃиҐїйЉеѕ©и€€з›ёгЂ‡жз”°е°‘е­ђеЊ–з›ёгЂЃе±±йљ›зµЊиІЎз›ёгЂЃе°Џжћ—зµЊжё€е®‰дїќз›ёгЂЃее†…гѓЇг‚ЇгѓЃгѓіз›ёгЂ47е€г‚ёгѓЈгѓ‘гѓіјіј¤ј§Ѕ“г‚ўгѓЇгѓјгѓ‰иЎЁеЅ°ејЏг‚в–Ѕ9ж™‚гжЊЃз¶љеЏЇиѓЅгЃЄй–‹з™єз›®жЁ™пј€пјіј¤ј§Ѕ“пј‰жЋЁйЂІжњ¬йѓЁгЂ17е€жµ·дёЉдїќе®‰дЅ“е€¶еј·еЊ–гЃ«й–ўгЃ™г‚‹й–ўдї‚й–Јеѓљдјљи­°гЂ41е€гѓ‚ёг‚їгѓ«з¤ѕдјљжЋЁйЂІдјљи­°гЂ‚в–Ѕ10ж™1е€й–Ји­°гЂ23е€дє¤йЂље®‰е…ЁеЇѕз­–гЃ«й–ўгЃ™г‚‹й–ўдї‚й–Јеѓљдјљи­°гЂ46е€иѕІжћ—ж°ґз”ЈжҐ­гѓ»ењ°еџџг®жґ»еЉ›е‰µйЂжњ¬йѓЁгЂ‚в–Ѕ11ж™3е€й‡‘е­ђз·Џе‹™з›ёгЂ€ґжњЁиІЎе‹™з›ёгЂЃжњ«жќѕж–‡з§‘з›ёгЂЃиђ©з”џз”°зµЊз”Јз›ёгЂЃдєЊд№‹ж№ЇйІзЃЅз›ёгЂЃи‹Ґе®®дё‡еЌљз›ёгЂ24е€ж–‰и—¤е›Ѕдє¤з›ёгЂ28е€йЃи—¤йЃёеЇѕе§”е“Ўй•·гЂ57е€жќ±дє¬гѓ»ж°ёз”°з”єгЃ®г‚¶гѓ»г‚­гѓЈгѓ”гѓ€гѓ«гѓ›гѓ†гѓ«жќ±жЂҐгЂ‚ж—Ґжњ¬ж–™зђ†еє—гЊж°ґз°ѕгЂЌгЃ§йє»з”џе‰Їз·ЏиЈЃгЃиЊ‚жњЁе№№дє‹й•·гЂЃжќѕй‡Ће®ж€їй•·е®гЃЁдјљйЈџг‚в–Ѕ13ж™9е€е®й‚ёгЂ30е€ж—Ґжњ¬еЊ»з™‚з”з©¶й–‹з™єе¤§иіћиЎЁеЅ°ејЏг‚иЁеїµж’®еЅ±гЂ‚в–Ѕ14ж™35е€е…¬й‚ёгЂ36е€гѓѓ¬гѓ“ж–°еєі¶гЃ®г‚¤гѓіг‚їгѓ“гѓҐгѓјгЂ55е€еєі¶гѓѓ¬гѓ“г®г‚¤гѓіг‚їгѓ“гѓҐгѓјгЂ‚в–Ѕ15ж™15е€дё­е›Ѕж”ѕйЂЃг®г‚¤гѓіг‚їгѓ“гѓҐгѓјгЂ35е€еєі¶гѓ›гјгѓгѓѓ¬гѓ“г®г‚¤гѓіг‚їгѓ“гѓҐгѓјгЂ55е€дё­е›Ѕж–°иЃћг®г‚¤гѓіг‚їгѓ“гѓҐгѓјгЂ‚в–Ѕ16ж™29е€е®й‚ёгЂ‚в–Ѕ17ж™10е€е ±йЃ“еђ„з¤ѕгЃ®г‚¤гѓіг‚їгѓ“гѓҐгѓјгЂ26е€жќ±дє¬гѓ»е…µ¤еќ‚г®е…µ¤еќ‚иѓѓи…ёз§‘г‚ЇгѓЄгѓ‹гѓѓг‚ЇгЂ‚е®љжњџеЃҐеє·иЁєж–­гЂ‚в–Ѕ19ж™46е€е…¬й‚ёгЂ‚В
12/25/2021,202112,2021,12,25,202112,2021-12,2021-Dec,Fumio_Kishida,No,No,No,No,No,No,12жњ25ж—Ґ,гЂеЌ€е‰Ќдё­гЃЇжќҐе®ўгЃЄгЃЏгЃе¬й‚ёгЃ§йЃЋгЃ”гЃ™г‚в–Ѕ13ж™4е€з§‹и‘‰е›Ѕе®¶е®‰е…Ёдїќйљње±й•·гЂЃе¤–е‹™зњЃг®жЈ®ж¬Ўе®гЃеё‚е·ќеЊ—з±іе±й•·гЂЃжµ·йѓЁи»Ќзё®дёЌж‹Ўж•Јгѓ»з§‘е­¦йѓЁй•·гЂ‚в–Ѕ14ж™5е€е±±йљ›зµЊиІЎз›ёгЂЃж–°еЋџж–°гЃ—гЃ„иі‡жњ¬дё»зѕ©е®џзЏѕжњ¬йѓЁдє‹е‹™е±й•·д»Јзђ‚в–Ѕ17ж™3е€й€ґжњЁиІЎе‹™з›ёгЂЃиІЎе‹™зњЃгЃ®зџўй‡Ћж¬Ўе®гЃиЊ¶и°·дё»иЁ€е±й•·гЂ54е€жќ±дє¬гѓ»й«ијЄгЃ®г‚°гѓ©гѓігѓ‰ггѓЄгѓіг‚№гѓ›гѓ†гѓ«й«ијЄгЂ‚гЊй‰„жќїз„јгЂгЃ—г‚ѓгЃ¶гЃ—г‚ѓгЃ¶гЂг‚№гѓјг‚­гѓЏг‚¦г‚№гЂжЎ‚гЌгЃ§иІЎе‹™з›ёгЃЁдјљйЈџг‚в–Ѕ20ж™21е€е…¬й‚ёгЂ‚В
12/26/2021,202112,2021,12,26,202112,2021-12,2021-Dec,Fumio_Kishida,No,No,No,No,No,No,12жњ26ж—Ґ,гЂеЌ€е‰Ќдё­гЃЇжќҐе®ўгЃЄгЃЏгЃе¬й‚ёгЃ§йЃЋгЃ”гЃ™г‚в–Ѕ17ж™27е€жќ±дє¬гѓ»и™ЋгѓЋй–гЃ®гѓ›гѓ†гѓ«гЂЊпјґЅ€пЅ…гјЇЅ‹пЅ•пЅ’пЅЃгјґЅЏпЅ‹пЅ™пЅЏгЌг‚гѓ•гѓ©гѓіг‚№ж–™зђ†еє—гЊгѓЊгѓјгѓґг‚§гѓ«гѓ»г‚Ёгѓќгѓѓг‚ЇгЂЌгЃ§е±±йљ›зµЊиІЎз›ёгЂЃе°Џжћ—зµЊжё€е®‰дїќз›ёгЂЃжњЁеЋџе®ж€їе‰Їй•·е®гЃз”е€©жЋе‰Ќе№№дє‹й•·гЃЁдјљйЈџг‚в–Ѕ20ж™30е€е…¬й‚ёгЂ‚В
12/27/2021,202112,2021,12,27,202112,2021-12,2021-Dec,Fumio_Kishida,No,No,No,No,YES!,No,12жњ27ж—Ґ,в–Ѕ9ж™1е€е…¬й‚ёз™єгЂ15е€жќ±дє¬гѓ»е±±еђ№з”єгЃ®ј®ј°јЇжі•дєєгЂЊи‡Єз«‹з”џжґ»г‚µгѓќгјгѓ€г‚»гѓіг‚їгѓјгѓ»г‚‚г‚„гЃЌг‚з”џжґ»е›°зЄ®иЂ…г®ж”ЇжЏґиЂ…гЃЁи»Љеє§гЃ§ж„Џи¦‹дє¤жЏ›г‚й‡жз”°е°‘е­ђеЊ–з›ёеђЊеё­гЂ‚в–Ѕ10ж™4е€е ±йЃ“еђ„з¤ѕгЃ®г‚¤гѓіг‚їгѓ“гѓҐгѓјгЂ37е€е®й‚ёгЂ39е€з§‹и‘‰е›Ѕе®¶е®‰е…Ёдїќйљње±й•·гЂЃеІЎй‡Ће¤–е‹™зњЃз·Џеђ€е¤–дє¤ж”їз­–е±й•·гЂЃеў—з”°йІиЎ›зњЃйІиЎ›ж”їз­–е±й•·гЂ‚в–Ѕ11ж™7е€е…Ёе›Ѕи­¦е‚™жҐ­йЂЈз›џг®йќ’е±±е№ёжЃ­зђє‹й•·гЂЃж©‹жњ¬жєе‰Їзђє‹й•·гЂ23е€з”°дё­й›єЊйѓЋжќ±дє¬еЊ»з§‘ж­Їз§‘е¤§е­¦й•·гЂ‚е›Ѕе…‰ж–‡д№Ў™ўи­°е“ЎеђЊеё­гЂ40е€е±±жњ¬дїЎе¤«ж—Ґжњ¬и–¬е‰¤её«дјљдјљй•·гЂ57е€е·ќжњ¬еј·ж—Ґжњ¬е­¦ж Ўж­Їз§‘еЊ»дјљдјљй•·гЂ‚в–Ѕ12ж™9е€ж№ЇеґЋи‹±еЅ¦еєі¶зњЊзџҐдє‹гЃи—¤еЋџеё°дёжќ±е¤§ж•™жЋ€гЂ‚еЇєз”°иЈњдЅђе®еђЊеё­гЂ‚в–Ѕ13ж™22е€дё­жќ‘зґе­ђггѓ”гѓіг‚єгѓ›гјгѓ«гѓ‚Јгѓіг‚°г‚№дјљй•·г‚‰гЃ‹г‚‰дїќи‚ІгЃ«й–ўгЃ™г‚‹жЏђиЁж›ёеЏ—г_еЏ–г‚ЉгЂ‚жЈ®иЈњдЅђе®еђЊеё­гЂ45е€з¦Џдє•гѓ€г‚·е­ђж—Ґжњ¬зњ‹и­·еЌ”дјљдјљй•·гЂ‚в–Ѕ14ж™1е€гѓ‘гјгѓ€гѓЉгѓјг‚·гѓгЃ«г‚€г‚‹дѕЎеЂ¤е‰µйЂгЃ®гЃџг‚ЃгЃ®и»ўе«Ѓеж»‘еЊ–дјљи­°гЂ‚в–Ѕ15ж™21е€е±±еЏЈжі°жЋе‰ЌйЃёеЇѕе§”е“Ўй•·гЂ‚жќ‘дє•иЈњдЅђе®еђЊеё­гЂ34е€з”ЈзµЊж–°иЃћгЃЁгѓ‹гѓѓгѓќгѓіж”ѕйЂЃг®дјЃз”»з”ЁгЃ«дїіе„ЄгЃ®и°·еЋџз«д»‹ж°ЏгЃЁеЇѕи«‚в–Ѕ16ж™13е€з«№еў—иІћдїЎгѓ­гѓјг‚Ѕгѓіз¤ѕй•·гЂ52е€ж•™и‚ІжњЄжќҐе‰µйЂдјљи­°гЂ‚в–Ѕ17ж™25е€жњ«жќѕж–‡з§‘з›ёгЂ39е€е›Ѕе ґе№ёд№‹еЉ©иЎ™ўи­°е“ЎгЂ50е€е°Џжћ—зµЊжё€е®‰дїќз›ёгЂЃз”џе·ќж–‡з§‘зњЃз ”з©¶й–‹з™єе±й•·гЂ‚в–Ѕ18ж™2е€е®й‚ёиЃ·е“ЎгЃ«иЁ“з¤єгЂ14е€е…¬й‚ёгЂ‚е›Ѕж°‘еђ‘гЃ‘г®гѓ“гѓ‡г‚ЄгѓЎгѓ‚»гѓјг‚ёеЏЋйЊІгЂ50е€ж №жњ¬еЊиЎ™ўдє€з®—е§”е“Ўй•·гЂ‚в–Ѕ19ж™21е€жќ±дє¬гѓ»зҐћз”°йЊ¦з”єгЃ®з«№ж©‹е®‰з”°гѓ“гѓ«гЂ‚гѓ¬г‚№гѓ€гѓ©гѓігЂЊе››е­Јдє¤жҐЅгЂз„¶гЂЌгЃ§е±±з”°е­ќз”·жЇЋж—Ґж–°иЃћз‰№е€Ґз·Ёй›§”е“ЎгЂЃе°Џз”°е°љиЄ­еЈІж–°иЃћжќ±дє¬жњ¬з¤ѕиЄїжџ»з ”з©¶жњ¬йѓЁе®ўе“Ўз ”з©¶е“ЎгЂЃиЉ№е·ќжґ‹дёж—Ґжњ¬зµЊжё€ж–°иЃћз¤ѕи«–иЄ¬гѓ•г‚§гѓ­гѓјгЂЃж”їжІ»г‚ёгѓЈгѓјгѓЉгѓЄг‚№гѓ€г®з”°еґЋеЏІйѓЋж°ЏгЃЁдјљйЈџг‚в–Ѕ21ж™38е€е…¬й‚ёгЂ‚В
12/28/2021,202112,2021,12,28,202112,2021-12,2021-Dec,Fumio_Kishida,No,No,YES!,No,YES!,No,12жњ28ж—Ґ,в–Ѕ9ж™4е€е…¬й‚ёгЃ‹г‚‰е®й‚ёгЂ5е€й€ґжњЁе®—з”·ж—Ґжњ¬з¶­ж–°гЃ®дјљеЏ‚й™ўи­°е“ЎгЂ18е€е­¤з‹¬гѓ»е­¤з«‹еЇѕз­–жЋЁйЂІдјљи­°гЂ36е€гѓ‚ёг‚їгѓ«з”°ењ’йЅеё‚е›Ѕе®¶ж§‹жѓіе®џзЏѕдјљи­°гЂ‚в–Ѕ10ж™3е€й–Ји­°гЂ19е€еІёйІиЎ›з›ёгЂ24е€е®‡е®™й–‹з™єж€¦з•Ґжњ¬йѓЁгЂ42е€е›Ѕе®¶е®‰е…Ёдїќйљњдјљи­°гЂ‚в–Ѕ11ж™15е€ж–Ћи—¤еЃҐе…ѕІз›ёгЂЃг‚ёгѓЈгѓјгѓЉгѓЄг‚№гѓ€г®з”°еЋџз·Џдёжњ—ж°Џг‚жќ‘дє•иЈњдЅђе®еђЊеё­гЂ44е€ј®јґјґгЃ®е°ѕдёЉиЄи”µјЈјіјіјЇгЂ‚йЃЯе­ђз·Џе‹™з›ёеђЊеё­гЂ‚в–Ѕ12ж™3е€дё­и°·гЂЃжќ‘дє•гЃеЇєз”°гЂЃжЈ®еђЈњдЅђе®гЃЁдјљйЈџг‚в–Ѕ13ж™34е€й–‹же­¦ењ’г®е°ЏзњЊж–№жЁ№е­¦ењ’й•·гЂ‡жж°ґе‹‰жЎй•·гЂ‚в–Ѕ14ж™20е€е…±еђЊйљдїЎгЃ®г‚¤гѓіг‚їгѓ“гѓҐгѓјгЂ‚в–Ѕ15ж™2е€з§‹и‘‰е›Ѕе®¶е®‰е…Ёдїќйљње±й•·гЂЃжЈ®е¤–е‹™ж¬Ўе®г‚в–Ѕ16ж™1е€ж–‡еЊ–ж”ѕйЂЃг®дјЃз”»з”ЁгЃ«г‚ёгѓЈгѓјгѓЉгѓЄг‚№гѓ€г®еѕЊи—¤и¬™ж¬Ўж°ЏгЃЁеЇѕи«43е€и„‡з”°йљ­—е›Ѕз«‹ж„џжџ“з—‡з ”з©¶ж‰й•·гЂЃеІЎйѓЁдїЎеЅ¦е·ќеґЋеё‚еЃҐеє·е®‰е…Ёз ”з©¶ж‰й•·гЂ‚в–Ѕ17ж™21е€еѕЊи—¤еЋљеЉґз›ёгЂЃж–‰и—¤е›Ѕдє¤з›ёгЂЃжќѕй‡Ће®ж€їй•·е®гЃе±±йљ›зµЊиІЎз›ёгЂЃее†…гѓЇг‚ЇгѓЃгѓіз›ёгЂЃжњЁеЋџе®ж€їе‰Їй•·е®гЃи—¤дє•е®ж€їе‰Їй•·е®иЈњгЃиї«дє•ж–°ећ‹г‚ігѓ­гѓЉг‚¦г‚¤гѓ«г‚№з­‰ж„џжџ“з—‡еЇѕз­–жЋЁйЂІе®¤й•·гЂЃеђ‰з”°еЋљеЉґж¬Ўе®г52е€дё­жі‰жќѕеЏёе‰ЌеЏ‚й™ўи­°е“ЎгЂ‚в–Ѕ18ж™8е€иҐїз”°и‹±зЇ…љеєі¶зњЊгµг‚‹гЃ•гЃЁжЊЇи€€ж”ЇйѓЁй•·гЂ14е€г‚ґгѓ«гѓ•г‚ЎгѓјгЃ®з¬№з”џе„ЄиЉ±ж°Џг28е€жІій‡Ћеє±жњ¬йѓЁй•·гЂ43е€ж»ќжІўе†…й–Јжѓ…е±е®г‚в–Ѕ19ж™‚ге›Ѕйљ›дјљи­°еђ‘г_гЃ®гѓ“гѓ‡г‚ЄгѓЎгѓ‚»гѓјг‚ёеЏЋйЊІгЂ43е€е ±йЃ“еђ„з¤ѕгЃ®г‚¤гѓіг‚їгѓ“гѓҐгѓјгЂ53е€е…¬й‚ёгЂ‚В
12/29/2021,202112,2021,12,29,202112,2021-12,2021-Dec,Fumio_Kishida,YES!,No,No,No,No,No,12жњ29ж—Ґ,гЂеЌ€е‰Ќдё­гЃЇжќҐе®ўгЃЄгЃЏгЃе¬й‚ёгЃ§йЃЋгЃ”гЃ™г‚в–Ѕ13ж™‚гжќ±дє¬гѓ»зґе°ѕдє•з”єгЃ®гѓ›гѓ†гѓ«гѓ‹гѓҐгѓјг‚Єгѓјг‚їгѓ‹г‚гЊгг‚ўг‚µгѓ­гѓіе¤§й‡ЋгЌгЃ§ж•Јй«ЄгЂ‚в–Ѕ14ж™59е€е…¬й‚ёгЂ‚в–Ѕ15ж™7е€еЏ¤иізЇ¤иЎ™ўи­°е“ЎгЂ‚в–Ѕ16ж™2е€еЏ¤иіж°Џеєг‚‹г‚В
12/30/2021,202112,2021,12,30,202112,2021-12,2021-Dec,Fumio_Kishida,No,No,No,No,No,No,12жњ30ж—Ґ,гЂзµ‚ж—ҐгЂЃе¬й‚ёгЃ§йЃЋгЃ”гЃ™г‚В
12/31/2021,202112,2021,12,31,202112,2021-12,2021-Dec,Fumio_Kishida,No,No,No,No,No,No,12жњ31ж—Ґ,в–Ѕ10ж™58е€е…¬й‚ёгЃ§жќѕй‡ЋгЃжњЁеЋџж­Је‰Їе®ж€їй•·е®гЃи—¤дє•е®ж€їе‰Їй•·е®иЈњгЃиї«дє•ж–°ећ‹г‚ігѓ­гѓЉг‚¦г‚¤гѓ«г‚№з­‰ж„џжџ“з—‡еЇѕз­–жЋЁйЂІе®¤й•·гЂЃеђ‰з”°еЋљеЉґж¬Ўе®г‚в–Ѕ11ж™52е€жќѕй‡ЋгЃжњЁеЋџж­Је‰Їе®ж€їй•·е®г‚в–Ѕ12ж™21е€жњЁеЋџе‰Їй•·е®г‚в–Ѕ15ж™10е€жќ±дє¬гѓ»ж—Ґжњ¬ж©‹е®¤з”єгЃ®гѓ›гѓ†гѓ«гЂЊггѓігѓгѓЄгѓіг‚ЄгѓЄг‚Ёгѓіг‚їгѓ«жќ±дє¬гЂЌг‚в–Ѕ17ж™5е€жќ±дє¬гѓ»иҐїжµ…иЌ‰гЃ®гЃ™гЃЌз„јгЃЌеє—гЊжµ…иЌ‰д»ЉеЌЉе›Ѕйљ›йљг‚Љжњ¬еє—гЌг‚иЈ•е­ђе¤«дєєг‚‰е®¶ж—ЏгЃЁйЈџдє‹г‚в–Ѕ19ж™16е€гѓћгѓігѓгѓЄгѓіг‚ЄгѓЄг‚Ёгѓіг‚їгѓ«жќ±дє¬гЂ‚е®їжіЉг‚В
1/1/2022,20221,2022,1,1,20221,2022-01,2022-Jan,Fumio_Kishida,No,No,No,No,No,No,,
1/2/2022,20221,2022,1,2,20221,2022-01,2022-Jan,Fumio_Kishida,No,No,No,No,No,No,1жњ1ж—Ґгѓ»2ж—Ґ,гЂ1ж—ҐгЂ‰в–Ѕ10ж™14е€йќ™й¤ЉегЃ®жќ±дє¬гѓ»ж—Ґжњ¬ж©‹е®¤з”єгЃ®гѓ›гѓ†гѓ«гЂЊггѓігѓгѓЄгѓіг‚ЄгѓЄг‚Ёгѓіг‚їгѓ«жќ±дє¬гЂЌз™єгЂ25е€зљ‡е±…г‚иЈ•е­ђе¤«дєєгЃЁе…±гЃ«ж–°е№ґзҐќиігЃ®е„гЃ«е‡єеё­гЂ‚в–Ѕ11ж™19е€е…¬й‚ёгЂ‚иЈ•е­ђе¤«дєєгЃЁиЁеїµж’®еЅ±гЂ‚в–Ѕ12ж™9е€гѓћгѓігѓгѓЄгѓіг‚ЄгѓЄг‚Ёгѓіг‚їгѓ«жќ±дє¬гЂ‚е®їжіЉг‚г2ж—ҐгЂ‰гзµ‚ж—ҐгЂЃггѓігѓгѓЄгѓіг‚ЄгѓЄг‚Ёгѓіг‚їгѓ«жќ±дє¬гЃ§йЃЋгЃ”гЃ™г‚В
1/3/2022,20221,2022,1,3,20221,2022-01,2022-Jan,Fumio_Kishida,No,No,No,No,No,No,1жњ3ж—Ґ,в–Ѕ11ж™7е€йќ™й¤ЉегЃ®жќ±дє¬гѓ»ж—Ґжњ¬ж©‹е®¤з”єгЃ®гѓ›гѓ†гѓ«гЂЊггѓігѓгѓЄгѓіг‚ЄгѓЄг‚Ёгѓіг‚їгѓ«жќ±дє¬гЂЌз™єгЂ21е€е…¬й‚ёгЂ‚в–Ѕ16ж™59е€еѕЊи—¤еЋљеЉґз›ёгЂЃжќѕй‡ЋгЃжњЁеЋџгЃзЈЇеґЋгЃж—з”џж­Је‰Їе®ж€їй•·е®гЃе±±йљ›зµЊиІЎз›ёгЂЃее†…гѓЇг‚ЇгѓЃгѓіз›ёгЂЃеђ‰з”°еЋљеЉґж¬Ўе®г‚в–Ѕ17ж™3е€и—¤дє•е®ж€їе‰Їй•·е®иЈњгЃиї«дє•ж–°ећ‹г‚ігѓ­гѓЉг‚¦г‚¤гѓ«г‚№з­‰ж„џжџ“з—‡еЇѕз­–жЋЁйЂІе®¤й•·еЉг‚Џг‚‹гЂ‚в–Ѕ18ж™10е€еЋљеЉґз›ёгЂЃжќѕй‡ЋгЃжњЁеЋџгЃзЈЇеґЋгЃж—з”џж­Је‰Їе®ж€їй•·е®гЃзµЊиІЎз›ёгЂЃгѓЇг‚ЇгѓЃгѓіз›ёгЂ20е€жќѕй‡ЋгЃжњЁеЋџгЃзЈЇеґЋгЃж—з”џж­Је‰Їе®ж€їй•·е®г‚в–Ѕ19ж™10е€е…Ёе“Ўе‡єг‚‹г‚В
1/4/2022,20221,2022,1,4,20221,2022-01,2022-Jan,Fumio_Kishida,No,No,No,No,No,No,1жњ4ж—Ґ,в–Ѕ8ж™32е€е…¬й‚ёз™єгЂ44е€јЄјІжќ±дє¬й§…г‚в–Ѕ10ж™39е€гЃ®гЃћгЃї213еЏ·гЃ§јЄјІеђЌеЏ¤е±‹й§…г44е€иї‘й‰„еђЌеЏ¤е±‹й§…г‚и—¤е·ќж”їдєєеЏ‚й™ўи­°е“Ўг‚‰г‚в–Ѕ12ж™13е€иї‘й‰„з‰№жЂҐгЃ§иї‘й‰„е®‡жІ»е±±з”°й§…г‚з”°жќ‘жІд№…е‰ЌеЋљеЉґз›ёгЂ€ґжњЁи‹±ж•¬иЎ™ўи­°е“ЎгЂЃдёи¦‹е‹ќд№‹дё‰й‡езњЊзџҐдє‹г‚‰е‡єиїЋгЃ€гЂ20е€дё‰й‡езњЊдјЉе‹ўеё‚г®дјЉе‹ўзҐће®®е¤–е®®гЂ‚еЏ‚ж‹ќг51е€дјЉе‹ўзҐће®®е†…е®®гЂ‚еЏ‚ж‹ќе®ўг‚‰гЃЁдє¤жµЃг‚еЏ‚ж‹ќг‚в–Ѕ13ж™20е€зҐћжҐЅж®їгЃ§зҐћжҐЅеҐ‰зґЌг49е€зҐће®®еЏёеєЃе‰ЌгЃ§гѓњгјг‚¤г‚№г‚«г‚¦гѓ€ж—Ґжњ¬йЂЈз›џдјЉе‹ўз¬¬7е›ЈгЂЃг‚¬гѓјгѓ«г‚№г‚«г‚¦гѓ€ж—Ґжњ¬йЂЈз›џдё‰й‡езњЊз¬¬1е›ЈгЃ‹г‚‰иЉ±жќџиґ€е‘€гЂ‚иЁеїµж’®еЅ±гЂ‚в–Ѕ14ж™10е€зҐће®®еЏёеєЃгЃ§е№ґй ­иЁи…дјљи¦‹г57е€иї‘й‰„е®‡жІ»е±±з”°й§…г‚ж”ЇжЏґиЂ…г‚‰гЃЁдє¤жµЃг‚з”°жќ‘е‰ЌеЋљеЉґз›ёгЂ€ґжњЁиЎ™ўи­°е“ЎгЂЃдёи¦‹зџҐдє‹г‚‰и¦‹йЃг‚ЉгЂ‚в–Ѕ16ж™36е€иї‘й‰„з‰№жЂҐгЃ§иї‘й‰„еђЌеЏ¤е±‹й§…г38е€јЄјІеђЌеЏ¤е±‹й§…г40е€е¤§жќ‘з§з«ж„›зџҐзњЊзџҐдє‹гЃи—¤е·ќеЏ‚й™ўи­°е“Ўг‚‰г‚в–Ѕ18ж™36е€гЃ®гЃћгЃї34еЏ·гЃ§јЄјІжќ±дє¬й§…г55е€жќ±дє¬гѓ»ж°ёз”°з”єгЃ®г‚¶гѓ»г‚­гѓЈгѓ”гѓ€гѓ«гѓ›гѓ†гѓ«жќ±жЂҐгЂ‚дё­е›Ѕж–™зђ†еє—гЊжџг‚±еІЎгЂЌгЃ§ећ‚з§е¤«й§ђдё­е›Ѕе¤§дЅїгЃЁдјљйЈџг‚в–Ѕ19ж™40е€жќ±дє¬гѓ»еЏ°е ґгЃ®гѓ•г‚ёгѓѓ¬гѓ“г‚в–Ѕ20ж™2е€јўјігѓ•г‚ёгЃ®е ±йЃ“з•ЄзµЃ«е‡єжј”г‚в–Ѕ21ж™43е€е…¬й‚ёгЂ‚В
1/5/2022,20221,2022,1,5,20221,2022-01,2022-Jan,Fumio_Kishida,No,No,No,No,YES!,No,1жњ5ж—Ґ,в–Ѕ8ж™59е€е…¬й‚ёгЃ‹г‚‰е®й‚ёгЂ‚в–Ѕ9ж™‚ге ±йЃ“еђ„з¤ѕгЃ®г‚¤гѓіг‚їгѓ“гѓҐгѓјгЂ2е€жІ–з”°е†…й–ЈеЌ±ж©џз®Ўзђ›ЈгЂЃз§‹и‘‰е›Ѕе®¶е®‰е…Ёдїќйљње±й•·гЂЃж»ќжІўе†…й–Јжѓ…е±е®г45е€е›Ѕе®¶е®‰е…Ёдїќйљње±й•·гЂЃе¤–е‹™зњЃг®жЈ®ж¬Ўе®гЃеё‚е·ќеЊ—з±іе±й•·гЂЃеі¶з”°йІиЎ›ж¬Ўе®г‚в–Ѕ10ж™26е€е…љжњ¬йѓЁгЂ31е€йє»з”џе‰Їз·ЏиЈЃгЃиЊ‚жњЁе№№дє‹й•·гЂ36е€е…љеЅ№е“Ўдјљг‚в–Ѕ11ж™40е€е‰Їз·ЏиЈЃгЃе№№дє‹й•·гЂЃ и—¤йЃёеЇѕе§”е“Ўй•·гЂ‚в–Ѕ12ж™18е€е®й‚ёгЂ55е€е±±еґЋеЏІйѓЋеЏ‚дёЋг‚в–Ѕ13ж™59е€жќ±дє¬гѓ»е†…е№ёз”єгЃ®еёќе›Ѕгѓ›гѓ†гѓ«гЂ‚е®ґдјљеґгЂЊе­”й›ЂгЃ®й–“гЌгЃ§зµЊжё3е›ЈдЅ“е±е‚¬гЃ®ж–°е№ґзҐќиігѓ‘гјгѓ‚ЈгѓјгЃ«е‡єеё­гЃ—гЃгЃ‚гЃЃ•гЃ¤гЂ‚в–Ѕ14ж™31е€е®й‚ёгЂ‚в–Ѕ15ж™48е€жќ±дє¬гѓ»жќ±ж—Ґжљ®й‡Њг®г‚ўгѓјгѓ€ггѓѓ«ж—Ґжљ®й‡Њгѓ©гѓіг‚°г‚¦гѓѓ‰гЂ‚е®ґдјљеґгЂЊгѓ©гѓіг‚°г‚¦гѓѓ‰гѓ›гјгѓ«гЂЌгЃ§йЂЈеђ€г®ж–°е№ґдє¤ж­“дјљгЃ«е‡єеё­гЃ—гЃгЃ‚гЃЃ•гЃ¤гЂ‚в–Ѕ16ж™46е€еёќе›Ѕгѓ›гѓ†гѓ«гЂ‚е®ґдјљеґгЂЊеЇЊеЈ«гЃ®й–“гЌгЃ§е†…е¤–жѓ…е‹ўиЄїжџ»дјљгЃЄгЃ©дё»е‚¬гЃ®ж–°е№ґдє’з¤јдјљгЃ«е‡єеё­гЃ—гЃгЃ‚гЃЃ•гЃ¤гЂ‚в–Ѕ17ж™23е€е®й‚ёгЂ‚в–Ѕ18ж™26е€еёќе›Ѕгѓ›гѓ†гѓ«гЂ‚й‰„жќїз„јгЃЌеє—гЊей–гЂЌгЃ§е‰Їз·ЏиЈЃгЃёеЇѕе§”е“Ўй•·гЃЁдјљйЈџг‚в–Ѕ20ж™53е€е…¬й‚ёгЂ‚В
1/6/2022,20221,2022,1,6,20221,2022-01,2022-Jan,Fumio_Kishida,No,No,No,No,YES!,No,1жњ6ж—Ґ,в–Ѕ9ж™44е€е…¬й‚ёгЃ‹г‚‰е®й‚ёгЂ45е€з§‹и‘‰е›Ѕе®¶е®‰е…Ёдїќйљње±й•·гЂЃе¤–е‹™зњЃг®е±±з”°е¤–е‹™еЇ©и­°е®гЃи€№и¶Љг‚ўг‚ёг‚ўе¤§жґ‹е·ће±й•·гЂЃж§ЊйЃ“йІиЎ›еЇ©и­°е®г‚в–Ѕ11ж™3е€йЂ±е€Љггѓѓ«гѓ¬г‚№гѓ€гѓ©гѓіжЋІиј‰з”ЁгЃ«еІ©е±‹жЇ…е…љи¦іе…‰з”ЈжҐ­жЊЇи€€и­°е“ЎйЂЈз›џе№№дє‹й•·гЃЁеЇѕи«‚в–Ѕ13ж™1е€г‚Єгѓјг‚№гѓ€гѓ©гѓЄг‚ўгЃ®гѓўгѓЄг‚Ѕгѓій¦–з›ёгЃЁгѓѓ¬гѓ“дјљи­°еЅўејЏгЃ§е†»‘еЊ–еЌ”е®љг®зЅІеђЌејЏг24е€гѓўгѓЄг‚Ѕгѓій¦–з›ёгЃЁгѓѓ¬гѓ“дјљи­°гЂ‚в–Ѕ15ж™29е€јўјігѓѓ¬жќ±гЃ®е ±йЃ“з•Єзµ®еЏЋйЊІгЂ‚в–Ѕ16ж™17е€гѓђг‚¤г‚Єг‚¤гѓігѓг‚№гѓ€гѓЄгѓјеЌ”дјљгЃЄгЃ©дё»е‚¬гЃ®ж–°жҐг‚»гѓџгѓЉгѓјеђ‘г_гЃ®гѓ“гѓ‡г‚ЄгѓЎгѓ‚»гѓјг‚ёеЏЋйЊІгЂ38е€иї«дє•ж–°ећ‹г‚ігѓ­гѓЉг‚¦г‚¤гѓ«г‚№з­‰ж„џжџ“з—‡еЇѕз­–жЋЁйЂІе®¤й•·гЂЃеђ‰з”°еЋљеЉґж¬Ўе®г‚в–Ѕ17ж™2е€и—¤дє•е‹‡жІ»ж»‹иізњЊй•·жµњеё‚й•·гЂЃе¤§еЎљж•¬дёйѓЋй•·жµње•†е·Ґдјљи­°ж‰дјљй­г‚‰г20е€е°Џж±з™ѕеђ€е­ђжќ±дє¬йѓЅзџҐдє‹г52е€жћ—е¤–з›ёгЂЃеѕЊи—¤еЋљеЉґз›ёгЂЃж–‰и—¤е›Ѕдє¤з›ёгЂЃжќѕй‡Ће®ж€їй•·е®гЃе±±йљ›зµЊиІЎз›ёгЂЃее†…гѓЇг‚ЇгѓЃгѓіз›ёгЂЃжњЁеЋџе®ж€їе‰Їй•·е®гЃи—¤дє•е®ж€їе‰Їй•·е®иЈњгЃж–°ећ‹г‚ігѓ­гѓЉг‚¦г‚¤гѓ«г‚№з­‰ж„џжџ“з—‡еЇѕз­–жЋЁйЂІе®¤й•·гЂЃеЋљеЉґж¬Ўе®г‚в–Ѕ19ж™8е€е ±йЃ“еђ„з¤ѕгЃ®г‚¤гѓіг‚їгѓ“гѓҐгѓјгЂ32е€е…¬й‚ёгЂ33е€дё­и°·иЈњдЅђе®г47е€дё­и°·ж°Џеєг‚‹г‚В
1/7/2022,20221,2022,1,7,20221,2022-01,2022-Jan,Fumio_Kishida,No,No,No,No,No,No,1жњ7ж—Ґ,в–Ѕ9ж™39е€е…¬й‚ёгЃ‹г‚‰е®й‚ёгЂ41е€еЏ¤е·ќжі•з›ёгЂЃжќѕе°ѕй‡‘ићЌеєЃз·Џеђ€ж”їз­–е±й•·гЂЃи—¤еЋџж–‡з§‘зњЃз·Џеђ€ж•™и‚Іж”їз­–е±й•·гЂ‚в–Ѕ10ж™5е€й–Ји­°гЂ16е€еІёйІиЎ›з›ёгЂ19е€ж€ђе№ґе№ґйЅўеј•гЃЌдё‹г_гЃ«й–ўгЃ™г‚‹й–ўдї‚й–Јеѓљдјљеђ€гЂ30е€зџіе·ќж‹‰и‡ґе•ЏйЎЊеЇѕз­–жњ¬йѓЁдє‹е‹™е±й•·гЂ‚в–Ѕ14ж™35е€й€ґжњЁиІЎе‹™з›ёгЂЃЯићЌеєЃг®дё­еі¶й•·е®гЃеЏ¤жІўдјЃз”»её‚еґе±й•·гЂ‚в–Ѕ15ж™5е€иђ©з”џз”°зµЊз”Јз›ёгЂЃзµЊз”ЈзњЃг®е¤љз”°ж¬Ўе®гЃеҐ€й€й‡жз”ЈжҐ­жЉиЎ“з’°еў±й•·гЂЃдїќеќ‚иі‡жєђг‚ЁгѓЌгѓ«г‚®гѓјеє•·е®г‚в–Ѕ16ж™4е€ж–°ећ‹г‚ігѓ­гѓЉг‚¦г‚¤гѓ«г‚№ж„џжџ“з—®ж”їеєњеЇѕз­–жњ¬йѓЁгЂ‚в–Ѕ17ж™‚гж»ќжІўе†…й–Јжѓ…е±е®г16е€з§‹и‘‰е›Ѕе®¶е®‰е…Ёдїќйљње±й•·гЂЃей–Јжѓ…е±е®г31е€зµЊз”Јз›ёгЂЃз±із”°е»єдё‰е›Ѕйљ›зµЊжё€дє¤жµЃеЌ”дјљдјљй•·гЂЃжџй•·жё…йљ†и—¤з”°е­¦ењ’зђ†дє‹й•·гЂЃж№ЇжІўз”±зґе¤«и—¤з”°еЊ»з§‘е¤§е­¦й•·гЂЃз™ЅжњЁи‰ЇдёеђЊе¤§з—…й™ўй•·гЂ‚в–Ѕ18ж™13е€жќ±дє¬гѓ»е¤§ж‰‹з”єгЃ®иЄ­еЈІж–°иЃћжќ±дє¬жњ¬з¤ѕгЂ‚гѓ“гѓҐгѓјгѓ©г‚¦гѓіг‚ёгЃ§жёЎиѕєжЃ’й›„иЄ­еЈІж–°иЃћг‚°гѓ«гѓјгѓ—жњ¬з¤ѕд»ЈиЎЁеЏ–з·еЅ№дё»з­Ѓе°Џжћ—зµЊжё€е®‰дїќз›ёгЂЃеџЋе†…е®џиЎ™ўи­°е“ЎгЃЁдјљйЈџг‚в–Ѕ19ж™41е€е…¬й‚ёгЂ‚В
1/8/2022,20221,2022,1,8,20221,2022-01,2022-Jan,Fumio_Kishida,No,No,No,No,No,No,1жњ8ж—Ґ,гЂзµ‚ж—ҐгЂЃе¬й‚ёгЃ§йЃЋгЃ”гЃ™г‚В
1/9/2022,20221,2022,1,9,20221,2022-01,2022-Jan,Fumio_Kishida,No,No,No,No,No,No,1жњ9ж—Ґ,в–Ѕ6ж™59е€е…¬й‚ёз™єгЂ‚в–Ѕ7ж™14е€жќ±дє¬гѓ»еЏ°е ґгЃ®гѓ•г‚ёгѓѓ¬гѓ“г32е€е ±йЃ“з•ЄзµЃ«е‡єжј”г‚в–Ѕ8ж™46е€жќ±дє¬гѓ»зґе°ѕдє•з”єгЃ®ј®јЁј«еЌ»Јз”°ж”ѕйЂЃдјљй¤ЁгЂ‚в–Ѕ9ж™1е€е ±йЃ“з•ЄзµЃ«е‡єжј”г‚в–Ѕ10ж™‚ге…¬й‚ёгЂ‚В
1/10/2022,20221,2022,1,10,20221,2022-01,2022-Jan,Fumio_Kishida,No,No,No,No,No,No,1жњ10ж—Ґ,гЂеЌ€е‰Ќдё­гЃЇжќҐе®ўгЃЄгЃЏгЃе¬й‚ёгЃ§йЃЋгЃ”гЃ™г‚в–Ѕ13ж™‚гжќѕй‡ЋгЃжњЁеЋџгЃзЈЇеґЋгЃж—з”џж­Је‰Їе®ж€їй•·е®г‚в–Ѕ14ж™53е€еѕЊи—¤еЋљеЉґз›ёгЂЃе±±йљ›зµЊиІЎз›ёгЂЃи—¤дє•е®ж€їе‰Їй•·е®иЈњгЃиї«дє•ж–°ећ‹г‚ігѓ­гѓЉг‚¦г‚¤гѓ«г‚№з­‰ж„џжџ“з—‡еЇѕз­–жЋЁйЂІе®¤й•·гЂЃжЈ®е¤–е‹™зњдє‹е±й•·гЂЃеЋљеЉґзњЃг®еђ‰з”°ж¬Ўе®гЃз¦Џеі¶еЊ»е‹™жЉЂз›ЈеЉг‚Џг‚‹гЂ‚в–Ѕ15ж™27е€еЋљеЉґз›ёгЂЃжќѕй‡ЋгЃжњЁеЋџгЃзЈЇеґЋгЃж—з”џж­Је‰Їе®ж€їй•·е®гЃзµЊиІЎз›ёгЂЃи—¤дє•е‰Їй•·е®иЈњгЃж–°ећ‹г‚ігѓ­гѓЉг‚¦г‚¤гѓ«г‚№з­‰ж„џжџ“з—‡еЇѕз­–жЋЁйЂІе®¤й•·гЂЃеЋљеЉґзњЃг®ж¬Ўе®гЃеЊ»е‹™жЉЂз›ЈгЂ40е€й«ж©‹е®ж€їе‰Їй•·е®иЈњеЉ г‚Џг‚‹гЂ‚в–Ѕ16ж™2е€еЋљеЉґз›ёгЂЃжќѕй‡ЋгЃжњЁеЋџгЃзЈЇеґЋгЃж—з”џж­Је‰Їе®ж€їй•·е®гЃзµЊиІЎз›ёгЂЃи—¤дє•е‰Їй•·е®иЈњгЃж–°ећ‹г‚ігѓ­гѓЉг‚¦г‚¤гѓ«г‚№з­‰ж„џжџ“з—‡еЇѕз­–жЋЁйЂІе®¤й•·гЂЃеЋљеЉґзњЃг®ж¬Ўе®гЃеЊ»е‹™жЉЂз›ЈгЂ39е€жњЁеЋџе®ж€їе‰Їй•·е®г‚в–Ѕ17ж™1е€е°ѕиє«иЊ‚ж–°ећ‹г‚ігѓ­гѓЉг‚¦г‚¤гѓ«г‚№ж„џжџ“з—‡еЇѕз­–ез§‘дјљй•·гЂЃеІЎйѓЁдїЎеЅ¦е·ќеґЋеё‚еЃҐеє·е®‰е…Ёз ”з©¶ж‰й•·гЂЃе›Ѕз«‹ж„џжџ“з—‡з ”з©¶ж‰гЃ®и„‡з”°йљ­—ж‰Ђй•·гЂЃж–Ћи—¤ж™єд№џж„џжџ“з—‡еЌ±ж©џз®Ўзђ”з©¶г‚»гѓіг‚їгѓјй•·еЉг‚Џг‚‹гЂ41е€жњЁеЋџе‰Їй•·е®г‚в–Ѕ18ж™31е€жњЁеЋџж°Џеєг‚‹г‚В
1/11/2022,20221,2022,1,11,20221,2022-01,2022-Jan,Fumio_Kishida,No,No,No,No,YES!,No,1жњ11ж—Ґ,в–Ѕ8ж™55е€е…¬й‚ёгЃ‹г‚‰е®й‚ёгЂ56е€е ±йЃ“еђ„з¤ѕгЃ®г‚¤гѓіг‚їгѓ“гѓҐгѓјгЂ‚в–Ѕ9ж™17е€е…љжњ¬йѓЁгЂ32е€е…љеЅ№е“Ўдјљг57е€е®й‚ёгЂ‚в–Ѕ10ж™1е€й–Ји­°гЂ15е€жњЁеЋџе®ж€їе‰Їй•·е®гЃз§‹и‘‰е›Ѕе®¶е®‰е…Ёдїќйљње±й•·гЂЃж»ќжІўе†…й–Јжѓ…е±е®гЃеІЎй‡Ће¤–е‹™зњЃз·Џеђ€е¤–дє¤ж”їз­–е±й•·гЂІиЎ›зњЃгЃ®еў—з”°йІиЎ›ж”їз­–е±й•·гЂ€ґжњЁзµ±еђ€е№•ее‰Їй•·гЂ26е€е¤§жЈ®е€©е¤«е…Ёе›Ѕзђ®№з”џжґ»иЎ›з”џеђЊжҐ­зµђ€йЂЈеђ€дјљзђ†дє‹й•·гЂ33е€ж №жњ¬еЊиЎ™ўдє€з®—е§”е“Ўй•·еЉг‚Џг‚‹гЂ40е€зџіз”°зњџж•Џе…·Џе‹™з›ёгЂЃиЎ™ўдє€з®—е§”е“Ўй•·гЂ51е€иЎ™ўдє€з®—е§”е“Ўй•·гЂ‚в–Ѕ11ж™35е€еѕЎеЋЁй‚¦й›ё–з•ЊзЁЋй–ўж©џж§‹пј€пј·јЈјЇј‰дє‹е‹™з·Џе±й•·гЂ‚в–Ѕ12ж™47е€з‰›еі¶дїЎжќ±дє¬еєі¶зњЊдєєдјљдјљй•·гЂ‚в–Ѕ14ж™7е€жёЎиѕєж•ЏеЅ¦е…Ёе›ЅзµЊзђ†ж•™и‚ІеЌ”дјљзђ†дє‹й•·гЂ29е€е±±йљ›зµЊиІЎз›ёгЂЃей–Јеєњг®з”°е’Њж¬Ўе®гЃдє•дёЉей–ЈеєњеЇ©и­°е®гЃжќ‘зЂ¬ж”їз­–зµ±ж‹¬е®г‚в–Ѕ15ж™13е€е›Ѕе®¶е®‰е…Ёдїќйљњдјљи­°гЂ‚в–Ѕ17ж™‚ге›Ѕе®¶е®‰е…Ёдїќйљње±й•·гЂЃей–Јжѓ…е±е®г16е€е†…й–Јжѓ…е±е®г30е€ж–°ећ‹г‚ігѓ­гѓЉг‚¦г‚¤гѓ«г‚№ж„џжџ“з—Ѓ«й–ўгЃ™г‚‹е…Ёе›ЅзџҐдє‹дјљгЃЁе›ЅгЃЁгЃ®ж„Џи¦‹дє¤жЏ›дјљг50е€й‡‘е­ђз·Џе‹™з›ёгЂЃее†…гѓЇг‚ЇгѓЃгѓіз›ёгЂЃжЈ®жЊж–‡иЈњдЅђе®г‚в–Ѕ18ж™10е€жµ…зџійЃ“е¤«ж—Ґжњ¬йџіжҐЅи‘—дЅњжЁ©еЌ”дјљпј€пјЄјЎјіјІјЎјЈј‰зђ†дє‹й•·гЂ47е€жќ±дє¬гѓ»дёёгЃ®е†…г®гѓ‘гѓ¬г‚№гѓ›гѓ†гѓ«жќ±дє¬гЂ‚ж—Ґжњ¬ж–™зђ†еє—гЊе’Њз”°еЂ‰гЌгЃ§е®‰еЌж™‹дё‰е…ѓй¦–з›ёгЃЁдјљйЈџг‚в–Ѕ21ж™18е€е…¬й‚ёгЂ‚В
1/12/2022,20221,2022,1,12,20221,2022-01,2022-Jan,Fumio_Kishida,No,No,No,No,No,No,1жњ12ж—Ґ,в–Ѕ9ж™14е€е…¬й‚ёгЃ‹г‚‰е®й‚ёгЂ15е€з§‹и‘‰е›Ѕе®¶е®‰е…Ёдїќйљње±й•·гЂЃе¤–е‹™зњЃг®жЈ®ж¬Ўе®гЃи€№и¶Љг‚ўг‚ёг‚ўе¤§жґ‹е·ће±й•·гЂ56е€е›Ѕдјљг59е€иЎ™ўгЃ®зґ°з”°гЂЃжµ·ж±џз”°ж­Је‰Їи­°й•·гЂЃеЏ‚й™ўгЃ®е±±жќ±гЂЃе°Џе·ќж­Је‰Їи­°й•·гЃ«зљЅЌз¶™ж‰їгЃ«й–ўгЃ™г‚‹ж¤њиЁЋзµђжћњгЃ®е ±е‘Љг‚жќѕй‡Ће®ж€їй•·е®еђЊеё­гЂ‚в–Ѕ10ж™11е€е®й‚ёгЂ30е€жѕ¤з”°зґ”ж—Ґз±ізµЊжё€еЌ”и­°дјљдјљй•·г‚‰г‚е°Џй‡же¤–е‹™зњЃзµЊжё€е±й•·еђЊеё­гЂ49е€зџідє•е•“дёе…¬жЋе…ље№№дє‹й•·г‚‰гЃ‹г‚‰ж–°ећ‹г‚ігѓ­гѓЉг‚¦г‚¤гѓ«г‚№еЇѕз­–гЃ«й–ўгЃ™г‚‹жЏђиЁж›ёеЏ—г_еЏ–г‚ЉгЂ‚в–Ѕ11ж™10е€еЊ—еІЎдјёдёе›Ѕйљ›еЌ”еЉ›ж©џж§‹пј€пјЄј©јЈјЎј‰зђ†дє‹й•·гЂ29е€жµ…е·ќй›…е—Јг‚ўг‚ёг‚ўй–‹з™єйЉиЎЊз·ЏиЈЃг52е€й«ж©‹иЄдёе…Ёе›ЅиіІёз®Ўзђѓ“г‚ёгѓЌг‚№еЌ”дјљдјљй•·гЂ‚в–Ѕ14ж™32е€гѓ‹гѓҐгѓјг‚№г‚ўгѓ—гѓЄгЃ®гЂЊпј®Ѕ…пЅ—пЅ“пј°Ѕ‰пЅЅ‹пЅ“пј€гѓ‹гѓҐгѓјг‚єгѓ”гѓѓг‚Їг‚№ј‰гЌг®дјЃз”»з”ЁгЃ«гѓЎгѓ‚Јг‚ўг‚ўгѓјгѓ‚Јг‚№гѓ€г®иђЅеђ€й™Ѕдёж°ЏгЃЁеЇѕи«‚в–Ѕ15ж™7е€е ж†ІйѓЋж—Ґжњ¬ж­Їз§‘еЊ»её«дјљдјљй•·гЂ29е€еѕЊи—¤еЋљеЉґз›ёгЂЃее†…гѓЇг‚ЇгѓЃгѓіз›ёгЂ‚в–Ѕ16ж™6е€иЌ’дё­ж—ҐејЈдјљй•·гЂ20е€й€ґжњЁе®—з”·ж—Ґжњ¬з¶­ж–°гЃ®дјљеЏ‚й™ўи­°е“ЎгЂ51е€жё…е·ќи‚‡еІёз”°ж–›„з¦Џдє•еѕЊжЏґдјљдјљй•·г‚‰г‚в–Ѕ18ж™20е€жќ±дє¬гѓ»и™ЋгѓЋй–гЃ®гѓ›гѓ†гѓ«гЂЊпјґЅ€пЅ…гјЇЅ‹пЅ•пЅ’пЅЃгјґЅЏпЅ‹пЅ™пЅЏгЌг‚ж—Ґжњ¬ж–™зђ†еє—гЊе±±й‡ЊгЌгЃ§иЉідє•ж•¬дёе¤§е’ЊгѓЏг‚¦г‚№е·ҐжҐ­з¤ѕй•·гЂЃеҐҐжќ‘жґ‹жІ»гѓ•г‚ёг‚їз¤ѕй•·гЃЁдјљйЈџг‚в–Ѕ20ж™37е€е…¬й‚ёгЂ‚В
